variant,gene_symbol,summary,clinical_importance,evidence,impact,frequency,category,inheritance,zygosity,PMIDs,dbSNP_ID,penetrance_score,build_37_chromosome,build_37_position,build_37_variant_allele,getev_report_url
COL6A3-P3082R,COL6A3,"Reported to cause early-onset dystonia by Zech et al (PMID: 26004199). Seen compound heterozygous with another variant in two affected siblings. Notably, two homozygous ""control"" individuals with South Asian ancestry are reported in ExAC, potentially contradicting the hypothesized effect.",High,Uncertain,Pathogenic,,Nervous system,Recessive,Heterozygous,26004199,,5,,,,http://evidence.pgp-hms.org/genomes?display_genome_id=dc522fe530826b3331281d1823d0fc23ebd3bdb9
STRA6-T321P,STRA6,"Reported to cause syndromic microphthalmia, causing congenital abnormally small eyes and other malformations. This assertion is recorded in ClinVar by OMIM (http://www.ncbi.nlm.nih.gov/clinvar/RCV000001197/) and comes from Pasutto et al 2007 (PMID: 17273977). Pasutto et al studied two consanguineous families and 13 additional cases with European ancestry; this variant was seen homozygously in one of the 13 alongside another missense variant in the same gene. It is unclear which of these two variants (if either) is causal, but the other variant (P90L) appears to be rarer, as it does not appear in ExAC data. In contrast, this variant has an allele frequency of 0.1% in European ancestry (1 in 500 are carriers). ExAC data strongly suggests that this variant, which is more common, is probably a non-causal coincidental observation.",High,Uncertain,Pathogenic,0.00056,Hearing and vision,Recessive,Heterozygous,17273977,,5,chr15,74481585,G,http://evidence.pgp-hms.org/genomes?display_genome_id=dc522fe530826b3331281d1823d0fc23ebd3bdb9
C3-R102G,C3,"This variant (also called C3F) is common in Europeans (10.2% allele frequency), and is associated with age-related macular degeneration. In the US, 1.5% of adults over 40 have the disease, but the incidence increases strongly with age (>15% in women over 80). Assuming an average lifetime risk of ~10%, heterozygous individuals have a ~13% risk and homozygous have ~20%.",Moderate,Likely,Pathogenic,0.15,Hearing and vision,Complex/Other,Heterozygous,4427677;17634448,rs2230199,3,chr19,6718387,C,http://evidence.pgp-hms.org/genomes?display_genome_id=dc522fe530826b3331281d1823d0fc23ebd3bdb9
PRF1-A91V,PRF1,"This variant may be associated with a slightly increased susceptibility to some rare blood disorders, in particular autoimmune proliferative disease, if combined with a more severe mutation elsewhere. Most reports lack statistical significance.",Low,Likely,Pathogenic,0.033,Blood;Immune system,Complex/Other,Heterozygous,16720836;17311987;17475905,rs35947132,1,chr10,72360387,A,http://evidence.pgp-hms.org/genomes?display_genome_id=dc522fe530826b3331281d1823d0fc23ebd3bdb9
MBL2-G54D,MBL2,"This variant is associated with mannose binding protein deficiency which leads to impaired complement system immune response to mannose-rich pathogens. Patients homozygous for this allele or compound heterozygous are likely to have increased susceptibility to infection, but Hellemann et al. report heterosis for intensive care outcomes in heterozygous subjects. The wild-type version of this gene is known as variant allele A, while this is called variant allele B. See R52C (variant D) and G57E (variant C).",Low,Likely,Pathogenic,0.1,Immune system,Recessive,Heterozygous,7564730;10199352;17872904,rs1800450,3,chr10,54531235,T,http://evidence.pgp-hms.org/genomes?display_genome_id=dc522fe530826b3331281d1823d0fc23ebd3bdb9
KRT5-G138E,KRT5,"This variant is associated with 1.25x increased risk of basal cell carcinoma (common skin cancer, rarely malignant).",Low,Likely,Pathogenic,0.052,Cancer;Skin,Unknown,Heterozygous,19578363,rs11170164,3,chr12,52913668,T,http://evidence.pgp-hms.org/genomes?display_genome_id=dc522fe530826b3331281d1823d0fc23ebd3bdb9
WFS1-R611H,WFS1,"This nonsynonymous SNP is associated with Wolfram Syndrome (known as DIDMOAD), which is characterized by early-onset non-autoimmune diabetes mellitus, diabetes insipidus, optic atrophy, and deafness) and to adult Type Two Diabetes Mellitus.  The WFS1 gene maps to chromosome 4p16.3.  The variant has been shown to be statistically associated with type II diabetes in six UK studies and one study of Ashkenazi Jews (Sandhu, M., et al., Minton et al.).",Low,Uncertain,Not Reviewed,0.4,Hearing and vision;Immune system;Metabolism,Recessive,Homozygous,17603484;17719176;23257691,rs734312,1,chr4,6303354,A,http://evidence.pgp-hms.org/genomes?display_genome_id=dc522fe530826b3331281d1823d0fc23ebd3bdb9
H6PD-R453Q,H6PD,"This common variant may have a small pathogenic effect by contributing to cortisone reductase deficiency (a rare abnormality) when homozygous and combined with a serious pathogenic variant. The same authors have tested and ruled out a contribution to polycystic ovary syndrome (similar phenotype, more common disease).",Low,Uncertain,Pathogenic,0.31,Genital and urinary;Metabolism,Recessive,Homozygous,12858176;15827106;16817821,rs6688832,1,chr1,9323910,A,http://evidence.pgp-hms.org/genomes?display_genome_id=dc522fe530826b3331281d1823d0fc23ebd3bdb9
ELAC2-S217L,ELAC2,"Reported to be associated with increased susceptibility to prostate cancer, but later studies weaken the hypothesis. Xu et al.'s meta-analysis concludes that there is a small but significant increased risk (OR = 1.13). Assuming a lifetime risk of 16% for prostate cancer we calculate this leads to an increased risk of ~1.5% (17.5% total).",Low,Uncertain,Pathogenic,0.27,Cancer;Genital and urinary,Complex/Other,Heterozygous,12384782;15368467;18767027;20231859,rs4792311,2,chr17,12915009,A,http://evidence.pgp-hms.org/genomes?display_genome_id=dc522fe530826b3331281d1823d0fc23ebd3bdb9
SP110-L425S,SP110,"This variant is associated with a slightly increased risk of tuberculosis. It is unclear whether it is itself causal, or in linkage disequilibrium with some other causal variant that has a stronger effect.",Low,Uncertain,Pathogenic,0.86,Immune system,Unknown,Homozygous,16803959,rs3948464,1,chr2,231050715,G,http://evidence.pgp-hms.org/genomes?display_genome_id=dc522fe530826b3331281d1823d0fc23ebd3bdb9
ELAC2-A541T,ELAC2,"This variant is implicated as causing increased susceptibility to prostate cancer. However the variant has always been seen paired with S217L, it is unclear which variant is causal. Evidence is weak for both; one meta-analysis (Severi et al.) concluded that neither variant was pathogenic, a more recent meta-analysis (Xu et al.) found the data to be significant but the odds ratio was not strong and concluded they are ""low-penetrance susceptibility markers of prostate cancer"".",Low,Uncertain,Pathogenic,0.028,Cancer;Genital and urinary,Unknown,Heterozygous,10986046;11175785;11431329;12373607;12515253;12783937;18767027;20231859,rs34152967,2,chr17,12899902,T,http://evidence.pgp-hms.org/genomes?display_genome_id=dc522fe530826b3331281d1823d0fc23ebd3bdb9
BRCA2-N372H,BRCA2,"This is a common variant of BRCA2 (HapMap allele frequency of 23%). The variant is weakly associated with an increased chance of breast cancer, and zygosity of the variant is associated with sex of children: male children are more likely to be homozygous for this variant, female children are more likely to be heterozygous.",Low,Uncertain,Pathogenic,0.24,Cancer,Recessive,Heterozygous,11062481;15235023,rs144848,2,chr13,32906729,C,http://evidence.pgp-hms.org/genomes?display_genome_id=dc522fe530826b3331281d1823d0fc23ebd3bdb9
TP53-P72R,TP53,"This is a common variant was first reported as a polymorphism. It has since had mixed associations with cancer: Storey et al. conclude a 7x *increased* risk of HPV cancer for homozygotes vs hets, but Jones et al. find a 1.98x *decreased* risk for colorectal cancer. This variant may have significant impact on particular cancers, but it is unclear what effect it has on the overall burden of cancer.",Low,Uncertain,Pathogenic,0.63,Cancer,Unknown,Homozygous,1975675;9607760;15355915;19837266;20615891;22184967,rs1042522,0,chr17,7579472,C,http://evidence.pgp-hms.org/genomes?display_genome_id=dc522fe530826b3331281d1823d0fc23ebd3bdb9
rs1544410,,"rs1544410 is a Vitamin D Receptor (VDR) single nucleotide polymorphism. It is unlikely that it has functional significance because it is located in an intron (Liu et. al.), but it is in strong linkage disequilibrium with rs731236 (Dvornyk et al), which is located in an exon. ",Low,Uncertain,Pharmacogenetic,0.35,Other,Unknown,Homozygous,,rs1544410,0,,,,http://evidence.pgp-hms.org/genomes?display_genome_id=dc522fe530826b3331281d1823d0fc23ebd3bdb9
PRNP-M129V,PRNP,"This variant is associated with some protective effects for prion disease -- individuals homozygous for this variant are less susceptible to Creutzfeldt-Jakob, and Papua New Guinea individuals heterozygotes at this site are less susceptible to kuru.

",Low,Well-established,Protective,0.34,Other,Complex/Other,Homozygous,18236005;19081515,rs1799990,0,chr20,4680251,G,http://evidence.pgp-hms.org/genomes?display_genome_id=dc522fe530826b3331281d1823d0fc23ebd3bdb9
NPC1-H215R,NPC1,"This variant is associated with a reduced risk of obesity, with an additive effect of -0.084 BMI per allele (an average of 0.54 pounds less, per allele, in a 5'6"" individual).





",Low,Likely,Protective,0.3,Metabolism,Complex/Other,Homozygous,19151714;19174833;19910939,rs1805081,2,chr18,21140432,C,http://evidence.pgp-hms.org/genomes?display_genome_id=dc522fe530826b3331281d1823d0fc23ebd3bdb9
IL7R-T244I,IL7R,"The reference genome variant for this allele has been associated with a slight increased risk of multiple sclerosis. Thus, this variant can be treated as a ""protective"" variant -- carriers of this variant are slightly less likely to have MS. Because the disease is rare and the effect of this variant is not very strong, the absolute decreased risk for carriers of this variant is less than .05% (less than 1 in 2000).",Low,Likely,Protective,0.21,Immune system;Nervous system,Unknown,Homozygous,12825072;17660530;17660816;17660817;21161391,rs6897932,0,chr5,35874575,T,http://evidence.pgp-hms.org/genomes?display_genome_id=dc522fe530826b3331281d1823d0fc23ebd3bdb9
KCNJ11-K23E,KCNJ11,"This variant is associated with decreased risk of type 2 diabetes. It is unclear whether this variant has additive effects, or acts in a dominant or recessive manner. Assuming diabetes has a lifetime risk of 36%, we estimate a decreased risk of around 1-2% per copy of this variant.",Low,Likely,Protective,0.74,Metabolism,Unknown,Homozygous,17463246;17463248;20054294,rs5219,2,chr11,17409572,C,http://evidence.pgp-hms.org/genomes?display_genome_id=dc522fe530826b3331281d1823d0fc23ebd3bdb9
MTR-D919G,MTR,"This variant was weakly associated with a protective effect vs. colorectal cancer, but only in individuals with low alcohol consumption.


",Low,Uncertain,Protective,0.22,Cancer,Complex/Other,Heterozygous,10498402;14744749;17417062;17855192,rs1805087,1,chr1,237048500,G,http://evidence.pgp-hms.org/genomes?display_genome_id=dc522fe530826b3331281d1823d0fc23ebd3bdb9
GJB3-A194T,GJB3,"Reported to cause deafness when combined with a pathogenic mutation in another gene (GJB2). This effect is recorded in ClinVar by OMIM (http://www.ncbi.nlm.nih.gov/clinvar/RCV000006866/) and is reported by Liu et al 2009 (PMID: 19050930) who found this variant heterozygous in one of 108 Chinese patients already carrying a putatively pathogenic a GJB2 variant. However, in ExAC data this variant has an allele frequency of 0.72% in east asian ancestry. Thus, 1 in 70 are expected to carry it heterozygously in this population; matching Liu et al's observation in cases. Due to high allele frequency, and lack of enrichment for the variant cases, the proposed effect should be considered disproven.",Low,Likely,Benign,,Hearing and vision,Unknown,Heterozygous,,,,,,,http://evidence.pgp-hms.org/genomes?display_genome_id=dc522fe530826b3331281d1823d0fc23ebd3bdb9
CACNA1S-L458H,CACNA1S,Common polymorphism,Low,Likely,Benign,0.27,Other,Unknown,Heterozygous,,rs12742169,,chr1,201052310,T,http://evidence.pgp-hms.org/genomes?display_genome_id=dc522fe530826b3331281d1823d0fc23ebd3bdb9
OCA2-R419Q,OCA2,"This variant is associated with eye color, as is OCA2 R305W. Individuals with this variant are reported to be more likely to have green/hazel eyes as opposed to blue/gray eyes. Other variants in this gene are associated with oculocutaneous albinism (albinism which involves skin and eyes).",Low,Likely,Benign,0.057,Hearing and vision;Skin,Unknown,Heterozygous,12163334,rs1800407,,chr15,28230318,T,http://evidence.pgp-hms.org/genomes?display_genome_id=dc522fe530826b3331281d1823d0fc23ebd3bdb9
NEFL-S472Shift,NEFL,"Although a frameshift in this gene would be predicted to cause Charcot-Marie Neuropathy, this particular position appears to reflect a single base insertion error/mutation in the reference genome (in other words, normal individuals are always homozygous for a deletion at this position relative to reference). See chr8:24,811,060-24,811,080 annotations on UCSC.",Low,Likely,Benign,,Nervous system,Unknown,Homozygous,,rs11340767,,,,,http://evidence.pgp-hms.org/genomes?display_genome_id=dc522fe530826b3331281d1823d0fc23ebd3bdb9
JAK3-P151R,JAK3,"Reported in ClinVar to cause Severe Combined Immunodeficiency Disease (aka ""bubble boy disease""). However the variant is carried by nearly 1 in 100 individuals with European ancestry, and 1 in 12,000 are predicted to be homozygous. The disease is extremely rare -- highest estimate is 1 in 50,000 -- the high frequency of this variant means it cannot be a cause of this disease.",Low,Likely,Benign,,Immune system,Unknown,Heterozygous,10982185;17456055,rs55778349,,,,,http://evidence.pgp-hms.org/genomes?display_genome_id=dc522fe530826b3331281d1823d0fc23ebd3bdb9
ERCC6-R1230P,ERCC6,Probably benign.,Low,Uncertain,Benign,0.07,Other,Unknown,Heterozygous,,rs4253211,,chr10,50678317,G,http://evidence.pgp-hms.org/genomes?display_genome_id=dc522fe530826b3331281d1823d0fc23ebd3bdb9
SLC45A2-L374F,SLC45A2,"Pigmentation allele for non-black hair, and consequently, possible increased susceptibility to malignant melanoma.",Low,Uncertain,Benign,0.69,Cancer,Unknown,Homozygous,15714523;17044855;18563784;18806926,rs16891982,,chr5,33951693,G,http://evidence.pgp-hms.org/genomes?display_genome_id=dc522fe530826b3331281d1823d0fc23ebd3bdb9
PTCH1-P1315L,PTCH1,"Common polymorphism, presumed benign.",Low,Uncertain,Benign,0.3,Other,Unknown,Homozygous,15712338,rs357564,,chr9,98209594,A,http://evidence.pgp-hms.org/genomes?display_genome_id=dc522fe530826b3331281d1823d0fc23ebd3bdb9
PCSK9-G670E,PCSK9,This variant is likely benign. ,Low,Uncertain,Benign,0.89,Other,Unknown,Homozygous,19351729,rs505151,,chr1,55529187,A,http://evidence.pgp-hms.org/genomes?display_genome_id=dc522fe530826b3331281d1823d0fc23ebd3bdb9
MAPT-R370W,MAPT,Probably benign.,Low,Uncertain,Benign,0.16,Other,Unknown,Heterozygous,15365985,rs17651549,,chr17,44061278,T,http://evidence.pgp-hms.org/genomes?display_genome_id=dc522fe530826b3331281d1823d0fc23ebd3bdb9
RP1-N985Y,RP1,"Probably benign. One report linked this variant to high triglycerides, but a later paper found a nearby SNP with similar association and suggests that both findings are caused by linkage to an undiscovered causal variant.",Low,Uncertain,Benign,0.35,Metabolism,Unknown,Heterozygous,12764676;19364639,rs2293869,,chr8,55539395,T,http://evidence.pgp-hms.org/genomes?display_genome_id=dc522fe530826b3331281d1823d0fc23ebd3bdb9
APOB-Y1422C,APOB,This position is almost certainly an error in the HG18 reference sequence. ,Low,Uncertain,Benign,1.0,Other,Unknown,Homozygous,,rs568413,,chr2,21235475,C,http://evidence.pgp-hms.org/genomes?display_genome_id=dc522fe530826b3331281d1823d0fc23ebd3bdb9
TPCN2-G734E,TPCN2,Pigmentation allele.,Low,Uncertain,Benign,0.29,Other,Unknown,Homozygous,18488028,rs3829241,,chr11,68855363,A,http://evidence.pgp-hms.org/genomes?display_genome_id=dc522fe530826b3331281d1823d0fc23ebd3bdb9
TAS2R38-A49P,TAS2R38,"This variant is strongly associated with causing the ""taster"" phenotype of phenylthiocarbamine (PTC) in a dominant manner.",Low,Uncertain,Benign,0.43,Other,Unknown,Homozygous,12595690;15883422;20675712,rs713598,,chr7,141673345,G,http://evidence.pgp-hms.org/genomes?display_genome_id=dc522fe530826b3331281d1823d0fc23ebd3bdb9
TAS2R38-I296V,TAS2R38,"This variant is associated with ""taster"" status of PTC, along with 49P and 262A. Due to linkage disequilibrium, the independent effects of positions 296 and 262 is unclear. The presence of 49P confers taster status in a dominant fashion, but in the absence of 49P, the presence of 262A/296V is still positively associated with tasting PTC.",Low,Uncertain,Benign,0.46,Other,Unknown,Homozygous,12595690;20675712,rs10246939,,chr7,141672604,C,http://evidence.pgp-hms.org/genomes?display_genome_id=dc522fe530826b3331281d1823d0fc23ebd3bdb9
TYR-S192Y,TYR,This variant is reported to affect skin pigmentation. It is associated with lighter skin in South Asians (OR 4-5) and with a lack of freckles in Europeans (OR 1.3).,Low,Uncertain,Benign,0.27,Skin,Unknown,Homozygous,17952075;17999355,rs1042602,,chr11,88911696,A,http://evidence.pgp-hms.org/genomes?display_genome_id=dc522fe530826b3331281d1823d0fc23ebd3bdb9
