variant,gene_symbol,summary,clinical_importance,evidence,impact,frequency,category,inheritance,zygosity,PMIDs,dbSNP_ID,penetrance_score,build_37_chromosome,build_37_position,build_37_variant_allele,getev_report_url
SERPINA1-E366K,SERPINA1,"This is also called the ""Pi Z"" or ""Z"" allele. When homozygous (acting in a recessive manner) this variant is the major cause of severe alpha-1-antitrypsin deficiency (95% of cases) which often leads to emphysema or chronic obstructive pulmonary disease (COPD) and liver disease in adults and children. Heterozygosity for this variant may also be associated with increased rate of lung or liver problems, especially when combined with another variant with reduced function (compound heterozygous).",High,Well-established,Pathogenic,0.012,"Breathing;Metabolism;Mouth, liver, and digestive",Recessive,Heterozygous,6976856;10464873;16608528;16827978;18565211,rs28929474,4,chr14,94844947,T,http://evidence.personalgenomes.org/genomes?display_genome_id=6fbdcac33560bbce0472ecbe8d2e02e88cb6e27b&access_token=685333df155e9d64d6536fc884c354d3
WNK4-R1185C,WNK4,"Reported to cause pseudohypoaldosteronism type II in a dominant manner, causing hypertension, hyperkalemia, increased renal salt reabsorption, and impaired K+ and H+ excretion. One family is reported carrying this variant, but this appears to lack statistical significance. Only a handful of families have been reported with this genetic disease, and the variant is extremely rare.",High,Uncertain,Pathogenic,0.00038,Genital and urinary;Heart and circulatory,Dominant,Heterozygous,11498583,,5,chr17,40948262,T,http://evidence.personalgenomes.org/genomes?display_genome_id=6fbdcac33560bbce0472ecbe8d2e02e88cb6e27b&access_token=685333df155e9d64d6536fc884c354d3
COL9A3-R103W,COL9A3,Carriers of this collagen variant are associated with having a significantly increased risk of lumbar disc disease (~11% total risk compared to a typical risk of 4%). ,Moderate,Likely,Pathogenic,0.048,"Muscular, skeletal, and connective tissue",Dominant,Heterozygous,11308397,rs61734651,3,chr20,61451332,T,http://evidence.personalgenomes.org/genomes?display_genome_id=6fbdcac33560bbce0472ecbe8d2e02e88cb6e27b&access_token=685333df155e9d64d6536fc884c354d3
HABP2-G534E,HABP2,"Known as the ""Marburg I"" polymorphism, this variant is associated with increased risk of coronary heart disease (CHD) in individuals with elevated cholesterol, triglyceride, and fibrinogen levels (5-fold risk of a CHD event, compared to 2-fold risk increase in people with the same risk factors but do not have this variant). In individuals without these elevated levels, however, carriers of the variant do not appear to have any increased risk of CHD.",Moderate,Likely,Pathogenic,0.028,Heart and circulatory;Metabolism,Unknown,Heterozygous,15543324;22421107,rs7080536,3,chr10,115348046,A,http://evidence.personalgenomes.org/genomes?display_genome_id=6fbdcac33560bbce0472ecbe8d2e02e88cb6e27b&access_token=685333df155e9d64d6536fc884c354d3
CTRC-R254W,CTRC,"Associated with idiopathic or hereditary chronic pancreatitis. We estimate carriers of this variant have around 0.1% increased risk of chronic pancreatitis (about 3-fold average, but the condition is very rare).",Low,Likely,Pathogenic,0.002,Other,Dominant,Heterozygous,18059268,,1,chr1,15772212,T,http://evidence.personalgenomes.org/genomes?display_genome_id=6fbdcac33560bbce0472ecbe8d2e02e88cb6e27b&access_token=685333df155e9d64d6536fc884c354d3
MTRR-I49M,MTRR,"This common variant (HapMap allele frequency of 31.3%) in a protein involved in folate (B9) and cobalamin (B12) metabolism and is often reported as ""MTRR I22M"" (an alternative transcript position). Mothers homozygous for this variant are associated with having around a increased chance of a child with Down syndrome (risk of 0.4%, average risk in population is 0.25%). Notably, age plays a far larger role in the rate of Down syndrome (risk is 4.5% for a mother 45-years-of-age), and it is unknown how this variant may combine with the effect of age. There are conflicting reports associating this variant with incidence of neural tube defects, possibly when combined with MTHFR A222V.",Low,Likely,Pathogenic,0.45,Anatomical and congenital;Metabolism;Nervous system,Recessive,Homozygous,10444342;10930360;11807890;12375236;15060097;15979034;17024475,rs1801394,1,chr5,7870973,G,http://evidence.personalgenomes.org/genomes?display_genome_id=6fbdcac33560bbce0472ecbe8d2e02e88cb6e27b&access_token=685333df155e9d64d6536fc884c354d3
NOD2-R702W,NOD2,"NOD2 encodes a protein involved in bacterial recognition. This variant is associated with Crohn's disease in European populations, but not in Korean or Japanese groups.",Low,Likely,Pathogenic,0.033,"Mouth, liver, and digestive",Complex/Other,Heterozygous,11875755;12202985;12529700,rs2066844,1,chr16,50745926,T,http://evidence.personalgenomes.org/genomes?display_genome_id=6fbdcac33560bbce0472ecbe8d2e02e88cb6e27b&access_token=685333df155e9d64d6536fc884c354d3
KRT5-G138E,KRT5,"This variant is associated with 1.25x increased risk of basal cell carcinoma (common skin cancer, rarely malignant).",Low,Likely,Pathogenic,0.052,Cancer;Skin,Unknown,Heterozygous,19578363,rs11170164,3,chr12,52913668,T,http://evidence.personalgenomes.org/genomes?display_genome_id=6fbdcac33560bbce0472ecbe8d2e02e88cb6e27b&access_token=685333df155e9d64d6536fc884c354d3
rs5186,,"This common noncoding genetic variant has an allele frequency of ~30% and is associated with an increased risk of hypertension. If ~25% of non-carriers have hypertension, Bonnardeaux et al's data predict ~4% increased risk of hypertension per copy of this variant. This SNP is in the 3' noncoding region of the AGTR1 transcript (angiotensin II type 1 receptor), also known as AT2R1 or AT1R, which is a target of hypertension drugs.",Low,Likely,Pathogenic,0.21,Drug response;Heart and circulatory,Unknown,Homozygous,"8021009;
11250978;11593098;16046653;16675453;17668390",rs5186,2,chr3,148459988,C,http://evidence.personalgenomes.org/genomes?display_genome_id=6fbdcac33560bbce0472ecbe8d2e02e88cb6e27b&access_token=685333df155e9d64d6536fc884c354d3
LRP5-A1330V,LRP5,"In a study of a UK population this variant was associated with a small increased risk of osteoporosis and osteoporotic bone fractures, with each copy of the variant presumed to have an additive effect. A study in Chinese young men failed to find an association with peak bone density.

 
",Low,Uncertain,Pathogenic,0.11,"Muscular, skeletal, and connective tissue",Complex/Other,Heterozygous,18455228;19148563;20953208,rs3736228,2,chr11,68201295,T,http://evidence.personalgenomes.org/genomes?display_genome_id=6fbdcac33560bbce0472ecbe8d2e02e88cb6e27b&access_token=685333df155e9d64d6536fc884c354d3
HFE-H63D,HFE,"There have been some hypotheses that this variant contributes to causing hereditary hemochromatosis, possibly as a compound heterozygote, but some others treat it as a polymorphism. Cys282Tyr is the classic causal variant and itself has very low penetrance. Mouse studies indicates this variant has a similar but weaker effect; if it has any effect at all its penetrance may be quite low and/or require modifier alleles.",Low,Uncertain,Pathogenic,0.11,Blood,Recessive,Heterozygous,8696333;9462220;12429850;14673107;17042772,rs1799945,1,chr6,26091179,G,http://evidence.personalgenomes.org/genomes?display_genome_id=6fbdcac33560bbce0472ecbe8d2e02e88cb6e27b&access_token=685333df155e9d64d6536fc884c354d3
CLEC7A-Y238X,CLEC7A,This variant has been found to impair homan mucosal antifungal defense and was implicated in vulvovaginal candidiasis and mucocutaneous infections in a Dutch family.,Low,Uncertain,Pathogenic,0.063,Genital and urinary;Skin,Recessive,Heterozygous,19864674,rs16910526,4,chr12,10271087,C,http://evidence.personalgenomes.org/genomes?display_genome_id=6fbdcac33560bbce0472ecbe8d2e02e88cb6e27b&access_token=685333df155e9d64d6536fc884c354d3
ERCC6-R1213G,ERCC6,"When homozygous, this variant may cause Cockayne Syndrome, which is a severe autosomal-recessive disorder characterized by abnormal early growth and development, abnormal sensitivity to sunlight, and premature aging. Cockayne Syndrome Type I and Type II lead to death in early childhood. Several other variants in the ERCC6 gene are linked to Cockayne Syndrome. This variant may also be linked to age-related macular degeneration like other ERCC6 variants, and has been linked to colorectal cancer in one study. ",Low,Uncertain,Pathogenic,0.2,Anatomical and congenital;Cancer;Hearing and vision,Recessive,Heterozygous,,rs2228527,0,chr10,50678369,C,http://evidence.personalgenomes.org/genomes?display_genome_id=6fbdcac33560bbce0472ecbe8d2e02e88cb6e27b&access_token=685333df155e9d64d6536fc884c354d3
WFS1-R611H,WFS1,"This nonsynonymous SNP is associated with Wolfram Syndrome (known as DIDMOAD), which is characterized by early-onset non-autoimmune diabetes mellitus, diabetes insipidus, optic atrophy, and deafness) and to adult Type Two Diabetes Mellitus.  The WFS1 gene maps to chromosome 4p16.3.  The variant has been shown to be statistically associated with type II diabetes in six UK studies and one study of Ashkenazi Jews (Sandhu, M., et al., Minton et al.).",Low,Uncertain,Not Reviewed,0.4,Hearing and vision;Immune system;Metabolism,Recessive,Heterozygous,17603484;17719176;23257691,rs734312,1,chr4,6303354,A,http://evidence.personalgenomes.org/genomes?display_genome_id=6fbdcac33560bbce0472ecbe8d2e02e88cb6e27b&access_token=685333df155e9d64d6536fc884c354d3
SP110-L425S,SP110,"This variant is associated with a slightly increased risk of tuberculosis. It is unclear whether it is itself causal, or in linkage disequilibrium with some other causal variant that has a stronger effect.",Low,Uncertain,Pathogenic,0.86,Immune system,Unknown,Heterozygous,16803959,rs3948464,1,chr2,231050715,G,http://evidence.personalgenomes.org/genomes?display_genome_id=6fbdcac33560bbce0472ecbe8d2e02e88cb6e27b&access_token=685333df155e9d64d6536fc884c354d3
TP53-P72R,TP53,"This is a common variant was first reported as a polymorphism. It has since had mixed associations with cancer: Storey et al. conclude a 7x *increased* risk of HPV cancer for homozygotes vs hets, but Jones et al. find a 1.98x *decreased* risk for colorectal cancer. This variant may have significant impact on particular cancers, but it is unclear what effect it has on the overall burden of cancer.",Low,Uncertain,Pathogenic,0.63,Cancer,Unknown,Homozygous,1975675;9607760;15355915;19837266;20615891;22184967,rs1042522,0,chr17,7579472,C,http://evidence.personalgenomes.org/genomes?display_genome_id=6fbdcac33560bbce0472ecbe8d2e02e88cb6e27b&access_token=685333df155e9d64d6536fc884c354d3
CYP2C9-R144C,CYP2C9,"This variant, also called CYP2C9*2, is a pharmacogenetic variant that modulates sensitivity for Warfarin (due to reduced metabolism). This variant is associated with Caucasians. The FDA has approved reduced recommended Warfarin dosage based on the presence of this variant.",Moderate,Well-established,Pharmacogenetic,0.097,Drug response;Metabolism,Unknown,Heterozygous,8004131;15947090;17161452;17686967;19228618;19794411;19794412,rs1799853,3,chr10,96702047,T,http://evidence.personalgenomes.org/genomes?display_genome_id=6fbdcac33560bbce0472ecbe8d2e02e88cb6e27b&access_token=685333df155e9d64d6536fc884c354d3
ABCC6-R1268Q,ABCC6,This common polymorphism appears to not have a significant phenotypic impact. A few studies report weak but significant associations with plasma lipids (in Inuits) and thalidomide toxicity.,Low,Uncertain,Pharmacogenetic,0.22,Metabolism,Unknown,Heterozygous,10811882;10913334;11776382;20038957,rs2238472,1,chr16,16251599,T,http://evidence.personalgenomes.org/genomes?display_genome_id=6fbdcac33560bbce0472ecbe8d2e02e88cb6e27b&access_token=685333df155e9d64d6536fc884c354d3
rs1544410,,"rs1544410 is a Vitamin D Receptor (VDR) single nucleotide polymorphism. It is unlikely that it has functional significance because it is located in an intron (Liu et. al.), but it is in strong linkage disequilibrium with rs731236 (Dvornyk et al), which is located in an exon. ",Low,Uncertain,Pharmacogenetic,0.35,Other,Unknown,Homozygous,,rs1544410,0,,,,http://evidence.personalgenomes.org/genomes?display_genome_id=6fbdcac33560bbce0472ecbe8d2e02e88cb6e27b&access_token=685333df155e9d64d6536fc884c354d3
FUT2-W154X,FUT2,"This recessive protective variant confers resistance to norovirus (which causes stomach flu). 20% of Caucasians and Africans are homozygous for this variant and are ""non-secretors"": they do not express ABO blood type antigens in their saliva or mucosal surfaces. Most strains of norovirus bind to these antigens in the gut, and so this non-secretor status confers almost total resistantance to most types of norovirus. There are notable exceptions, some strains of norovirus bind a different target and are equally infectious for secretors and non-secretors.",Moderate,Well-established,Protective,0.49,Blood;Immune system,Recessive,Homozygous,7876235;12692541;19625485;20031047;22025362,rs601338,5,chr19,49206674,A,http://evidence.personalgenomes.org/genomes?display_genome_id=6fbdcac33560bbce0472ecbe8d2e02e88cb6e27b&access_token=685333df155e9d64d6536fc884c354d3
PRNP-M129V,PRNP,"This variant is associated with some protective effects for prion disease -- individuals homozygous for this variant are less susceptible to Creutzfeldt-Jakob, and Papua New Guinea individuals heterozygotes at this site are less susceptible to kuru.

",Low,Well-established,Protective,0.34,Other,Complex/Other,Heterozygous,18236005;19081515,rs1799990,0,chr20,4680251,G,http://evidence.personalgenomes.org/genomes?display_genome_id=6fbdcac33560bbce0472ecbe8d2e02e88cb6e27b&access_token=685333df155e9d64d6536fc884c354d3
KCNJ11-K23E,KCNJ11,"This variant is associated with decreased risk of type 2 diabetes. It is unclear whether this variant has additive effects, or acts in a dominant or recessive manner. Assuming diabetes has a lifetime risk of 36%, we estimate a decreased risk of around 1-2% per copy of this variant.",Low,Likely,Protective,0.74,Metabolism,Unknown,Homozygous,17463246;17463248;20054294,rs5219,2,chr11,17409572,C,http://evidence.personalgenomes.org/genomes?display_genome_id=6fbdcac33560bbce0472ecbe8d2e02e88cb6e27b&access_token=685333df155e9d64d6536fc884c354d3
MTR-D919G,MTR,"This variant was weakly associated with a protective effect vs. colorectal cancer, but only in individuals with low alcohol consumption.


",Low,Uncertain,Protective,0.22,Cancer,Complex/Other,Heterozygous,10498402;14744749;17417062;17855192,rs1805087,1,chr1,237048500,G,http://evidence.personalgenomes.org/genomes?display_genome_id=6fbdcac33560bbce0472ecbe8d2e02e88cb6e27b&access_token=685333df155e9d64d6536fc884c354d3
TYR-R402Q,TYR,"This is a frequent pigmentation polymorphism in Europeans that affects function of the Tyrosinase gene. It is associated with blue instead of green eyes and sun sensitivity. For the most part this variant is benign, but many individuals with ocular albinism (which affects only the eyes) carry this variant along with another more severe variant in the same gene.",Low,Well-established,Benign,0.2,Hearing and vision,Complex/Other,Heterozygous,1820207;7704033;11284711;18326704;18488027;18488028;19533789,rs1126809,0,chr11,89017961,A,http://evidence.personalgenomes.org/genomes?display_genome_id=6fbdcac33560bbce0472ecbe8d2e02e88cb6e27b&access_token=685333df155e9d64d6536fc884c354d3
CACNA1S-L458H,CACNA1S,Common polymorphism,Low,Likely,Benign,0.27,Other,Unknown,Homozygous,,rs12742169,,chr1,201052310,T,http://evidence.personalgenomes.org/genomes?display_genome_id=6fbdcac33560bbce0472ecbe8d2e02e88cb6e27b&access_token=685333df155e9d64d6536fc884c354d3
PKP2-D26N,PKP2,"Probably benign. This variant has been classified as a rare polymorphism, although other variants in this gene have been implicated in causing autosomal dominant arrhythmogenic right ventricular dysplasia (which can cause sudden death at an early age).",Low,Likely,Benign,0.0049,Heart and circulatory,Unknown,Heterozygous,16567567;20829228,,,chr12,33049590,T,http://evidence.personalgenomes.org/genomes?display_genome_id=6fbdcac33560bbce0472ecbe8d2e02e88cb6e27b&access_token=685333df155e9d64d6536fc884c354d3
PKD1-A4059V,PKD1,Probably benign.,Low,Likely,Benign,0.057,Other,Unknown,Heterozygous,19686598,rs3209986,,chr16,2140554,A,http://evidence.personalgenomes.org/genomes?display_genome_id=6fbdcac33560bbce0472ecbe8d2e02e88cb6e27b&access_token=685333df155e9d64d6536fc884c354d3
NOTCH3-A1020P,NOTCH3,"Probably nonpathogenic. Reported by Scheid et al. as possibly causing CADASIL in a dominant manner, but an immediate follow-up from Quattrone et al. disagreed with this hypothesis, pointing to the presence of the variant in their own controls and the high allele frequency for the variant seen in dbSNP data.",Low,Likely,Benign,0.11,Nervous system,Unknown,Heterozygous,18765654;19528524;22348356,rs35769976,,chr19,15291576,G,http://evidence.personalgenomes.org/genomes?display_genome_id=6fbdcac33560bbce0472ecbe8d2e02e88cb6e27b&access_token=685333df155e9d64d6536fc884c354d3
MLH1-I219V,MLH1,"Computational evidence, functional assays, and case/control studies suggest this variant is probably benign.",Low,Uncertain,Benign,0.24,Other,Dominant,Heterozygous,11781295;12810663;17074586;17510385;17870204;19863800;20301390;22631669,rs1799977,0,chr3,37053568,G,http://evidence.personalgenomes.org/genomes?display_genome_id=6fbdcac33560bbce0472ecbe8d2e02e88cb6e27b&access_token=685333df155e9d64d6536fc884c354d3
TPCN2-G734E,TPCN2,Pigmentation allele.,Low,Uncertain,Benign,0.29,Other,Unknown,Homozygous,18488028,rs3829241,,chr11,68855363,A,http://evidence.personalgenomes.org/genomes?display_genome_id=6fbdcac33560bbce0472ecbe8d2e02e88cb6e27b&access_token=685333df155e9d64d6536fc884c354d3
TXNDC3-I338T,TXNDC3,"Tentatively classified as benign, but predicted to be damaging and other variants in this gene are implicated in causing primary ciliary dyskinesia (situs inversus, chronic sinusitis, and bronchiectasis).",Low,Uncertain,Benign,0.038,Anatomical and congenital;Breathing,Unknown,Heterozygous,,rs62001870,,chr7,37923923,C,http://evidence.personalgenomes.org/genomes?display_genome_id=6fbdcac33560bbce0472ecbe8d2e02e88cb6e27b&access_token=685333df155e9d64d6536fc884c354d3
ENPP1-R774C,ENPP1,"Tentatively classified as benign. Initially reported as a recessive cause of infantile arterial calcification, but with no statistical significance. Other variants have been implicated as causal in these cases this variant. 5% allele frequency in caucasians contradicts this variant as having any highly pathogenic effect.",Low,Uncertain,Benign,0.026,Heart and circulatory,Unknown,Heterozygous,12881724;20137773,rs28933977,0,chr6,132206079,T,http://evidence.personalgenomes.org/genomes?display_genome_id=6fbdcac33560bbce0472ecbe8d2e02e88cb6e27b&access_token=685333df155e9d64d6536fc884c354d3
TYR-S192Y,TYR,This variant is reported to affect skin pigmentation. It is associated with lighter skin in South Asians (OR 4-5) and with a lack of freckles in Europeans (OR 1.3).,Low,Uncertain,Benign,0.27,Skin,Unknown,Heterozygous,17952075;17999355,rs1042602,,chr11,88911696,A,http://evidence.personalgenomes.org/genomes?display_genome_id=6fbdcac33560bbce0472ecbe8d2e02e88cb6e27b&access_token=685333df155e9d64d6536fc884c354d3
PCSK9-G670E,PCSK9,This variant is likely benign. ,Low,Uncertain,Benign,0.89,Other,Unknown,Homozygous,19351729,rs505151,,chr1,55529187,A,http://evidence.personalgenomes.org/genomes?display_genome_id=6fbdcac33560bbce0472ecbe8d2e02e88cb6e27b&access_token=685333df155e9d64d6536fc884c354d3
FMO3-V257M,FMO3,"This common variant (HapMap allele frequency of 9.2%) appears to have no functional effect. OMIM has recorded it as having been seen homozygously in an individual with Trimethylaminuria, but Treacy et al. 1998 conclude it is a polymorphism.",Low,Uncertain,Benign,0.057,Metabolism,Unknown,Heterozygous,9536088,rs1736557,,chr1,171080080,A,http://evidence.personalgenomes.org/genomes?display_genome_id=6fbdcac33560bbce0472ecbe8d2e02e88cb6e27b&access_token=685333df155e9d64d6536fc884c354d3
GUCY2D-A52S,GUCY2D,"One publication suggested that this variant possibly causes Leber's congenital amaurosis in a recessive manner, but the frequency data (36% in 1000 genomes) contradicts any significant pathogenic effect.",Low,Uncertain,Benign,0.21,Hearing and vision,Recessive,Heterozygous,8944027,rs61749665,,chr17,7906519,T,http://evidence.personalgenomes.org/genomes?display_genome_id=6fbdcac33560bbce0472ecbe8d2e02e88cb6e27b&access_token=685333df155e9d64d6536fc884c354d3
FLG-R3530S,FLG,"Tentatively classified as benign, although predicted by Polyphen 2 to be damaging. Other more severe null mutations (frameshift and nonsense) in this gene are reported to cause ichthyosis vulgaris in a recessive manner.",Low,Uncertain,Benign,0.11,Skin,Unknown,Heterozygous,,rs72697000,,chr1,152276772,A,http://evidence.personalgenomes.org/genomes?display_genome_id=6fbdcac33560bbce0472ecbe8d2e02e88cb6e27b&access_token=685333df155e9d64d6536fc884c354d3
APOB-Y1422C,APOB,This position is almost certainly an error in the HG18 reference sequence. ,Low,Uncertain,Benign,1.0,Other,Unknown,Homozygous,,rs568413,,chr2,21235475,C,http://evidence.personalgenomes.org/genomes?display_genome_id=6fbdcac33560bbce0472ecbe8d2e02e88cb6e27b&access_token=685333df155e9d64d6536fc884c354d3
ABCC11-G180R,ABCC11,This variant is associated with dry type ear wax (a benign trait) in a recessive manner.,Low,Uncertain,Benign,0.098,Other,Unknown,Heterozygous,14471313;16444273,rs17822931,,chr16,48258198,T,http://evidence.personalgenomes.org/genomes?display_genome_id=6fbdcac33560bbce0472ecbe8d2e02e88cb6e27b&access_token=685333df155e9d64d6536fc884c354d3
MAPT-R370W,MAPT,Probably benign.,Low,Uncertain,Benign,0.16,Other,Unknown,Heterozygous,15365985,rs17651549,,chr17,44061278,T,http://evidence.personalgenomes.org/genomes?display_genome_id=6fbdcac33560bbce0472ecbe8d2e02e88cb6e27b&access_token=685333df155e9d64d6536fc884c354d3
MUSK-T100M,MUSK,Probably benign.,Low,Uncertain,Benign,0.023,Other,Unknown,Heterozygous,,rs35142681,,chr9,113449489,T,http://evidence.personalgenomes.org/genomes?display_genome_id=6fbdcac33560bbce0472ecbe8d2e02e88cb6e27b&access_token=685333df155e9d64d6536fc884c354d3
TAS2R38-I296V,TAS2R38,"This variant is associated with ""taster"" status of PTC, along with 49P and 262A. Due to linkage disequilibrium, the independent effects of positions 296 and 262 is unclear. The presence of 49P confers taster status in a dominant fashion, but in the absence of 49P, the presence of 262A/296V is still positively associated with tasting PTC.",Low,Uncertain,Benign,0.46,Other,Unknown,Heterozygous,12595690;20675712,rs10246939,,chr7,141672604,C,http://evidence.personalgenomes.org/genomes?display_genome_id=6fbdcac33560bbce0472ecbe8d2e02e88cb6e27b&access_token=685333df155e9d64d6536fc884c354d3
SLC45A2-L374F,SLC45A2,"Pigmentation allele for non-black hair, and consequently, possible increased susceptibility to malignant melanoma.",Low,Uncertain,Benign,0.69,Cancer,Unknown,Homozygous,15714523;17044855;18563784;18806926,rs16891982,,chr5,33951693,G,http://evidence.personalgenomes.org/genomes?display_genome_id=6fbdcac33560bbce0472ecbe8d2e02e88cb6e27b&access_token=685333df155e9d64d6536fc884c354d3
PTCH1-P1315L,PTCH1,"Common polymorphism, presumed benign.",Low,Uncertain,Benign,0.3,Other,Unknown,Heterozygous,15712338,rs357564,,chr9,98209594,A,http://evidence.personalgenomes.org/genomes?display_genome_id=6fbdcac33560bbce0472ecbe8d2e02e88cb6e27b&access_token=685333df155e9d64d6536fc884c354d3
PHYH-P29S,PHYH,"Probably benign. This variant was implicated as causing Refsum Disease in a recessive manner, but a subsequent publication noted that all instances were linked with other explanatory mutations. The high allele frequency of this variant in the population (7-13%) contradicts a pathogenic hypothesis.",Low,Uncertain,Benign,0.16,Nervous system,Unknown,Heterozygous,10767344;14974078,rs28938169,0,chr10,13340236,A,http://evidence.personalgenomes.org/genomes?display_genome_id=6fbdcac33560bbce0472ecbe8d2e02e88cb6e27b&access_token=685333df155e9d64d6536fc884c354d3
TAS2R38-A49P,TAS2R38,"This variant is strongly associated with causing the ""taster"" phenotype of phenylthiocarbamine (PTC) in a dominant manner.",Low,Uncertain,Benign,0.43,Other,Unknown,Heterozygous,12595690;15883422;20675712,rs713598,,chr7,141673345,G,http://evidence.personalgenomes.org/genomes?display_genome_id=6fbdcac33560bbce0472ecbe8d2e02e88cb6e27b&access_token=685333df155e9d64d6536fc884c354d3
