variant,gene_symbol,summary,clinical_importance,evidence,impact,frequency,category,inheritance,zygosity,PMIDs,dbSNP_ID,penetrance_score,build_37_chromosome,build_37_position,build_37_variant_allele,getev_report_url
APOE-C130R,APOE,"This is generally known as the ApoE4 allele of ApoE and is associated with increased risk of Alzheimer's. 20-25% of individuals are heterozygous for this variant, and 1-2% are homozygous. Data from Khachaturian et al. suggests an average 7% of all individuals developed Alzheimer's by the age of 80; when this is split by ApoE4 status: 10% of ApoE4 heterozygotes (3% increased attributable risk), 40% of ApoE4 homozygotes (33% increased attributable risk), and 5% of non-carriers (2% decreased attributable risk). Notably, their model suggests 70-75% of people would eventually develop Alzheimer's by the age of 100 regardless of ApoE4 genotype (and 25-30% are resistant, regardless of genotype), but that ApoE4 variants shift the disease onset to occur significantly earlier (4 years earlier for heterozygous carriers, 13 years for homozygotes).",High,Well-established,Pathogenic,0.14,Mental and behavioral;Nervous system,Complex/Other,Heterozygous,9343467;11950276;15123497;17428983,rs429358,4,chr19,45411941,C,http://evidence.personalgenomes.org/genomes?display_genome_id=5ddfdb0b0f1e7c14ea1a0021d19aa0b8fa13eb5f&access_token=9a72a8cd558ac64c41d530192e255410
RYR2-G1886S,RYR2,"Reported to cause arrhythmogenic right ventricular cardiomyopathy when compound heterozygous with G1885E, although this finding is weakened after correcting for multiple hypotheses and it is unclear what penetrance such a genotype might have, if it is causal.",High,Uncertain,Pathogenic,0.061,"Heart and circulatory;Muscular, skeletal, and connective tissue;Nervous system",Recessive,Heterozygous,16769042;18326664,rs3766871,4,chr1,237778084,A,http://evidence.personalgenomes.org/genomes?display_genome_id=5ddfdb0b0f1e7c14ea1a0021d19aa0b8fa13eb5f&access_token=9a72a8cd558ac64c41d530192e255410
SIAE-M89V,SIAE,"This variant was reported to be associated with autoimmune disease when homozygous. However, a later publication has contradicted this result, finding no significant association between this variant and autoimmune disease in a very large cohort.",Moderate,Uncertain,Pathogenic,0.04,Immune system,Recessive,Heterozygous,20555325;22200769,rs78778622,3,chr11,124530664,C,http://evidence.personalgenomes.org/genomes?display_genome_id=5ddfdb0b0f1e7c14ea1a0021d19aa0b8fa13eb5f&access_token=9a72a8cd558ac64c41d530192e255410
NOD2-R702W,NOD2,"NOD2 encodes a protein involved in bacterial recognition. This variant is associated with Crohn's disease in European populations, but not in Korean or Japanese groups.",Low,Likely,Pathogenic,0.033,"Mouth, liver, and digestive",Complex/Other,Heterozygous,11875755;12202985;12529700,rs2066844,1,chr16,50745926,T,http://evidence.personalgenomes.org/genomes?display_genome_id=5ddfdb0b0f1e7c14ea1a0021d19aa0b8fa13eb5f&access_token=9a72a8cd558ac64c41d530192e255410
MTRR-I49M,MTRR,"This common variant (HapMap allele frequency of 31.3%) in a protein involved in folate (B9) and cobalamin (B12) metabolism and is often reported as ""MTRR I22M"" (an alternative transcript position). Mothers homozygous for this variant are associated with having around a increased chance of a child with Down syndrome (risk of 0.4%, average risk in population is 0.25%). Notably, age plays a far larger role in the rate of Down syndrome (risk is 4.5% for a mother 45-years-of-age), and it is unknown how this variant may combine with the effect of age. There are conflicting reports associating this variant with incidence of neural tube defects, possibly when combined with MTHFR A222V.",Low,Likely,Pathogenic,0.45,Anatomical and congenital;Metabolism;Nervous system,Recessive,Heterozygous,10444342;10930360;11807890;12375236;15060097;15979034;17024475,rs1801394,1,chr5,7870973,G,http://evidence.personalgenomes.org/genomes?display_genome_id=5ddfdb0b0f1e7c14ea1a0021d19aa0b8fa13eb5f&access_token=9a72a8cd558ac64c41d530192e255410
APOA5-S19W,APOA5,"This variant, also known as APOA5*3, is associated with higher plasma triglyceride concentrations but no significant correlation with coronary artery disease itself has been found.",Low,Likely,Pathogenic,0.065,Heart and circulatory;Metabolism,Unknown,Heterozygous,12417524;12417525;16143024;16682041;19802338,rs3135506,2,chr11,116662407,C,http://evidence.personalgenomes.org/genomes?display_genome_id=5ddfdb0b0f1e7c14ea1a0021d19aa0b8fa13eb5f&access_token=9a72a8cd558ac64c41d530192e255410
TNFRSF13B-C104R,TNFRSF13B,"Hypothesized to cause common variable immunodeficiency (CVID) in a dominant manner, but observations lack statistical significance and the frequency of people having this variant (0.8%) is much higher than the prevalence of the disease (0.002%). If this variant is associated with increased risk, carriers of this variant must still have an extremely low chance of developing CVID. Other genetic factors may be necessary.",Low,Uncertain,Pathogenic,0.004,Immune system,Dominant,Heterozygous,16007086;16007087;17492055,rs34557412,1,chr17,16852187,G,http://evidence.personalgenomes.org/genomes?display_genome_id=5ddfdb0b0f1e7c14ea1a0021d19aa0b8fa13eb5f&access_token=9a72a8cd558ac64c41d530192e255410
TGFB1-R25P,TGFB1,"This variant in a growth factor gene is associated with variation in TGFB1 levels; this has been associated with various pathogenic and some protective effects, including: more hepatic fibrosis progression in hep C patients, lower risk of cleft palate, anticorrelation with longevity, higher risk of myocardial infarction and lower risk of hypertension.",Low,Uncertain,Pathogenic,0.049,Anatomical and congenital;Heart and circulatory,Complex/Other,Heterozygous,8901839;14596813;15212689;15569360,rs1800471,2,chr19,41858876,G,http://evidence.personalgenomes.org/genomes?display_genome_id=5ddfdb0b0f1e7c14ea1a0021d19aa0b8fa13eb5f&access_token=9a72a8cd558ac64c41d530192e255410
RNASEL-R462Q,RNASEL,"Associated with increased risk of prostate cancer in individuals who already have a family history of prostate cancer, but studies have been unable to replicate this finding in sporadic (non-familial) prostate cancer cases.",Low,Uncertain,Pathogenic,0.28,Cancer;Genital and urinary,Complex/Other,Homozygous,11941539;12022038;12415269;17407163,rs486907,2,chr1,182554557,T,http://evidence.personalgenomes.org/genomes?display_genome_id=5ddfdb0b0f1e7c14ea1a0021d19aa0b8fa13eb5f&access_token=9a72a8cd558ac64c41d530192e255410
ELAC2-S217L,ELAC2,"Reported to be associated with increased susceptibility to prostate cancer, but later studies weaken the hypothesis. Xu et al.'s meta-analysis concludes that there is a small but significant increased risk (OR = 1.13). Assuming a lifetime risk of 16% for prostate cancer we calculate this leads to an increased risk of ~1.5% (17.5% total).",Low,Uncertain,Pathogenic,0.27,Cancer;Genital and urinary,Complex/Other,Heterozygous,12384782;15368467;18767027;20231859,rs4792311,2,chr17,12915009,A,http://evidence.personalgenomes.org/genomes?display_genome_id=5ddfdb0b0f1e7c14ea1a0021d19aa0b8fa13eb5f&access_token=9a72a8cd558ac64c41d530192e255410
TGIF1-P83Shift,TGIF1,"Severe variants in this gene are associated with holoprosencephaly disorders when combined with loss-of-function variants in SHH. Haploinsufficiency was identified in some families with this condition. It is unclear how likely this variant is to occur in combination with an SHH variant, or what phenotypic effect the variant would have on its own.",Low,Uncertain,Pathogenic,0.14,Nervous system,Complex/Other,Heterozygous,10556296,rs11571510,1,,,,http://evidence.personalgenomes.org/genomes?display_genome_id=5ddfdb0b0f1e7c14ea1a0021d19aa0b8fa13eb5f&access_token=9a72a8cd558ac64c41d530192e255410
TP53-P72R,TP53,"This is a common variant was first reported as a polymorphism. It has since had mixed associations with cancer: Storey et al. conclude a 7x *increased* risk of HPV cancer for homozygotes vs hets, but Jones et al. find a 1.98x *decreased* risk for colorectal cancer. This variant may have significant impact on particular cancers, but it is unclear what effect it has on the overall burden of cancer.",Low,Uncertain,Pathogenic,0.63,Cancer,Unknown,Homozygous,1975675;9607760;15355915;19837266;20615891;22184967,rs1042522,0,chr17,7579472,C,http://evidence.personalgenomes.org/genomes?display_genome_id=5ddfdb0b0f1e7c14ea1a0021d19aa0b8fa13eb5f&access_token=9a72a8cd558ac64c41d530192e255410
BRCA2-N372H,BRCA2,"This is a common variant of BRCA2 (HapMap allele frequency of 23%). The variant is weakly associated with an increased chance of breast cancer, and zygosity of the variant is associated with sex of children: male children are more likely to be homozygous for this variant, female children are more likely to be heterozygous.",Low,Uncertain,Pathogenic,0.24,Cancer,Recessive,Heterozygous,11062481;15235023,rs144848,2,chr13,32906729,C,http://evidence.personalgenomes.org/genomes?display_genome_id=5ddfdb0b0f1e7c14ea1a0021d19aa0b8fa13eb5f&access_token=9a72a8cd558ac64c41d530192e255410
H6PD-R453Q,H6PD,"This common variant may have a small pathogenic effect by contributing to cortisone reductase deficiency (a rare abnormality) when homozygous and combined with a serious pathogenic variant. The same authors have tested and ruled out a contribution to polycystic ovary syndrome (similar phenotype, more common disease).",Low,Uncertain,Pathogenic,0.31,Genital and urinary;Metabolism,Recessive,Heterozygous,12858176;15827106;16817821,rs6688832,1,chr1,9323910,A,http://evidence.personalgenomes.org/genomes?display_genome_id=5ddfdb0b0f1e7c14ea1a0021d19aa0b8fa13eb5f&access_token=9a72a8cd558ac64c41d530192e255410
SP110-L425S,SP110,"This variant is associated with a slightly increased risk of tuberculosis. It is unclear whether it is itself causal, or in linkage disequilibrium with some other causal variant that has a stronger effect.",Low,Uncertain,Pathogenic,0.86,Immune system,Unknown,Homozygous,16803959,rs3948464,1,chr2,231050715,G,http://evidence.personalgenomes.org/genomes?display_genome_id=5ddfdb0b0f1e7c14ea1a0021d19aa0b8fa13eb5f&access_token=9a72a8cd558ac64c41d530192e255410
HFE-H63D,HFE,"There have been some hypotheses that this variant contributes to causing hereditary hemochromatosis, possibly as a compound heterozygote, but some others treat it as a polymorphism. Cys282Tyr is the classic causal variant and itself has very low penetrance. Mouse studies indicates this variant has a similar but weaker effect; if it has any effect at all its penetrance may be quite low and/or require modifier alleles.",Low,Uncertain,Pathogenic,0.11,Blood,Recessive,Heterozygous,8696333;9462220;12429850;14673107;17042772,rs1799945,1,chr6,26091179,G,http://evidence.personalgenomes.org/genomes?display_genome_id=5ddfdb0b0f1e7c14ea1a0021d19aa0b8fa13eb5f&access_token=9a72a8cd558ac64c41d530192e255410
ERCC6-R1213G,ERCC6,"When homozygous, this variant may cause Cockayne Syndrome, which is a severe autosomal-recessive disorder characterized by abnormal early growth and development, abnormal sensitivity to sunlight, and premature aging. Cockayne Syndrome Type I and Type II lead to death in early childhood. Several other variants in the ERCC6 gene are linked to Cockayne Syndrome. This variant may also be linked to age-related macular degeneration like other ERCC6 variants, and has been linked to colorectal cancer in one study. ",Low,Uncertain,Pathogenic,0.2,Anatomical and congenital;Cancer;Hearing and vision,Recessive,Heterozygous,,rs2228527,0,chr10,50678369,C,http://evidence.personalgenomes.org/genomes?display_genome_id=5ddfdb0b0f1e7c14ea1a0021d19aa0b8fa13eb5f&access_token=9a72a8cd558ac64c41d530192e255410
DPYD-M166V,DPYD,Associated with DPYD deficiency and poor prognosis for chemotherapy w/ 5-flurorouracil. ,High,Likely,Pharmacogenetic,0.078,Other,Unknown,Heterozygous,11895907;14635116;19104657,rs2297595,5,chr1,98165091,C,http://evidence.personalgenomes.org/genomes?display_genome_id=5ddfdb0b0f1e7c14ea1a0021d19aa0b8fa13eb5f&access_token=9a72a8cd558ac64c41d530192e255410
CYP2C9-R144C,CYP2C9,"This variant, also called CYP2C9*2, is a pharmacogenetic variant that modulates sensitivity for Warfarin (due to reduced metabolism). This variant is associated with Caucasians. The FDA has approved reduced recommended Warfarin dosage based on the presence of this variant.",Moderate,Well-established,Pharmacogenetic,0.097,Drug response;Metabolism,Unknown,Heterozygous,8004131;15947090;17161452;17686967;19228618;19794411;19794412,rs1799853,3,chr10,96702047,T,http://evidence.personalgenomes.org/genomes?display_genome_id=5ddfdb0b0f1e7c14ea1a0021d19aa0b8fa13eb5f&access_token=9a72a8cd558ac64c41d530192e255410
rs1544410,,"rs1544410 is a Vitamin D Receptor (VDR) single nucleotide polymorphism. It is unlikely that it has functional significance because it is located in an intron (Liu et. al.), but it is in strong linkage disequilibrium with rs731236 (Dvornyk et al), which is located in an exon. ",Low,Uncertain,Pharmacogenetic,0.35,Other,Unknown,Heterozygous,,rs1544410,0,,,,http://evidence.personalgenomes.org/genomes?display_genome_id=5ddfdb0b0f1e7c14ea1a0021d19aa0b8fa13eb5f&access_token=9a72a8cd558ac64c41d530192e255410
FUT2-W154X,FUT2,"This recessive protective variant confers resistance to norovirus (which causes stomach flu). 20% of Caucasians and Africans are homozygous for this variant and are ""non-secretors"": they do not express ABO blood type antigens in their saliva or mucosal surfaces. Most strains of norovirus bind to these antigens in the gut, and so this non-secretor status confers almost total resistantance to most types of norovirus. There are notable exceptions, some strains of norovirus bind a different target and are equally infectious for secretors and non-secretors.",Moderate,Well-established,Protective,0.49,Blood;Immune system,Recessive,Homozygous,7876235;12692541;19625485;20031047;22025362,rs601338,5,chr19,49206674,A,http://evidence.personalgenomes.org/genomes?display_genome_id=5ddfdb0b0f1e7c14ea1a0021d19aa0b8fa13eb5f&access_token=9a72a8cd558ac64c41d530192e255410
CFH-V62I,CFH,"Associated with a decreased risk for age related macular degeneration (ARMD). Homozygotes for this have a 4-5% decreased attributable risk (3-4% vs. average 8% risk), heterozygotes have slightly lower than average risk (7%). Non-carriers have an increased risk (12-13%). ARMD impairs sharp vision as age progresses. While there is no cure, treatment can slow progression of the disease and environmental factors (smoking and obesity) contribute to higher risk.",Low,Likely,Protective,0.39,Hearing and vision;Metabolism,Complex/Other,Heterozygous,15870199,rs800292,2,chr1,196642233,A,http://evidence.personalgenomes.org/genomes?display_genome_id=5ddfdb0b0f1e7c14ea1a0021d19aa0b8fa13eb5f&access_token=9a72a8cd558ac64c41d530192e255410
KCNJ11-K23E,KCNJ11,"This variant is associated with decreased risk of type 2 diabetes. It is unclear whether this variant has additive effects, or acts in a dominant or recessive manner. Assuming diabetes has a lifetime risk of 36%, we estimate a decreased risk of around 1-2% per copy of this variant.",Low,Likely,Protective,0.74,Metabolism,Unknown,Homozygous,17463246;17463248;20054294,rs5219,2,chr11,17409572,C,http://evidence.personalgenomes.org/genomes?display_genome_id=5ddfdb0b0f1e7c14ea1a0021d19aa0b8fa13eb5f&access_token=9a72a8cd558ac64c41d530192e255410
IL7R-T244I,IL7R,"The reference genome variant for this allele has been associated with a slight increased risk of multiple sclerosis. Thus, this variant can be treated as a ""protective"" variant -- carriers of this variant are slightly less likely to have MS. Because the disease is rare and the effect of this variant is not very strong, the absolute decreased risk for carriers of this variant is less than .05% (less than 1 in 2000).",Low,Likely,Protective,0.21,Immune system;Nervous system,Unknown,Heterozygous,12825072;17660530;17660816;17660817;21161391,rs6897932,0,chr5,35874575,T,http://evidence.personalgenomes.org/genomes?display_genome_id=5ddfdb0b0f1e7c14ea1a0021d19aa0b8fa13eb5f&access_token=9a72a8cd558ac64c41d530192e255410
MTR-D919G,MTR,"This variant was weakly associated with a protective effect vs. colorectal cancer, but only in individuals with low alcohol consumption.


",Low,Uncertain,Protective,0.22,Cancer,Complex/Other,Heterozygous,10498402;14744749;17417062;17855192,rs1805087,1,chr1,237048500,G,http://evidence.personalgenomes.org/genomes?display_genome_id=5ddfdb0b0f1e7c14ea1a0021d19aa0b8fa13eb5f&access_token=9a72a8cd558ac64c41d530192e255410
NOTCH3-A1020P,NOTCH3,"Probably nonpathogenic. Reported by Scheid et al. as possibly causing CADASIL in a dominant manner, but an immediate follow-up from Quattrone et al. disagreed with this hypothesis, pointing to the presence of the variant in their own controls and the high allele frequency for the variant seen in dbSNP data.",Low,Likely,Benign,0.11,Nervous system,Unknown,Heterozygous,18765654;19528524;22348356,rs35769976,,chr19,15291576,G,http://evidence.personalgenomes.org/genomes?display_genome_id=5ddfdb0b0f1e7c14ea1a0021d19aa0b8fa13eb5f&access_token=9a72a8cd558ac64c41d530192e255410
PMS2-P470S,PMS2,"Benign, common variant.",Low,Likely,Benign,0.37,Other,Unknown,Heterozygous,15256438,rs1805321,,chr7,6026988,A,http://evidence.personalgenomes.org/genomes?display_genome_id=5ddfdb0b0f1e7c14ea1a0021d19aa0b8fa13eb5f&access_token=9a72a8cd558ac64c41d530192e255410
ALOX12B-P127S,ALOX12B,"This variant was found heterozygously in autosomal recessive congenital ichthyosis in two Turkish siblings, although the second mutation was not found. Later, Lesueur et al. observe that this variant has a 4% frequency in their North African controls and is likely just a rare SNP.",Low,Uncertain,Benign,0.017,Skin,Complex/Other,Heterozygous,16116617;17139268,rs72842957,,chr17,7984479,A,http://evidence.personalgenomes.org/genomes?display_genome_id=5ddfdb0b0f1e7c14ea1a0021d19aa0b8fa13eb5f&access_token=9a72a8cd558ac64c41d530192e255410
TAS2R38-A49P,TAS2R38,"This variant is strongly associated with causing the ""taster"" phenotype of phenylthiocarbamine (PTC) in a dominant manner.",Low,Uncertain,Benign,0.43,Other,Unknown,Heterozygous,12595690;15883422;20675712,rs713598,,chr7,141673345,G,http://evidence.personalgenomes.org/genomes?display_genome_id=5ddfdb0b0f1e7c14ea1a0021d19aa0b8fa13eb5f&access_token=9a72a8cd558ac64c41d530192e255410
AARS-K967M,AARS,Tentatively presumed benign because seen in a healthy PGP participant. A damaging effect to the gene is predicted by Polyphen 2 and other variants are reported to cause Chacot-Marie-Tooth neuropathy in a dominant manner.,Low,Uncertain,Benign,0.011,Nervous system,Unknown,Heterozygous,20045102,rs35744709,,chr16,70286631,A,http://evidence.personalgenomes.org/genomes?display_genome_id=5ddfdb0b0f1e7c14ea1a0021d19aa0b8fa13eb5f&access_token=9a72a8cd558ac64c41d530192e255410
TAS2R38-I296V,TAS2R38,"This variant is associated with ""taster"" status of PTC, along with 49P and 262A. Due to linkage disequilibrium, the independent effects of positions 296 and 262 is unclear. The presence of 49P confers taster status in a dominant fashion, but in the absence of 49P, the presence of 262A/296V is still positively associated with tasting PTC.",Low,Uncertain,Benign,0.46,Other,Unknown,Heterozygous,12595690;20675712,rs10246939,,chr7,141672604,C,http://evidence.personalgenomes.org/genomes?display_genome_id=5ddfdb0b0f1e7c14ea1a0021d19aa0b8fa13eb5f&access_token=9a72a8cd558ac64c41d530192e255410
TYR-S192Y,TYR,This variant is reported to affect skin pigmentation. It is associated with lighter skin in South Asians (OR 4-5) and with a lack of freckles in Europeans (OR 1.3).,Low,Uncertain,Benign,0.27,Skin,Unknown,Heterozygous,17952075;17999355,rs1042602,,chr11,88911696,A,http://evidence.personalgenomes.org/genomes?display_genome_id=5ddfdb0b0f1e7c14ea1a0021d19aa0b8fa13eb5f&access_token=9a72a8cd558ac64c41d530192e255410
TPCN2-G734E,TPCN2,Pigmentation allele.,Low,Uncertain,Benign,0.29,Other,Unknown,Heterozygous,18488028,rs3829241,,chr11,68855363,A,http://evidence.personalgenomes.org/genomes?display_genome_id=5ddfdb0b0f1e7c14ea1a0021d19aa0b8fa13eb5f&access_token=9a72a8cd558ac64c41d530192e255410
PCSK9-G670E,PCSK9,This variant is likely benign. ,Low,Uncertain,Benign,0.89,Other,Unknown,Homozygous,19351729,rs505151,,chr1,55529187,A,http://evidence.personalgenomes.org/genomes?display_genome_id=5ddfdb0b0f1e7c14ea1a0021d19aa0b8fa13eb5f&access_token=9a72a8cd558ac64c41d530192e255410
FANCA-S1088F,FANCA,"Probably benign. One report hypothesized this variant causing Fanconi Anemia, but the allele frequency (3-7%) is high enough to contradict a highly penetrant pathogenic effect. Later authors have concluded this is a polymorphism, not pathogenic.",Low,Uncertain,Benign,0.058,Blood,Unknown,Heterozygous,10094191;14695169,rs17233497,0,chr16,89815152,A,http://evidence.personalgenomes.org/genomes?display_genome_id=5ddfdb0b0f1e7c14ea1a0021d19aa0b8fa13eb5f&access_token=9a72a8cd558ac64c41d530192e255410
CD19-R514H,CD19,Presumed benign.,Low,Uncertain,Benign,0.048,Other,Unknown,Heterozygous,,rs34763945,,chr16,28950051,A,http://evidence.personalgenomes.org/genomes?display_genome_id=5ddfdb0b0f1e7c14ea1a0021d19aa0b8fa13eb5f&access_token=9a72a8cd558ac64c41d530192e255410
APOB-Y1422C,APOB,This position is almost certainly an error in the HG18 reference sequence. ,Low,Uncertain,Benign,1.0,Other,Unknown,Homozygous,,rs568413,,chr2,21235475,C,http://evidence.personalgenomes.org/genomes?display_genome_id=5ddfdb0b0f1e7c14ea1a0021d19aa0b8fa13eb5f&access_token=9a72a8cd558ac64c41d530192e255410
PHYH-P29S,PHYH,"Probably benign. This variant was implicated as causing Refsum Disease in a recessive manner, but a subsequent publication noted that all instances were linked with other explanatory mutations. The high allele frequency of this variant in the population (7-13%) contradicts a pathogenic hypothesis.",Low,Uncertain,Benign,0.16,Nervous system,Unknown,Heterozygous,10767344;14974078,rs28938169,0,chr10,13340236,A,http://evidence.personalgenomes.org/genomes?display_genome_id=5ddfdb0b0f1e7c14ea1a0021d19aa0b8fa13eb5f&access_token=9a72a8cd558ac64c41d530192e255410
PKP2-L366P,PKP2,This variant is a benign polymorphism.  ,Low,Uncertain,Benign,0.22,Other,Unknown,Heterozygous,19955750,rs1046116,,chr12,33021934,G,http://evidence.personalgenomes.org/genomes?display_genome_id=5ddfdb0b0f1e7c14ea1a0021d19aa0b8fa13eb5f&access_token=9a72a8cd558ac64c41d530192e255410
ABCA4-R943Q,ABCA4,"This is a polymorphism in a gene associated with Stargardt disease. Although it has a slight detectable effect in functional study, it is common in control groups and is not believed to have any significant pathogenic effect.",Low,Uncertain,Benign,0.032,Hearing and vision,Unknown,Heterozygous,9295268;11919200,rs1801581,,chr1,94512565,T,http://evidence.personalgenomes.org/genomes?display_genome_id=5ddfdb0b0f1e7c14ea1a0021d19aa0b8fa13eb5f&access_token=9a72a8cd558ac64c41d530192e255410
ABCC11-G180R,ABCC11,This variant is associated with dry type ear wax (a benign trait) in a recessive manner.,Low,Uncertain,Benign,0.098,Other,Unknown,Heterozygous,14471313;16444273,rs17822931,,chr16,48258198,T,http://evidence.personalgenomes.org/genomes?display_genome_id=5ddfdb0b0f1e7c14ea1a0021d19aa0b8fa13eb5f&access_token=9a72a8cd558ac64c41d530192e255410
RP1-N985Y,RP1,"Probably benign. One report linked this variant to high triglycerides, but a later paper found a nearby SNP with similar association and suggests that both findings are caused by linkage to an undiscovered causal variant.",Low,Uncertain,Benign,0.35,Metabolism,Unknown,Heterozygous,12764676;19364639,rs2293869,,chr8,55539395,T,http://evidence.personalgenomes.org/genomes?display_genome_id=5ddfdb0b0f1e7c14ea1a0021d19aa0b8fa13eb5f&access_token=9a72a8cd558ac64c41d530192e255410
SLC45A2-L374F,SLC45A2,"Pigmentation allele for non-black hair, and consequently, possible increased susceptibility to malignant melanoma.",Low,Uncertain,Benign,0.69,Cancer,Unknown,Homozygous,15714523;17044855;18563784;18806926,rs16891982,,chr5,33951693,G,http://evidence.personalgenomes.org/genomes?display_genome_id=5ddfdb0b0f1e7c14ea1a0021d19aa0b8fa13eb5f&access_token=9a72a8cd558ac64c41d530192e255410
