variant,gene_symbol,summary,clinical_importance,evidence,impact,frequency,category,inheritance,zygosity,PMIDs,dbSNP_ID,penetrance_score,build_37_chromosome,build_37_position,build_37_variant_allele
UGT1A1-G71R,UGT1A1,"This variant, also known as UGT1A1*6, is associated with Gilbert syndrome (found in ~5% of the population) and transient hyperbilirubinemia in infants in east asian populations. This allele appears to have incomplete penetrance and causes reduced enzyme activity.",Moderate,Likely,Pathogenic,0.00074,"Mouth, liver, and digestive",Complex/Other,Heterozygous,9929972;18004206,rs4148323,3,chr2,234669144,A
VWF-R854Q,VWF,Causes type 2N von Willebrand disease in a recessive manner. This defect in coagulation can manifest as excessive bleeding during surgery.,Moderate,Likely,Pathogenic,0.0041,Other,Recessive,Heterozygous,22875612,rs41276738,5,chr12,6143978,T
NOD2-R702W,NOD2,"NOD2 encodes a protein involved in bacterial recognition. This variant is associated with Crohn's disease in European populations, but not in Korean or Japanese groups.",Low,Likely,Pathogenic,0.033,"Mouth, liver, and digestive",Complex/Other,Homozygous,11875755;12202985;12529700,rs2066844,1,chr16,50745926,T
PRF1-A91V,PRF1,"This variant may be associated with a slightly increased susceptibility to some rare blood disorders, in particular autoimmune proliferative disease, if combined with a more severe mutation elsewhere. Most reports lack statistical significance.",Low,Likely,Pathogenic,0.033,Blood;Immune system,Complex/Other,Heterozygous,16720836;17311987;17475905,rs35947132,1,chr10,72360387,A
WFS1-R611H,WFS1,"This nonsynonymous SNP is associated with Wolfram Syndrome (known as DIDMOAD), which is characterized by early-onset non-autoimmune diabetes mellitus, diabetes insipidus, optic atrophy, and deafness) and to adult Type Two Diabetes Mellitus.  The WFS1 gene maps to chromosome 4p16.3.  The variant has been shown to be statistically associated with type II diabetes in six UK studies and one study of Ashkenazi Jews (Sandhu, M., et al., Minton et al.).",Low,Uncertain,Not Reviewed,0.4,Hearing and vision;Immune system;Metabolism,Recessive,Homozygous,17603484;17719176;23257691,rs734312,1,chr4,6303354,A
LRP5-A1330V,LRP5,"In a study of a UK population this variant was associated with a small increased risk of osteoporosis and osteoporotic bone fractures, with each copy of the variant presumed to have an additive effect. A study in Chinese young men failed to find an association with peak bone density.

 
",Low,Uncertain,Pathogenic,0.11,"Muscular, skeletal, and connective tissue",Complex/Other,Heterozygous,18455228;19148563;20953208,rs3736228,2,chr11,68201295,T
ELAC2-S217L,ELAC2,"Reported to be associated with increased susceptibility to prostate cancer, but later studies weaken the hypothesis. Xu et al.'s meta-analysis concludes that there is a small but significant increased risk (OR = 1.13). Assuming a lifetime risk of 16% for prostate cancer we calculate this leads to an increased risk of ~1.5% (17.5% total).",Low,Uncertain,Pathogenic,0.27,Cancer;Genital and urinary,Complex/Other,Heterozygous,12384782;15368467;18767027;20231859,rs4792311,2,chr17,12915009,A
RNASEL-R462Q,RNASEL,"Associated with increased risk of prostate cancer in individuals who already have a family history of prostate cancer, but studies have been unable to replicate this finding in sporadic (non-familial) prostate cancer cases.",Low,Uncertain,Pathogenic,0.28,Cancer;Genital and urinary,Complex/Other,Homozygous,11941539;12022038;12415269;17407163,rs486907,2,chr1,182554557,T
TP53-P72R,TP53,"This is a common variant was first reported as a polymorphism. It has since had mixed associations with cancer: Storey et al. conclude a 7x *increased* risk of HPV cancer for homozygotes vs hets, but Jones et al. find a 1.98x *decreased* risk for colorectal cancer. This variant may have significant impact on particular cancers, but it is unclear what effect it has on the overall burden of cancer.",Low,Uncertain,Pathogenic,0.63,Cancer,Unknown,Heterozygous,1975675;9607760;15355915;19837266;20615891;22184967,rs1042522,0,chr17,7579472,C
HFE-H63D,HFE,"There have been some hypotheses that this variant contributes to causing hereditary hemochromatosis, possibly as a compound heterozygote, but some others treat it as a polymorphism. Cys282Tyr is the classic causal variant and itself has very low penetrance. Mouse studies indicates this variant has a similar but weaker effect; if it has any effect at all its penetrance may be quite low and/or require modifier alleles.",Low,Uncertain,Pathogenic,0.11,Blood,Recessive,Heterozygous,8696333;9462220;12429850;14673107;17042772,rs1799945,1,chr6,26091179,G
SP110-L425S,SP110,"This variant is associated with a slightly increased risk of tuberculosis. It is unclear whether it is itself causal, or in linkage disequilibrium with some other causal variant that has a stronger effect.",Low,Uncertain,Pathogenic,0.86,Immune system,Unknown,Homozygous,16803959,rs3948464,1,chr2,231050715,G
ERCC6-R1213G,ERCC6,"When homozygous, this variant may cause Cockayne Syndrome, which is a severe autosomal-recessive disorder characterized by abnormal early growth and development, abnormal sensitivity to sunlight, and premature aging. Cockayne Syndrome Type I and Type II lead to death in early childhood. Several other variants in the ERCC6 gene are linked to Cockayne Syndrome. This variant may also be linked to age-related macular degeneration like other ERCC6 variants, and has been linked to colorectal cancer in one study. ",Low,Uncertain,Pathogenic,0.2,Anatomical and congenital;Cancer;Hearing and vision,Recessive,Heterozygous,,rs2228527,0,chr10,50678369,C
CYP2C9-R144C,CYP2C9,"This variant, also called CYP2C9*2, is a pharmacogenetic variant that modulates sensitivity for Warfarin (due to reduced metabolism). This variant is associated with Caucasians. The FDA has approved reduced recommended Warfarin dosage based on the presence of this variant.",Moderate,Well-established,Pharmacogenetic,0.097,Drug response;Metabolism,Unknown,Heterozygous,8004131;15947090;17161452;17686967;19228618;19794411;19794412,rs1799853,3,chr10,96702047,T
TPMT-Y240C,TPMT,"Alone, this variant is known as TPMT*3C -- but often, especially in Caucasians, it is found together with another nonsynonymous variant (A154T) to produce the TPMT*3A variant. Both variants are associated with loss of thiopurine methyltransferase (TPMT) activity, although *3C is milder than *3A. Inability to metabolize thiopurine drugs can lead to severe adverse reactions. Heterozygotes may be advised to take a reduced dosage due to reduced metabolism of the drug.",Low,Well-established,Pharmacogenetic,0.046,Drug response;Metabolism,Complex/Other,Heterozygous,15228163;15298741;20154640;20354201,rs1142345,2,chr6,18130918,C
TPMT-A154T,TPMT,"Usually this variant is found in combination Y240C, forming the TPMT*3A variant. When alone, this variant produces the *3B variant. Both variants are associated with loss of thiopurine methyltransferase (TPMT) activity. Inability to metabolize thiopurine drugs can lead to severe adverse reactions. Heterozygotes may be advised to take a reduced dosage due to reduced metabolism of the drug.",Low,Likely,Pharmacogenetic,0.028,Drug response;Metabolism,Recessive,Heterozygous,15228163;15298741;20154640;20354201,rs1800460,2,chr6,18139228,T
FUT2-W154X,FUT2,"This recessive protective variant confers resistance to norovirus (which causes stomach flu). 20% of Caucasians and Africans are homozygous for this variant and are ""non-secretors"": they do not express ABO blood type antigens in their saliva or mucosal surfaces. Most strains of norovirus bind to these antigens in the gut, and so this non-secretor status confers almost total resistantance to most types of norovirus. There are notable exceptions, some strains of norovirus bind a different target and are equally infectious for secretors and non-secretors.",Moderate,Well-established,Protective,0.49,Blood;Immune system,Recessive,Heterozygous,7876235;12692541;19625485;20031047;22025362,rs601338,5,chr19,49206674,A
PRNP-M129V,PRNP,"This variant is associated with some protective effects for prion disease -- individuals homozygous for this variant are less susceptible to Creutzfeldt-Jakob, and Papua New Guinea individuals heterozygotes at this site are less susceptible to kuru.

",Low,Well-established,Protective,0.34,Other,Complex/Other,Homozygous,18236005;19081515,rs1799990,0,chr20,4680251,G
CFH-V62I,CFH,"Associated with a decreased risk for age related macular degeneration (ARMD). Homozygotes for this have a 4-5% decreased attributable risk (3-4% vs. average 8% risk), heterozygotes have slightly lower than average risk (7%). Non-carriers have an increased risk (12-13%). ARMD impairs sharp vision as age progresses. While there is no cure, treatment can slow progression of the disease and environmental factors (smoking and obesity) contribute to higher risk.",Low,Likely,Protective,0.39,Hearing and vision;Metabolism,Complex/Other,Heterozygous,15870199,rs800292,2,chr1,196642233,A
NPC1-H215R,NPC1,"This variant is associated with a reduced risk of obesity, with an additive effect of -0.084 BMI per allele (an average of 0.54 pounds less, per allele, in a 5'6"" individual).





",Low,Likely,Protective,0.3,Metabolism,Complex/Other,Heterozygous,19151714;19174833;19910939,rs1805081,2,chr18,21140432,C
TOR1A-D216H,TOR1A,This SNP has been shown to be benign and play a protective role against Dystonia.  ,Low,Likely,Protective,0.1,Nervous system,Unknown,Heterozygous,18519876;19380705;20669276,rs1801968,1,chr9,132580901,G
IL7R-T244I,IL7R,"The reference genome variant for this allele has been associated with a slight increased risk of multiple sclerosis. Thus, this variant can be treated as a ""protective"" variant -- carriers of this variant are slightly less likely to have MS. Because the disease is rare and the effect of this variant is not very strong, the absolute decreased risk for carriers of this variant is less than .05% (less than 1 in 2000).",Low,Likely,Protective,0.21,Immune system;Nervous system,Unknown,Heterozygous,12825072;17660530;17660816;17660817;21161391,rs6897932,0,chr5,35874575,T
KCNJ11-K23E,KCNJ11,"This variant is associated with decreased risk of type 2 diabetes. It is unclear whether this variant has additive effects, or acts in a dominant or recessive manner. Assuming diabetes has a lifetime risk of 36%, we estimate a decreased risk of around 1-2% per copy of this variant.",Low,Likely,Protective,0.74,Metabolism,Unknown,Heterozygous,17463246;17463248;20054294,rs5219,2,chr11,17409572,C
MTR-D919G,MTR,"This variant was weakly associated with a protective effect vs. colorectal cancer, but only in individuals with low alcohol consumption.


",Low,Uncertain,Protective,0.22,Cancer,Complex/Other,Homozygous,10498402;14744749;17417062;17855192,rs1805087,1,chr1,237048500,G
TYR-R402Q,TYR,"This is a frequent pigmentation polymorphism in Europeans that affects function of the Tyrosinase gene. It is associated with blue instead of green eyes and sun sensitivity. For the most part this variant is benign, but many individuals with ocular albinism (which affects only the eyes) carry this variant along with another more severe variant in the same gene.",Low,Well-established,Benign,0.2,Hearing and vision,Complex/Other,Heterozygous,1820207;7704033;11284711;18326704;18488027;18488028;19533789,rs1126809,0,chr11,89017961,A
GABRD-R220H,GABRD,"Probably benign, one report hypothesized this variant was associated with epilepsy, but a follow-up investigation failed to establish any statistically significant difference for this variant's incidence in control vs. affected populations.",Low,Likely,Benign,0.016,Nervous system,Unknown,Heterozygous,15115768;16023832,rs41307846,,chr1,1959699,A
PMS2-P470S,PMS2,"Benign, common variant.",Low,Likely,Benign,0.37,Other,Unknown,Homozygous,15256438,rs1805321,,chr7,6026988,A
GAA-E689K,GAA,This is also known as the GAA*4 allozyme is frequent in the Asian population and appears to have somewhat reduced enzyme activity. Kroos et al. rule out pathogenic effect.,Low,Uncertain,Benign,0.03,Other,Complex/Other,Heterozygous,18301443,rs1800309,,chr17,78087041,A
APOB-Y1422C,APOB,This position is almost certainly an error in the HG18 reference sequence. ,Low,Uncertain,Benign,1.0,Other,Unknown,Homozygous,,rs568413,,chr2,21235475,C
F5-D2222G,F5,"Other mutations in this gene are associated with Factor 5 deficiency. There is no literature implicating this variant, however, and it is fairly common in the population (3.8% in HapMap), and so it is currently labeled as benign.",Low,Uncertain,Benign,0.045,Blood,Unknown,Heterozygous,,rs6027,,chr1,169483561,C
ABCC11-G180R,ABCC11,This variant is associated with dry type ear wax (a benign trait) in a recessive manner.,Low,Uncertain,Benign,0.098,Other,Unknown,Heterozygous,14471313;16444273,rs17822931,,chr16,48258198,T
DNAH5-P4488T,DNAH5,Probably benign.,Low,Uncertain,Benign,0.047,Other,Unknown,Heterozygous,,rs113425437,,chr5,13701422,T
RPGRIP1L-A1183G,RPGRIP1L,"Probably not pathogenic, although it may have a modifier effect in other diseases. Other disruptive variants in this gene are implicated in causing Joubert Syndrome and Meckel Syndrome in a recessive manner. Although this variant is somewhat rare (1.1% allele frequency) and Polyphen 2 predicts it to be disruptive, most reported disease-causing variants in the gene are more disruptive frameshift or nonsense mutations & occur upstream of this position.",Low,Uncertain,Benign,0.011,Anatomical and congenital;Mental and behavioral;Nervous system,Unknown,Heterozygous,19430481,,,chr16,53653005,C
ERCC6-R1230P,ERCC6,Probably benign.,Low,Uncertain,Benign,0.07,Other,Unknown,Heterozygous,,rs4253211,,chr10,50678317,G
F5-M413T,F5,Presumed benign. This variant is not particularly rare and has not been reported to cause disease.,Low,Uncertain,Benign,0.058,Other,Unknown,Heterozygous,17284699,rs6033,,chr1,169521853,G
FLG-R3530S,FLG,"Tentatively classified as benign, although predicted by Polyphen 2 to be damaging. Other more severe null mutations (frameshift and nonsense) in this gene are reported to cause ichthyosis vulgaris in a recessive manner.",Low,Uncertain,Benign,0.11,Skin,Unknown,Heterozygous,,rs72697000,,chr1,152276772,A
TPCN2-G734E,TPCN2,Pigmentation allele.,Low,Uncertain,Benign,0.29,Other,Unknown,Heterozygous,18488028,rs3829241,,chr11,68855363,A
PTCH1-P1315L,PTCH1,"Common polymorphism, presumed benign.",Low,Uncertain,Benign,0.3,Other,Unknown,Heterozygous,15712338,rs357564,,chr9,98209594,A
TYR-S192Y,TYR,This variant is reported to affect skin pigmentation. It is associated with lighter skin in South Asians (OR 4-5) and with a lack of freckles in Europeans (OR 1.3).,Low,Uncertain,Benign,0.27,Skin,Unknown,Heterozygous,17952075;17999355,rs1042602,,chr11,88911696,A
PCSK9-G670E,PCSK9,This variant is likely benign. ,Low,Uncertain,Benign,0.89,Other,Unknown,Homozygous,19351729,rs505151,,chr1,55529187,A
GUCY2D-A52S,GUCY2D,"One publication suggested that this variant possibly causes Leber's congenital amaurosis in a recessive manner, but the frequency data (36% in 1000 genomes) contradicts any significant pathogenic effect.",Low,Uncertain,Benign,0.21,Hearing and vision,Recessive,Heterozygous,8944027,rs61749665,,chr17,7906519,T
RAPSN-R58C,RAPSN,Reported as non-pathogenic polymorphism. ,Low,Uncertain,Benign,0.078,Other,Unknown,Heterozygous,11791205,rs34312154,,chr11,47470345,A
