variant,gene_symbol,summary,clinical_importance,evidence,impact,frequency,category,inheritance,zygosity,PMIDs,dbSNP_ID,penetrance_score,build_37_chromosome,build_37_position,build_37_variant_allele
COL9A3-R103W,COL9A3,Carriers of this collagen variant are associated with having a significantly increased risk of lumbar disc disease (~11% total risk compared to a typical risk of 4%). ,Moderate,Likely,Pathogenic,0.048,"Muscular, skeletal, and connective tissue",Dominant,Heterozygous,11308397,rs61734651,3,chr20,61451332,T
C3-R102G,C3,"This variant (also called C3F) is common in Europeans (10.2% allele frequency), and is associated with age-related macular degeneration. In the US, 1.5% of adults over 40 have the disease, but the incidence increases strongly with age (>15% in women over 80). Assuming an average lifetime risk of ~10%, heterozygous individuals have a ~13% risk and homozygous have ~20%.",Moderate,Likely,Pathogenic,0.15,Hearing and vision,Complex/Other,Heterozygous,4427677;17634448,rs2230199,3,chr19,6718387,C
APC-E1317Q,APC,"This rare variant has been hypothesized to increase risk of colon cancer. Later studies have contradicted this, finding no significant enrichment and concluding the variant does not increase risk.",Moderate,Uncertain,Pathogenic,0.0088,Cancer,Dominant,Heterozygous,11001924;14578138;17119068,rs1801166,3,chr5,112175240,C
MBL2-G54D,MBL2,"This variant is associated with mannose binding protein deficiency which leads to impaired complement system immune response to mannose-rich pathogens. Patients homozygous for this allele or compound heterozygous are likely to have increased susceptibility to infection, but Hellemann et al. report heterosis for intensive care outcomes in heterozygous subjects. The wild-type version of this gene is known as variant allele A, while this is called variant allele B. See R52C (variant D) and G57E (variant C).",Low,Likely,Pathogenic,0.1,Immune system,Recessive,Homozygous,7564730;10199352;17872904,rs1800450,3,chr10,54531235,T
COL4A1-Q1334H,COL4A1,"This common variant has been associated with arterial stiffness and, in Japanese, a small increased risk of myocardial infarction (MI, a.k.a. heart attack). This last observation supported a dominant effect for this variant and, assuming a lifetime risk of 15% for MI, we estimate carriers have an additional risk of 0.5-3%.",Low,Likely,Pathogenic,0.32,Heart and circulatory,Dominant,Heterozygous,10334796;18077766;20031579,rs3742207,2,chr13,110818598,G
PIGR-A580V,PIGR,"In a Japanese study, this variant was associated with an increased risk for immunoglobulin A nephropathy (IgAN), a rare disease. The chances of having this disease, even with this variant, is less than 0.1%.",Low,Likely,Pathogenic,0.25,Genital and urinary;Immune system,Complex/Other,Heterozygous,12740691,rs291102,0,chr1,207106478,A
NOD2-G908R,NOD2,"This variant is associated with an increased susceptibility to Crohn's disease and other inflammatory bowel diseases (IBD). Assuming an overall prevalence of 0.5% for IBD, this variant implies an increased attributable risk of 2% (5x increased risk, for an overall risk of 2.5% of IBD for people with this variant).",Low,Likely,Pathogenic,0.011,"Mouth, liver, and digestive",Unknown,Heterozygous,11385576;12019468,,2,chr16,50756540,C
rs5186,,"This common noncoding genetic variant has an allele frequency of ~30% and is associated with an increased risk of hypertension. If ~25% of non-carriers have hypertension, Bonnardeaux et al's data predict ~4% increased risk of hypertension per copy of this variant. This SNP is in the 3' noncoding region of the AGTR1 transcript (angiotensin II type 1 receptor), also known as AT2R1 or AT1R, which is a target of hypertension drugs.",Low,Likely,Pathogenic,0.21,Drug response;Heart and circulatory,Unknown,Heterozygous,"8021009;
11250978;11593098;16046653;16675453;17668390",rs5186,2,chr3,148459988,C
WFS1-R611H,WFS1,"This nonsynonymous SNP is associated with Wolfram Syndrome (known as DIDMOAD), which is characterized by early-onset non-autoimmune diabetes mellitus, diabetes insipidus, optic atrophy, and deafness) and to adult Type Two Diabetes Mellitus.  The WFS1 gene maps to chromosome 4p16.3.  The variant has been shown to be statistically associated with type II diabetes in six UK studies and one study of Ashkenazi Jews (Sandhu, M., et al., Minton et al.).",Low,Uncertain,Not Reviewed,0.4,Hearing and vision;Immune system;Metabolism,Recessive,Homozygous,17603484;17719176;23257691,rs734312,1,chr4,6303354,A
TGFB1-R25P,TGFB1,"This variant in a growth factor gene is associated with variation in TGFB1 levels; this has been associated with various pathogenic and some protective effects, including: more hepatic fibrosis progression in hep C patients, lower risk of cleft palate, anticorrelation with longevity, higher risk of myocardial infarction and lower risk of hypertension.",Low,Uncertain,Pathogenic,0.049,Anatomical and congenital;Heart and circulatory,Complex/Other,Heterozygous,8901839;14596813;15212689;15569360,rs1800471,2,chr19,41858876,G
ELAC2-S217L,ELAC2,"Reported to be associated with increased susceptibility to prostate cancer, but later studies weaken the hypothesis. Xu et al.'s meta-analysis concludes that there is a small but significant increased risk (OR = 1.13). Assuming a lifetime risk of 16% for prostate cancer we calculate this leads to an increased risk of ~1.5% (17.5% total).",Low,Uncertain,Pathogenic,0.27,Cancer;Genital and urinary,Complex/Other,Heterozygous,12384782;15368467;18767027;20231859,rs4792311,2,chr17,12915009,A
RNASEL-R462Q,RNASEL,"Associated with increased risk of prostate cancer in individuals who already have a family history of prostate cancer, but studies have been unable to replicate this finding in sporadic (non-familial) prostate cancer cases.",Low,Uncertain,Pathogenic,0.28,Cancer;Genital and urinary,Complex/Other,Heterozygous,11941539;12022038;12415269;17407163,rs486907,2,chr1,182554557,T
SP110-L425S,SP110,"This variant is associated with a slightly increased risk of tuberculosis. It is unclear whether it is itself causal, or in linkage disequilibrium with some other causal variant that has a stronger effect.",Low,Uncertain,Pathogenic,0.86,Immune system,Unknown,Homozygous,16803959,rs3948464,1,chr2,231050715,G
TP53-P72R,TP53,"This is a common variant was first reported as a polymorphism. It has since had mixed associations with cancer: Storey et al. conclude a 7x *increased* risk of HPV cancer for homozygotes vs hets, but Jones et al. find a 1.98x *decreased* risk for colorectal cancer. This variant may have significant impact on particular cancers, but it is unclear what effect it has on the overall burden of cancer.",Low,Uncertain,Pathogenic,0.63,Cancer,Unknown,Homozygous,1975675;9607760;15355915;19837266;20615891;22184967,rs1042522,0,chr17,7579472,C
FUT2-W154X,FUT2,"This recessive protective variant confers resistance to norovirus (which causes stomach flu). 20% of Caucasians and Africans are homozygous for this variant and are ""non-secretors"": they do not express ABO blood type antigens in their saliva or mucosal surfaces. Most strains of norovirus bind to these antigens in the gut, and so this non-secretor status confers almost total resistantance to most types of norovirus. There are notable exceptions, some strains of norovirus bind a different target and are equally infectious for secretors and non-secretors.",Moderate,Well-established,Protective,0.49,Blood;Immune system,Recessive,Homozygous,7876235;12692541;19625485;20031047;22025362,rs601338,5,chr19,49206674,A
NPC1-H215R,NPC1,"This variant is associated with a reduced risk of obesity, with an additive effect of -0.084 BMI per allele (an average of 0.54 pounds less, per allele, in a 5'6"" individual).





",Low,Likely,Protective,0.3,Metabolism,Complex/Other,Heterozygous,19151714;19174833;19910939,rs1805081,2,chr18,21140432,C
IL7R-T244I,IL7R,"The reference genome variant for this allele has been associated with a slight increased risk of multiple sclerosis. Thus, this variant can be treated as a ""protective"" variant -- carriers of this variant are slightly less likely to have MS. Because the disease is rare and the effect of this variant is not very strong, the absolute decreased risk for carriers of this variant is less than .05% (less than 1 in 2000).",Low,Likely,Protective,0.21,Immune system;Nervous system,Unknown,Heterozygous,12825072;17660530;17660816;17660817;21161391,rs6897932,0,chr5,35874575,T
KCNJ11-K23E,KCNJ11,"This variant is associated with decreased risk of type 2 diabetes. It is unclear whether this variant has additive effects, or acts in a dominant or recessive manner. Assuming diabetes has a lifetime risk of 36%, we estimate a decreased risk of around 1-2% per copy of this variant.",Low,Likely,Protective,0.74,Metabolism,Unknown,Heterozygous,17463246;17463248;20054294,rs5219,2,chr11,17409572,C
MTR-D919G,MTR,"This variant was weakly associated with a protective effect vs. colorectal cancer, but only in individuals with low alcohol consumption.


",Low,Uncertain,Protective,0.22,Cancer,Complex/Other,Homozygous,10498402;14744749;17417062;17855192,rs1805087,1,chr1,237048500,G
CACNA1S-L458H,CACNA1S,Common polymorphism,Low,Likely,Benign,0.27,Other,Unknown,Homozygous,,rs12742169,,chr1,201052310,T
PMS2-P470S,PMS2,"Benign, common variant.",Low,Likely,Benign,0.37,Other,Unknown,Heterozygous,15256438,rs1805321,,chr7,6026988,A
PKD1-A4059V,PKD1,Probably benign.,Low,Likely,Benign,0.057,Other,Unknown,Heterozygous,19686598,rs3209986,,chr16,2140554,A
MLH1-I219V,MLH1,"Computational evidence, functional assays, and case/control studies suggest this variant is probably benign.",Low,Uncertain,Benign,0.24,Other,Dominant,Homozygous,11781295;12810663;17074586;17510385;17870204;19863800;20301390;22631669,rs1799977,0,chr3,37053568,G
TPCN2-G734E,TPCN2,Pigmentation allele.,Low,Uncertain,Benign,0.29,Other,Unknown,Homozygous,18488028,rs3829241,,chr11,68855363,A
TXNDC3-I338T,TXNDC3,"Tentatively classified as benign, but predicted to be damaging and other variants in this gene are implicated in causing primary ciliary dyskinesia (situs inversus, chronic sinusitis, and bronchiectasis).",Low,Uncertain,Benign,0.038,Anatomical and congenital;Breathing,Unknown,Heterozygous,,rs62001870,,chr7,37923923,C
TYR-S192Y,TYR,This variant is reported to affect skin pigmentation. It is associated with lighter skin in South Asians (OR 4-5) and with a lack of freckles in Europeans (OR 1.3).,Low,Uncertain,Benign,0.27,Skin,Unknown,Heterozygous,17952075;17999355,rs1042602,,chr11,88911696,A
ERCC6-R1230P,ERCC6,Probably benign.,Low,Uncertain,Benign,0.07,Other,Unknown,Heterozygous,,rs4253211,,chr10,50678317,G
PTCH1-P1315L,PTCH1,"Common polymorphism, presumed benign.",Low,Uncertain,Benign,0.3,Other,Unknown,Homozygous,15712338,rs357564,,chr9,98209594,A
APOB-Y1422C,APOB,This position is almost certainly an error in the HG18 reference sequence. ,Low,Uncertain,Benign,1.0,Other,Unknown,Homozygous,,rs568413,,chr2,21235475,C
PHYH-P29S,PHYH,"Probably benign. This variant was implicated as causing Refsum Disease in a recessive manner, but a subsequent publication noted that all instances were linked with other explanatory mutations. The high allele frequency of this variant in the population (7-13%) contradicts a pathogenic hypothesis.",Low,Uncertain,Benign,0.16,Nervous system,Unknown,Heterozygous,10767344;14974078,rs28938169,0,chr10,13340236,A
PCSK9-G670E,PCSK9,This variant is likely benign. ,Low,Uncertain,Benign,0.89,Other,Unknown,Homozygous,19351729,rs505151,,chr1,55529187,A
FMO3-V257M,FMO3,"This common variant (HapMap allele frequency of 9.2%) appears to have no functional effect. OMIM has recorded it as having been seen homozygously in an individual with Trimethylaminuria, but Treacy et al. 1998 conclude it is a polymorphism.",Low,Uncertain,Benign,0.057,Metabolism,Unknown,Heterozygous,9536088,rs1736557,,chr1,171080080,A
RP1-N985Y,RP1,"Probably benign. One report linked this variant to high triglycerides, but a later paper found a nearby SNP with similar association and suggests that both findings are caused by linkage to an undiscovered causal variant.",Low,Uncertain,Benign,0.35,Metabolism,Unknown,Heterozygous,12764676;19364639,rs2293869,,chr8,55539395,T
TAS2R38-I296V,TAS2R38,"This variant is associated with ""taster"" status of PTC, along with 49P and 262A. Due to linkage disequilibrium, the independent effects of positions 296 and 262 is unclear. The presence of 49P confers taster status in a dominant fashion, but in the absence of 49P, the presence of 262A/296V is still positively associated with tasting PTC.",Low,Uncertain,Benign,0.46,Other,Unknown,Heterozygous,12595690;20675712,rs10246939,,chr7,141672604,C
SLC45A2-L374F,SLC45A2,"Pigmentation allele for non-black hair, and consequently, possible increased susceptibility to malignant melanoma.",Low,Uncertain,Benign,0.69,Cancer,Unknown,Homozygous,15714523;17044855;18563784;18806926,rs16891982,,chr5,33951693,G
TAS2R38-A49P,TAS2R38,"This variant is strongly associated with causing the ""taster"" phenotype of phenylthiocarbamine (PTC) in a dominant manner.",Low,Uncertain,Benign,0.43,Other,Unknown,Heterozygous,12595690;15883422;20675712,rs713598,,chr7,141673345,G
