variant,gene_symbol,summary,clinical_importance,evidence,impact,frequency,category,inheritance,zygosity,PMIDs,dbSNP_ID,penetrance_score,build_37_chromosome,build_37_position,build_37_variant_allele
CFH-Q950H,CFH,"This rare variant was found heterozygously (presumed acting in a dominant manner) in a single sporadic case of atypical hemolytic-uremic syndrome — a potentially lethal medical emergency, usually occurring in childhood. Although predicted to be disruptive, observations of the variant lack statistical significance.",High,Uncertain,Pathogenic,0.0044,Blood;Genital and urinary,Dominant,Heterozygous,14583443,,4,chr1,196709816,T
RP1-T373I,RP1,"Reported to cause recessive retinitis pigmentosa in some Pakistani families. Because it is unclear whether these families have some common ancestry, and because there may be an uncharacterized linked variant, this pathogenic effect of this variant is considered uncertain.",High,Uncertain,Pathogenic,0.012,Hearing and vision,Recessive,Heterozygous,11095597;15863674,rs77775126,5,chr8,55537560,T
PEX1-I696M,PEX1,"Reported as a mutation causing peroxisome biogenesis disorder in a single patient, presumably in a recessive manner.",High,Uncertain,Pathogenic,0.027,Metabolism,Recessive,Heterozygous,11389485,rs35996821,5,chr7,92132493,C
FLG-S761Shift,FLG,"Based on other severe variants in the same gene, this variant is likely to cause ichthyosis vulgaris when homozygous or compound heterozygous with another severe variant. Some authors report the variant has incomplete dominance, with heterozygotes generally having a very mild phenotype: some palmar hyperlinearity, keratosis pilaris and, in some cases fine scale.",Moderate,Uncertain,Pathogenic,0.0079,Skin,Complex/Other,Heterozygous,16444271,,5,,,
SLC4A1-E40K,SLC4A1,"Rare and reported to cause hemolytic anemia in a recessive manner, although insufficient data is published to establish statistical significance. Polyphen 2 predicts a benign effect.",Moderate,Uncertain,Pathogenic,0.012,Blood,Recessive,Heterozygous,8471774,rs45562031,5,chr17,42338993,T
TGM1-Y312Shift,TGM1,"No known reports, but predicted to be highly disruptive and cause congenital ichthyosis in a recessive manner.",Moderate,Uncertain,Pathogenic,0.0078,Skin,Recessive,Heterozygous,,,5,,,
BTD-D444H,BTD,"This variant is implicated in partial and profound biotinidase deficiency. Alone, this variant is estimated to have a 52% loss of enzymatic activity. This variant is often found with A171T, and together they are reported to cause profound deficiency. Notably there is a report of asymptomatic double-mutant adults, so symptoms may have variable penetrance. This variant is found compound heterozygously with more serious mutations in cases of partial biotinidase deficiency.",Low,Well-established,Pathogenic,0.03,Metabolism,Recessive,Heterozygous,88555;2109151;9375914;9654207;10206677;18704161,rs13078881,1,chr3,15686693,C
COL4A1-Q1334H,COL4A1,"This common variant has been associated with arterial stiffness and, in Japanese, a small increased risk of myocardial infarction (MI, a.k.a. heart attack). This last observation supported a dominant effect for this variant and, assuming a lifetime risk of 15% for MI, we estimate carriers have an additional risk of 0.5-3%.",Low,Likely,Pathogenic,0.32,Heart and circulatory,Dominant,Homozygous,10334796;18077766;20031579,rs3742207,2,chr13,110818598,G
rs5186,,"This common noncoding genetic variant has an allele frequency of ~30% and is associated with an increased risk of hypertension. If ~25% of non-carriers have hypertension, Bonnardeaux et al's data predict ~4% increased risk of hypertension per copy of this variant. This SNP is in the 3' noncoding region of the AGTR1 transcript (angiotensin II type 1 receptor), also known as AT2R1 or AT1R, which is a target of hypertension drugs.",Low,Likely,Pathogenic,0.21,Drug response;Heart and circulatory,Unknown,Heterozygous,"8021009;
11250978;11593098;16046653;16675453;17668390",rs5186,2,chr3,148459988,C
CETP-A390P,CETP,"This variant is associated with slightly lower HDL (good) cholesterol, although it has a negligible effect (around 2 mg/dl).",Low,Likely,Pathogenic,0.039,Metabolism,Unknown,Heterozygous,17952847,rs5880,1,chr16,57015091,C
AMPD1-Q12X,AMPD1,"Causes Adenosine Deaminase Deficiency in a recessive manner. Most of the time individuals do not report symptoms, but when symptoms do exist they to be post-exercise symptoms of muscle weakness, muscle pain, and getting tired more quickly.",Low,Likely,Pathogenic,0.093,"Metabolism;Muscular, skeletal, and connective tissue",Recessive,Heterozygous,1631143,rs17602729,4,chr1,115236057,A
RNASEL-R462Q,RNASEL,"Associated with increased risk of prostate cancer in individuals who already have a family history of prostate cancer, but studies have been unable to replicate this finding in sporadic (non-familial) prostate cancer cases.",Low,Uncertain,Pathogenic,0.28,Cancer;Genital and urinary,Complex/Other,Heterozygous,11941539;12022038;12415269;17407163,rs486907,2,chr1,182554557,T
ELAC2-S217L,ELAC2,"Reported to be associated with increased susceptibility to prostate cancer, but later studies weaken the hypothesis. Xu et al.'s meta-analysis concludes that there is a small but significant increased risk (OR = 1.13). Assuming a lifetime risk of 16% for prostate cancer we calculate this leads to an increased risk of ~1.5% (17.5% total).",Low,Uncertain,Pathogenic,0.27,Cancer;Genital and urinary,Complex/Other,Heterozygous,12384782;15368467;18767027;20231859,rs4792311,2,chr17,12915009,A
TP53-P72R,TP53,"This is a common variant was first reported as a polymorphism. It has since had mixed associations with cancer: Storey et al. conclude a 7x *increased* risk of HPV cancer for homozygotes vs hets, but Jones et al. find a 1.98x *decreased* risk for colorectal cancer. This variant may have significant impact on particular cancers, but it is unclear what effect it has on the overall burden of cancer.",Low,Uncertain,Pathogenic,0.63,Cancer,Unknown,Homozygous,1975675;9607760;15355915;19837266;20615891;22184967,rs1042522,0,chr17,7579472,C
H6PD-R453Q,H6PD,"This common variant may have a small pathogenic effect by contributing to cortisone reductase deficiency (a rare abnormality) when homozygous and combined with a serious pathogenic variant. The same authors have tested and ruled out a contribution to polycystic ovary syndrome (similar phenotype, more common disease).",Low,Uncertain,Pathogenic,0.31,Genital and urinary;Metabolism,Recessive,Heterozygous,12858176;15827106;16817821,rs6688832,1,chr1,9323910,A
ERCC6-R1213G,ERCC6,"When homozygous, this variant may cause Cockayne Syndrome, which is a severe autosomal-recessive disorder characterized by abnormal early growth and development, abnormal sensitivity to sunlight, and premature aging. Cockayne Syndrome Type I and Type II lead to death in early childhood. Several other variants in the ERCC6 gene are linked to Cockayne Syndrome. This variant may also be linked to age-related macular degeneration like other ERCC6 variants, and has been linked to colorectal cancer in one study. ",Low,Uncertain,Pathogenic,0.2,Anatomical and congenital;Cancer;Hearing and vision,Recessive,Heterozygous,,rs2228527,0,chr10,50678369,C
SP110-L425S,SP110,"This variant is associated with a slightly increased risk of tuberculosis. It is unclear whether it is itself causal, or in linkage disequilibrium with some other causal variant that has a stronger effect.",Low,Uncertain,Pathogenic,0.86,Immune system,Unknown,Homozygous,16803959,rs3948464,1,chr2,231050715,G
CYP2C9-R144C,CYP2C9,"This variant, also called CYP2C9*2, is a pharmacogenetic variant that modulates sensitivity for Warfarin (due to reduced metabolism). This variant is associated with Caucasians. The FDA has approved reduced recommended Warfarin dosage based on the presence of this variant.",Moderate,Well-established,Pharmacogenetic,0.097,Drug response;Metabolism,Unknown,Heterozygous,8004131;15947090;17161452;17686967;19228618;19794411;19794412,rs1799853,3,chr10,96702047,T
TPMT-Y240C,TPMT,"Alone, this variant is known as TPMT*3C -- but often, especially in Caucasians, it is found together with another nonsynonymous variant (A154T) to produce the TPMT*3A variant. Both variants are associated with loss of thiopurine methyltransferase (TPMT) activity, although *3C is milder than *3A. Inability to metabolize thiopurine drugs can lead to severe adverse reactions. Heterozygotes may be advised to take a reduced dosage due to reduced metabolism of the drug.",Low,Well-established,Pharmacogenetic,0.046,Drug response;Metabolism,Complex/Other,Heterozygous,15228163;15298741;20154640;20354201,rs1142345,2,chr6,18130918,C
TPMT-A154T,TPMT,"Usually this variant is found in combination Y240C, forming the TPMT*3A variant. When alone, this variant produces the *3B variant. Both variants are associated with loss of thiopurine methyltransferase (TPMT) activity. Inability to metabolize thiopurine drugs can lead to severe adverse reactions. Heterozygotes may be advised to take a reduced dosage due to reduced metabolism of the drug.",Low,Likely,Pharmacogenetic,0.028,Drug response;Metabolism,Recessive,Heterozygous,15228163;15298741;20154640;20354201,rs1800460,2,chr6,18139228,T
rs1544410,,"rs1544410 is a Vitamin D Receptor (VDR) single nucleotide polymorphism. It is unlikely that it has functional significance because it is located in an intron (Liu et. al.), but it is in strong linkage disequilibrium with rs731236 (Dvornyk et al), which is located in an exon. ",Low,Uncertain,Pharmacogenetic,0.35,Other,Unknown,Heterozygous,,rs1544410,0,,,
NPC1-H215R,NPC1,"This variant is associated with a reduced risk of obesity, with an additive effect of -0.084 BMI per allele (an average of 0.54 pounds less, per allele, in a 5'6"" individual).





",Low,Likely,Protective,0.3,Metabolism,Complex/Other,Heterozygous,19151714;19174833;19910939,rs1805081,2,chr18,21140432,C
DTNBP1-P272S,DTNBP1,Possibly a slight protective effect against colorectal cancer if homozygous.,Low,Uncertain,Protective,0.035,Cancer,Recessive,Heterozygous,17000706,rs17470454,2,chr6,15523448,A
LPL-S474X,LPL,"This variant actually increases LPL enzyme activity despite creating a termination codon (see Rip J et al). It appears to be a protective variant, associated with lower triglyceride levels--although the effect is quite weak and explains only 0.5-1% of triglyceride variation.",Low,Uncertain,Protective,0.084,Metabolism,Unknown,Heterozygous,16574898;17463246;18193044;19802338;20429872;22042884,rs328,,chr8,19819724,G
COL6A3-D2831H,COL6A3,"Probably benign, reported by Pan et al. as a presumed-nonpathogenic variant in the gene.",Low,Likely,Benign,0.068,Other,Unknown,Heterozygous,9536084;15563506,rs36104025,,chr2,238247734,G
ADA-K80R,ADA,"This variant has a 3.5% allele frequency in 1000 genomes data. Although OMIM links this to disease, the paper they reference uses in vitro data to conclude that this is a functionally neutral polymorphism.",Low,Likely,Benign,0.064,Other,Recessive,Heterozygous,6198631;17181544,rs11555566,,chr20,43255220,C
PKHD1-I3905N,PKHD1,"Presumed benign, allele frequency contradicts severe pathogenic effect.",Low,Likely,Benign,0.049,Other,Unknown,Heterozygous,,rs2661488,,chr6,51491866,T
CACNA1S-L458H,CACNA1S,Common polymorphism,Low,Likely,Benign,0.27,Other,Unknown,Heterozygous,,rs12742169,,chr1,201052310,T
PKHD1-V3960I,PKHD1,"Probably benign, reported as a nonpathogenic polymorphism found in controls.",Low,Likely,Benign,0.013,Other,Unknown,Heterozygous,15698423,rs34548196,,chr6,51484226,T
KEL-T193M,KEL,This variant is also known as Kell or K1 or K (capitalized) in the Kell antigen system. K1-negative mothers (carrying no copies of this variant) carrying K1-positive fetuses (heterozygous or homozygous) are at risk for hemolytic disease of the newborn. About 9% of caucasians carry one or two copies of K1.,Low,Uncertain,Benign,0.032,Blood,Dominant,Heterozygous,7849312,rs8176058,,chr7,142655008,A
MLH1-I219V,MLH1,"Computational evidence, functional assays, and case/control studies suggest this variant is probably benign.",Low,Uncertain,Benign,0.24,Other,Dominant,Heterozygous,11781295;12810663;17074586;17510385;17870204;19863800;20301390;22631669,rs1799977,0,chr3,37053568,G
RPGRIP1-A547S,RPGRIP1,"Probably benign. Implicated in causing autosomal recessive cone-rod dystrophy, but a later report found the same incidence in controls and concludes it is not causal.",Low,Uncertain,Benign,0.23,Hearing and vision,Complex/Other,Heterozygous,12920076;16272259,rs10151259,,chr14,21790040,T
ELN-G581R,ELN,"Probably a benign SNP, not rare (4.8% allele frequency in GET-Evidence data).",Low,Uncertain,Benign,0.073,Other,Unknown,Heterozygous,,rs17855988,,chr7,73474825,C
BRCA1-Q356R,BRCA1,"One common variant associated this variant with an increased risk of breast cancer, but a more recent, larger study found no association.",Low,Uncertain,Benign,0.046,Cancer,Unknown,Homozygous,17341484;19661094,rs1799950,,chr17,41246481,C
EDAR-V370A,EDAR,"Associated with thicker hair, common in Chinese and Japanese individuals and thought to be Asian-specific.",Low,Uncertain,Benign,0.011,Other,Unknown,Heterozygous,18065779;18561327;18704500;19804850,rs3827760,,chr2,109513601,G
RELN-G1280E,RELN,Probably benign.,Low,Uncertain,Benign,0.011,Other,Unknown,Heterozygous,14515139,rs55689103,,chr7,103234202,T
APOB-Y1422C,APOB,This position is almost certainly an error in the HG18 reference sequence. ,Low,Uncertain,Benign,1.0,Other,Unknown,Homozygous,,rs568413,,chr2,21235475,C
AMPD1-P48L,AMPD1,"Probably benign, ancestral to15173240 pathogenic Q12X mutation.",Low,Uncertain,Benign,0.094,Other,Unknown,Heterozygous,15173240,rs61752479,,chr1,115231254,A
NDRG1-H41R,NDRG1,"Tentatively classified as benign, although predicted by Polyphen 2 to be damaging. Other more severe null mutations (frameshift and nonsense) in this gene are reported to cause Charcot-Marie-Tooth disease type 4 in a recessive manner.",Low,Uncertain,Benign,0.00074,Nervous system,Unknown,Heterozygous,,rs2233318,,chr8,134276873,C
VWF-G2705R,VWF,"Probably benign, seems to be considered an uncommon polymorphism.",Low,Uncertain,Benign,0.046,Other,Unknown,Heterozygous,11439975,rs7962217,,chr12,6061559,T
F5-D2222G,F5,"Other mutations in this gene are associated with Factor 5 deficiency. There is no literature implicating this variant, however, and it is fairly common in the population (3.8% in HapMap), and so it is currently labeled as benign.",Low,Uncertain,Benign,0.045,Blood,Unknown,Heterozygous,,rs6027,,chr1,169483561,C
ATM-V2079I,ATM,Probably benign.,Low,Uncertain,Benign,0.0064,Other,Unknown,Heterozygous,8665503,rs1800060,,chr11,108188136,A
GALT-N314D,GALT,"This variant has an allele frequency of ~8% and is ancestral to ""Duarte"" / ""Duarte 2"" and ""Duarte 1""/""Los Angeles"" galactosemia variants. This variant is evolutionarily ancestral, and in vitro studies fail to support an impact of this variant on enzyme activity. Carney et al. instead implicate a 4 base deletion on the 5' of the GALT gene as being causal and linked to this variant. Galactosemia is typically screened and detected in infants and causes early, severe but nonspecific symptoms (digestive problems, lethargy, failure to thrive).",Low,Uncertain,Benign,0.072,"Mouth, liver, and digestive",Unknown,Heterozygous,10408771;11261429;19224951,rs2070074,,chr9,34649442,G
NTRK1-H604Y,NTRK1,"Various databases and papers treat this variant as a non-pathogenic polymorphism, although it is fairly uncommon and is computational methods predict it to be damaging.",Low,Uncertain,Benign,0.043,Other,Unknown,Heterozygous,10443680;16412461;21228398,rs6336,,chr1,156848918,T
SLC45A2-L374F,SLC45A2,"Pigmentation allele for non-black hair, and consequently, possible increased susceptibility to malignant melanoma.",Low,Uncertain,Benign,0.69,Cancer,Unknown,Homozygous,15714523;17044855;18563784;18806926,rs16891982,,chr5,33951693,G
NTRK1-G613V,NTRK1,"Also called G607V, this variant has been reported as a nonpathogenic polymorphism.",Low,Uncertain,Benign,0.043,Other,Unknown,Heterozygous,10330344;10443680;11159935,rs6339,,chr1,156848946,T
PTCH1-P1315L,PTCH1,"Common polymorphism, presumed benign.",Low,Uncertain,Benign,0.3,Other,Unknown,Heterozygous,15712338,rs357564,,chr9,98209594,A
TAS2R38-I296V,TAS2R38,"This variant is associated with ""taster"" status of PTC, along with 49P and 262A. Due to linkage disequilibrium, the independent effects of positions 296 and 262 is unclear. The presence of 49P confers taster status in a dominant fashion, but in the absence of 49P, the presence of 262A/296V is still positively associated with tasting PTC.",Low,Uncertain,Benign,0.46,Other,Unknown,Heterozygous,12595690;20675712,rs10246939,,chr7,141672604,C
TAS2R38-A49P,TAS2R38,"This variant is strongly associated with causing the ""taster"" phenotype of phenylthiocarbamine (PTC) in a dominant manner.",Low,Uncertain,Benign,0.43,Other,Unknown,Heterozygous,12595690;15883422;20675712,rs713598,,chr7,141673345,G
PKP2-L366P,PKP2,This variant is a benign polymorphism.  ,Low,Uncertain,Benign,0.22,Other,Unknown,Heterozygous,19955750,rs1046116,,chr12,33021934,G
USH2A-V230M,USH2A,"This rare variant may be associated with Usher Syndrome II, but the literature seems to have concluded that it is a non-pathogenic polymorphism (including authors who earlier reported it as pathogenic).",Low,Uncertain,Benign,0.016,Hearing and vision,Recessive,Heterozygous,10909849;11311042;15325563;18273898,rs45500891,,chr1,216538391,T
TYR-S192Y,TYR,This variant is reported to affect skin pigmentation. It is associated with lighter skin in South Asians (OR 4-5) and with a lack of freckles in Europeans (OR 1.3).,Low,Uncertain,Benign,0.27,Skin,Unknown,Homozygous,17952075;17999355,rs1042602,,chr11,88911696,A
TERT-A279T,TERT,Reported as a rare but probably nonpathogenic polymorphism occurring in controls as well as patients. Other defects in this gene are associated with telomere shortening which may cause aplastic anemia or dyskeratosis congenita.,Low,Uncertain,Benign,0.02,Blood,Unknown,Heterozygous,15814878;18931339,rs61748181,,chr5,1294166,T
F5-M413T,F5,Presumed benign. This variant is not particularly rare and has not been reported to cause disease.,Low,Uncertain,Benign,0.058,Other,Unknown,Heterozygous,17284699,rs6033,,chr1,169521853,G
