variant,gene_symbol,summary,clinical_importance,evidence,impact,frequency,category,inheritance,zygosity,PMIDs,dbSNP_ID,penetrance_score,build_37_chromosome,build_37_position,build_37_variant_allele
CBS-I278T,CBS,This recessive mutation causes homocystinuria in a recessive manner and is found in patients responsive to pyridoxine treatment.,High,Likely,Pathogenic,0.0029,Genital and urinary;Metabolism,Recessive,Heterozygous,7611293;8554066;8940271;9813456;15972722;19683694,rs5742905,5,chr21,44483184,G
LRP5-V667M,LRP5,"This variant has been implicated in causing osteoporosis-pseudoglioma syndrome in a recessive manner. The gene is strongly implicated in causing the disease, but an insufficient number of controls means this variant's observation lacks statistical significance. The condition manifests in childhood with early onset osteoporosis and eye problems.",High,Uncertain,Pathogenic,0.041,"Hearing and vision;Muscular, skeletal, and connective tissue",Recessive,Heterozygous,11719191,rs4988321,5,chr11,68174189,A
C3-R102G,C3,"This variant (also called C3F) is common in Europeans (10.2% allele frequency), and is associated with age-related macular degeneration. In the US, 1.5% of adults over 40 have the disease, but the incidence increases strongly with age (>15% in women over 80). Assuming an average lifetime risk of ~10%, heterozygous individuals have a ~13% risk and homozygous have ~20%.",Moderate,Likely,Pathogenic,0.15,Hearing and vision,Complex/Other,Heterozygous,4427677;17634448,rs2230199,3,chr19,6718387,C
MTRR-I49M,MTRR,"This common variant (HapMap allele frequency of 31.3%) in a protein involved in folate (B9) and cobalamin (B12) metabolism and is often reported as ""MTRR I22M"" (an alternative transcript position). Mothers homozygous for this variant are associated with having around a increased chance of a child with Down syndrome (risk of 0.4%, average risk in population is 0.25%). Notably, age plays a far larger role in the rate of Down syndrome (risk is 4.5% for a mother 45-years-of-age), and it is unknown how this variant may combine with the effect of age. There are conflicting reports associating this variant with incidence of neural tube defects, possibly when combined with MTHFR A222V.",Low,Likely,Pathogenic,0.45,Anatomical and congenital;Metabolism;Nervous system,Recessive,Homozygous,10444342;10930360;11807890;12375236;15060097;15979034;17024475,rs1801394,1,chr5,7870973,G
PRF1-A91V,PRF1,"This variant may be associated with a slightly increased susceptibility to some rare blood disorders, in particular autoimmune proliferative disease, if combined with a more severe mutation elsewhere. Most reports lack statistical significance.",Low,Likely,Pathogenic,0.033,Blood;Immune system,Complex/Other,Heterozygous,16720836;17311987;17475905,rs35947132,1,chr10,72360387,A
AMPD1-Q12X,AMPD1,"Causes Adenosine Deaminase Deficiency in a recessive manner. Most of the time individuals do not report symptoms, but when symptoms do exist they to be post-exercise symptoms of muscle weakness, muscle pain, and getting tired more quickly.",Low,Likely,Pathogenic,0.093,"Metabolism;Muscular, skeletal, and connective tissue",Recessive,Heterozygous,1631143,rs17602729,4,chr1,115236057,A
APOA5-S19W,APOA5,"This variant, also known as APOA5*3, is associated with higher plasma triglyceride concentrations but no significant correlation with coronary artery disease itself has been found.",Low,Likely,Pathogenic,0.065,Heart and circulatory;Metabolism,Unknown,Heterozygous,12417524;12417525;16143024;16682041;19802338,rs3135506,2,chr11,116662407,C
WFS1-R611H,WFS1,"This nonsynonymous SNP is associated with Wolfram Syndrome (known as DIDMOAD), which is characterized by early-onset non-autoimmune diabetes mellitus, diabetes insipidus, optic atrophy, and deafness) and to adult Type Two Diabetes Mellitus.  The WFS1 gene maps to chromosome 4p16.3.  The variant has been shown to be statistically associated with type II diabetes in six UK studies and one study of Ashkenazi Jews (Sandhu, M., et al., Minton et al.).",Low,Uncertain,Not Reviewed,0.4,Hearing and vision;Immune system;Metabolism,Recessive,Homozygous,17603484;17719176;23257691,rs734312,1,chr4,6303354,A
LRP5-A1330V,LRP5,"In a study of a UK population this variant was associated with a small increased risk of osteoporosis and osteoporotic bone fractures, with each copy of the variant presumed to have an additive effect. A study in Chinese young men failed to find an association with peak bone density.

 
",Low,Uncertain,Pathogenic,0.11,"Muscular, skeletal, and connective tissue",Complex/Other,Heterozygous,18455228;19148563;20953208,rs3736228,2,chr11,68201295,T
RNASEL-R462Q,RNASEL,"Associated with increased risk of prostate cancer in individuals who already have a family history of prostate cancer, but studies have been unable to replicate this finding in sporadic (non-familial) prostate cancer cases.",Low,Uncertain,Pathogenic,0.28,Cancer;Genital and urinary,Complex/Other,Heterozygous,11941539;12022038;12415269;17407163,rs486907,2,chr1,182554557,T
ELAC2-S217L,ELAC2,"Reported to be associated with increased susceptibility to prostate cancer, but later studies weaken the hypothesis. Xu et al.'s meta-analysis concludes that there is a small but significant increased risk (OR = 1.13). Assuming a lifetime risk of 16% for prostate cancer we calculate this leads to an increased risk of ~1.5% (17.5% total).",Low,Uncertain,Pathogenic,0.27,Cancer;Genital and urinary,Complex/Other,Heterozygous,12384782;15368467;18767027;20231859,rs4792311,2,chr17,12915009,A
ELAC2-A541T,ELAC2,"This variant is implicated as causing increased susceptibility to prostate cancer. However the variant has always been seen paired with S217L, it is unclear which variant is causal. Evidence is weak for both; one meta-analysis (Severi et al.) concluded that neither variant was pathogenic, a more recent meta-analysis (Xu et al.) found the data to be significant but the odds ratio was not strong and concluded they are ""low-penetrance susceptibility markers of prostate cancer"".",Low,Uncertain,Pathogenic,0.028,Cancer;Genital and urinary,Unknown,Heterozygous,10986046;11175785;11431329;12373607;12515253;12783937;18767027;20231859,rs34152967,2,chr17,12899902,T
SP110-L425S,SP110,"This variant is associated with a slightly increased risk of tuberculosis. It is unclear whether it is itself causal, or in linkage disequilibrium with some other causal variant that has a stronger effect.",Low,Uncertain,Pathogenic,0.86,Immune system,Unknown,Heterozygous,16803959,rs3948464,1,chr2,231050715,G
H6PD-R453Q,H6PD,"This common variant may have a small pathogenic effect by contributing to cortisone reductase deficiency (a rare abnormality) when homozygous and combined with a serious pathogenic variant. The same authors have tested and ruled out a contribution to polycystic ovary syndrome (similar phenotype, more common disease).",Low,Uncertain,Pathogenic,0.31,Genital and urinary;Metabolism,Recessive,Heterozygous,12858176;15827106;16817821,rs6688832,1,chr1,9323910,A
TP53-P72R,TP53,"This is a common variant was first reported as a polymorphism. It has since had mixed associations with cancer: Storey et al. conclude a 7x *increased* risk of HPV cancer for homozygotes vs hets, but Jones et al. find a 1.98x *decreased* risk for colorectal cancer. This variant may have significant impact on particular cancers, but it is unclear what effect it has on the overall burden of cancer.",Low,Uncertain,Pathogenic,0.63,Cancer,Unknown,Heterozygous,1975675;9607760;15355915;19837266;20615891;22184967,rs1042522,0,chr17,7579472,C
DPYD-M166V,DPYD,Associated with DPYD deficiency and poor prognosis for chemotherapy w/ 5-flurorouracil. ,High,Likely,Pharmacogenetic,0.078,Other,Unknown,Heterozygous,11895907;14635116;19104657,rs2297595,5,chr1,98165091,C
FUT2-W154X,FUT2,"This recessive protective variant confers resistance to norovirus (which causes stomach flu). 20% of Caucasians and Africans are homozygous for this variant and are ""non-secretors"": they do not express ABO blood type antigens in their saliva or mucosal surfaces. Most strains of norovirus bind to these antigens in the gut, and so this non-secretor status confers almost total resistantance to most types of norovirus. There are notable exceptions, some strains of norovirus bind a different target and are equally infectious for secretors and non-secretors.",Moderate,Well-established,Protective,0.49,Blood;Immune system,Recessive,Homozygous,7876235;12692541;19625485;20031047;22025362,rs601338,5,chr19,49206674,A
PRNP-M129V,PRNP,"This variant is associated with some protective effects for prion disease -- individuals homozygous for this variant are less susceptible to Creutzfeldt-Jakob, and Papua New Guinea individuals heterozygotes at this site are less susceptible to kuru.

",Low,Well-established,Protective,0.34,Other,Complex/Other,Heterozygous,18236005;19081515,rs1799990,0,chr20,4680251,G
NPC1-H215R,NPC1,"This variant is associated with a reduced risk of obesity, with an additive effect of -0.084 BMI per allele (an average of 0.54 pounds less, per allele, in a 5'6"" individual).





",Low,Likely,Protective,0.3,Metabolism,Complex/Other,Heterozygous,19151714;19174833;19910939,rs1805081,2,chr18,21140432,C
IL7R-T244I,IL7R,"The reference genome variant for this allele has been associated with a slight increased risk of multiple sclerosis. Thus, this variant can be treated as a ""protective"" variant -- carriers of this variant are slightly less likely to have MS. Because the disease is rare and the effect of this variant is not very strong, the absolute decreased risk for carriers of this variant is less than .05% (less than 1 in 2000).",Low,Likely,Protective,0.21,Immune system;Nervous system,Unknown,Heterozygous,12825072;17660530;17660816;17660817;21161391,rs6897932,0,chr5,35874575,T
KCNJ11-K23E,KCNJ11,"This variant is associated with decreased risk of type 2 diabetes. It is unclear whether this variant has additive effects, or acts in a dominant or recessive manner. Assuming diabetes has a lifetime risk of 36%, we estimate a decreased risk of around 1-2% per copy of this variant.",Low,Likely,Protective,0.74,Metabolism,Unknown,Heterozygous,17463246;17463248;20054294,rs5219,2,chr11,17409572,C
MTR-D919G,MTR,"This variant was weakly associated with a protective effect vs. colorectal cancer, but only in individuals with low alcohol consumption.


",Low,Uncertain,Protective,0.22,Cancer,Complex/Other,Homozygous,10498402;14744749;17417062;17855192,rs1805087,1,chr1,237048500,G
IRS2-G1057D,IRS2,"a.k.a Gly1057Asp, insulin receptor substrate-2 IRS2. The rs1805097(G) allele is associated with the Gly, and the (A) allele with Asp. 
A longevity study concluded that rs1805097(A;A) individuals were about twice as likely to live over 85 y/o (odds ratio 2.03, CI:1.39-2.99, p = .0003). ",Low,Uncertain,Protective,0.23,Other,Unknown,Homozygous,19887537,rs1805097,,chr13,110435231,T
CACNA1S-L458H,CACNA1S,Common polymorphism,Low,Likely,Benign,0.27,Other,Unknown,Heterozygous,,rs12742169,,chr1,201052310,T
MLH1-I219V,MLH1,"Computational evidence, functional assays, and case/control studies suggest this variant is probably benign.",Low,Uncertain,Benign,0.24,Other,Dominant,Heterozygous,11781295;12810663;17074586;17510385;17870204;19863800;20301390;22631669,rs1799977,0,chr3,37053568,G
FBN2-S2580L,FBN2,"Probably benign -- initially associated with congenital contractual arachnodactyly, but later reports classify it as a nonpathogenic polymorphism.",Low,Uncertain,Benign,0.078,Anatomical and congenital,Dominant,Heterozygous,9714438;10633129;16835936;17345643,rs2291628,,chr5,127609633,A
ELN-G581R,ELN,"Probably a benign SNP, not rare (4.8% allele frequency in GET-Evidence data).",Low,Uncertain,Benign,0.073,Other,Unknown,Heterozygous,,rs17855988,,chr7,73474825,C
TYR-S192Y,TYR,This variant is reported to affect skin pigmentation. It is associated with lighter skin in South Asians (OR 4-5) and with a lack of freckles in Europeans (OR 1.3).,Low,Uncertain,Benign,0.27,Skin,Unknown,Heterozygous,17952075;17999355,rs1042602,,chr11,88911696,A
COL5A2-P460S,COL5A2,"Tentatively benign. Although predicted to be damaging by Polyphen 2, this variant is seen in 2 out of 62 PGP & public genomes. OMIM lists other more disruptive variants (frameshift & nonsense) as reported to cause Ehlers-Danlos syndrome when homozygous.",Low,Uncertain,Benign,0.04,"Muscular, skeletal, and connective tissue",Unknown,Heterozygous,,rs35830636,,chr2,189932764,A
APOB-Y1422C,APOB,This position is almost certainly an error in the HG18 reference sequence. ,Low,Uncertain,Benign,1.0,Other,Unknown,Homozygous,,rs568413,,chr2,21235475,C
TPCN2-G734E,TPCN2,Pigmentation allele.,Low,Uncertain,Benign,0.29,Other,Unknown,Heterozygous,18488028,rs3829241,,chr11,68855363,A
CASP8-M1T,CASP8,"Probably benign. Although start codons can be extremely disruptive and this gene is implicated in a rare disease (autoimmune lymphoproliferative syndrome), the allele frequency for this variant (2-3%) is high enough to contradict such a strong pathogenic effect. This may be because the gene has many other transcripts that do not include this position as exonic.",Low,Uncertain,Benign,0.031,Blood;Immune system,Unknown,Heterozygous,12353035,rs3769824,,chr2,202122956,C
TAS2R38-A49P,TAS2R38,"This variant is strongly associated with causing the ""taster"" phenotype of phenylthiocarbamine (PTC) in a dominant manner.",Low,Uncertain,Benign,0.43,Other,Unknown,Homozygous,12595690;15883422;20675712,rs713598,,chr7,141673345,G
RP1-N985Y,RP1,"Probably benign. One report linked this variant to high triglycerides, but a later paper found a nearby SNP with similar association and suggests that both findings are caused by linkage to an undiscovered causal variant.",Low,Uncertain,Benign,0.35,Metabolism,Unknown,Homozygous,12764676;19364639,rs2293869,,chr8,55539395,T
AMPD1-P48L,AMPD1,"Probably benign, ancestral to15173240 pathogenic Q12X mutation.",Low,Uncertain,Benign,0.094,Other,Unknown,Heterozygous,15173240,rs61752479,,chr1,115231254,A
SLC45A2-L374F,SLC45A2,"Pigmentation allele for non-black hair, and consequently, possible increased susceptibility to malignant melanoma.",Low,Uncertain,Benign,0.69,Cancer,Unknown,Homozygous,15714523;17044855;18563784;18806926,rs16891982,,chr5,33951693,G
SPTA1-A970D,SPTA1,"This variant, also called alpha-IIa, has been seen frequently in individuals with recessive Hereditary spherocytosis. This appears to be the result of linkage to alpha-LEPRA (a C>T substitution at position -99 of intron 30); A970D is later reported as functionally neutral.",Low,Uncertain,Benign,0.037,Blood,Unknown,Heterozygous,8844207;9067503;15384986;16150946,rs35948326,,chr1,158624528,T
TAS2R38-I296V,TAS2R38,"This variant is associated with ""taster"" status of PTC, along with 49P and 262A. Due to linkage disequilibrium, the independent effects of positions 296 and 262 is unclear. The presence of 49P confers taster status in a dominant fashion, but in the absence of 49P, the presence of 262A/296V is still positively associated with tasting PTC.",Low,Uncertain,Benign,0.46,Other,Unknown,Homozygous,12595690;20675712,rs10246939,,chr7,141672604,C
PCSK9-G670E,PCSK9,This variant is likely benign. ,Low,Uncertain,Benign,0.89,Other,Unknown,Heterozygous,19351729,rs505151,,chr1,55529187,A
