variant,gene_symbol,summary,clinical_importance,evidence,impact,frequency,category,inheritance,zygosity,PMIDs,dbSNP_ID,penetrance_score,build_37_chromosome,build_37_position,build_37_variant_allele,getev_report_url
WFS1-C426Y,WFS1,"Reported in a single case of familial depression, but no linkage data and no statistical significance.",Moderate,Uncertain,Pathogenic,0.0012,Mental and behavioral,Dominant,Heterozygous,11244483;12955714,rs35218685,3,chr4,6302799,A,http://evidence.personalgenomes.org/genomes?display_genome_id=b207b64a41cd250a7a14bc2a55e478f758975f62
MBL2-G54D,MBL2,"This variant is associated with mannose binding protein deficiency which leads to impaired complement system immune response to mannose-rich pathogens. Patients homozygous for this allele or compound heterozygous are likely to have increased susceptibility to infection, but Hellemann et al. report heterosis for intensive care outcomes in heterozygous subjects. The wild-type version of this gene is known as variant allele A, while this is called variant allele B. See R52C (variant D) and G57E (variant C).",Low,Likely,Pathogenic,0.1,Immune system,Recessive,Heterozygous,7564730;10199352;17872904,rs1800450,3,chr10,54531235,T,http://evidence.personalgenomes.org/genomes?display_genome_id=b207b64a41cd250a7a14bc2a55e478f758975f62
NOD2-G908R,NOD2,"This variant is associated with an increased susceptibility to Crohn's disease and other inflammatory bowel diseases (IBD). Assuming an overall prevalence of 0.5% for IBD, this variant implies an increased attributable risk of 2% (5x increased risk, for an overall risk of 2.5% of IBD for people with this variant).",Low,Likely,Pathogenic,0.011,"Mouth, liver, and digestive",Unknown,Heterozygous,11385576;12019468,,2,chr16,50756540,C,http://evidence.personalgenomes.org/genomes?display_genome_id=b207b64a41cd250a7a14bc2a55e478f758975f62
MTRR-I49M,MTRR,"This common variant (HapMap allele frequency of 31.3%) in a protein involved in folate (B9) and cobalamin (B12) metabolism and is often reported as ""MTRR I22M"" (an alternative transcript position). Mothers homozygous for this variant are associated with having around a increased chance of a child with Down syndrome (risk of 0.4%, average risk in population is 0.25%). Notably, age plays a far larger role in the rate of Down syndrome (risk is 4.5% for a mother 45-years-of-age), and it is unknown how this variant may combine with the effect of age. There are conflicting reports associating this variant with incidence of neural tube defects, possibly when combined with MTHFR A222V.",Low,Likely,Pathogenic,0.45,Anatomical and congenital;Metabolism;Nervous system,Recessive,Heterozygous,10444342;10930360;11807890;12375236;15060097;15979034;17024475,rs1801394,1,chr5,7870973,G,http://evidence.personalgenomes.org/genomes?display_genome_id=b207b64a41cd250a7a14bc2a55e478f758975f62
MBL2-R52C,MBL2,"This variant is associated with mannose binding protein deficiency which leads to impaired complement system immune response to mannose-rich pathogens. Patients homozygous for this allele or compound heterozygous are likely to have increased susceptibility to infection, but Hellemann et al. report heterosis for intensive care outcomes in heterozygous subjects. The wild-type version of this gene is known as variant allele A, while this is called variant allele D. See G54D (variant B) and G57E (variant C).",Low,Likely,Pathogenic,0.049,Immune system,Recessive,Heterozygous,7564730;10199352;17872904,rs5030737,1,chr10,54531242,A,http://evidence.personalgenomes.org/genomes?display_genome_id=b207b64a41cd250a7a14bc2a55e478f758975f62
TGIF1-P83Shift,TGIF1,"Severe variants in this gene are associated with holoprosencephaly disorders when combined with loss-of-function variants in SHH. Haploinsufficiency was identified in some families with this condition. It is unclear how likely this variant is to occur in combination with an SHH variant, or what phenotypic effect the variant would have on its own.",Low,Uncertain,Pathogenic,0.14,Nervous system,Complex/Other,Homozygous,10556296,rs11571510,1,,,,http://evidence.personalgenomes.org/genomes?display_genome_id=b207b64a41cd250a7a14bc2a55e478f758975f62
RNASEL-R462Q,RNASEL,"Associated with increased risk of prostate cancer in individuals who already have a family history of prostate cancer, but studies have been unable to replicate this finding in sporadic (non-familial) prostate cancer cases.",Low,Uncertain,Pathogenic,0.28,Cancer;Genital and urinary,Complex/Other,Heterozygous,11941539;12022038;12415269;17407163,rs486907,2,chr1,182554557,T,http://evidence.personalgenomes.org/genomes?display_genome_id=b207b64a41cd250a7a14bc2a55e478f758975f62
BRCA2-N372H,BRCA2,"This is a common variant of BRCA2 (HapMap allele frequency of 23%). The variant is weakly associated with an increased chance of breast cancer, and zygosity of the variant is associated with sex of children: male children are more likely to be homozygous for this variant, female children are more likely to be heterozygous.",Low,Uncertain,Pathogenic,0.24,Cancer,Recessive,Heterozygous,11062481;15235023,rs144848,2,chr13,32906729,C,http://evidence.personalgenomes.org/genomes?display_genome_id=b207b64a41cd250a7a14bc2a55e478f758975f62
SP110-L425S,SP110,"This variant is associated with a slightly increased risk of tuberculosis. It is unclear whether it is itself causal, or in linkage disequilibrium with some other causal variant that has a stronger effect.",Low,Uncertain,Pathogenic,0.86,Immune system,Unknown,Homozygous,16803959,rs3948464,1,chr2,231050715,G,http://evidence.personalgenomes.org/genomes?display_genome_id=b207b64a41cd250a7a14bc2a55e478f758975f62
TP53-P72R,TP53,"This is a common variant was first reported as a polymorphism. It has since had mixed associations with cancer: Storey et al. conclude a 7x *increased* risk of HPV cancer for homozygotes vs hets, but Jones et al. find a 1.98x *decreased* risk for colorectal cancer. This variant may have significant impact on particular cancers, but it is unclear what effect it has on the overall burden of cancer.",Low,Uncertain,Pathogenic,0.63,Cancer,Unknown,Homozygous,1975675;9607760;15355915;19837266;20615891;22184967,rs1042522,0,chr17,7579472,C,http://evidence.personalgenomes.org/genomes?display_genome_id=b207b64a41cd250a7a14bc2a55e478f758975f62
H6PD-R453Q,H6PD,"This common variant may have a small pathogenic effect by contributing to cortisone reductase deficiency (a rare abnormality) when homozygous and combined with a serious pathogenic variant. The same authors have tested and ruled out a contribution to polycystic ovary syndrome (similar phenotype, more common disease).",Low,Uncertain,Pathogenic,0.31,Genital and urinary;Metabolism,Recessive,Heterozygous,12858176;15827106;16817821,rs6688832,1,chr1,9323910,A,http://evidence.personalgenomes.org/genomes?display_genome_id=b207b64a41cd250a7a14bc2a55e478f758975f62
WFS1-R611H,WFS1,"This nonsynonymous SNP is associated with Wolfram Syndrome (known as DIDMOAD), which is characterized by early-onset non-autoimmune diabetes mellitus, diabetes insipidus, optic atrophy, and deafness) and to adult Type Two Diabetes Mellitus.  The WFS1 gene maps to chromosome 4p16.3.  The variant has been shown to be statistically associated with type II diabetes in six UK studies and one study of Ashkenazi Jews (Sandhu, M., et al., Minton et al.).",Low,Uncertain,Not Reviewed,0.4,Hearing and vision;Immune system;Metabolism,Recessive,Heterozygous,17603484;17719176;23257691,rs734312,1,chr4,6303354,A,http://evidence.personalgenomes.org/genomes?display_genome_id=b207b64a41cd250a7a14bc2a55e478f758975f62
ERCC6-R1213G,ERCC6,"When homozygous, this variant may cause Cockayne Syndrome, which is a severe autosomal-recessive disorder characterized by abnormal early growth and development, abnormal sensitivity to sunlight, and premature aging. Cockayne Syndrome Type I and Type II lead to death in early childhood. Several other variants in the ERCC6 gene are linked to Cockayne Syndrome. This variant may also be linked to age-related macular degeneration like other ERCC6 variants, and has been linked to colorectal cancer in one study. ",Low,Uncertain,Pathogenic,0.2,Anatomical and congenital;Cancer;Hearing and vision,Recessive,Heterozygous,,rs2228527,0,chr10,50678369,C,http://evidence.personalgenomes.org/genomes?display_genome_id=b207b64a41cd250a7a14bc2a55e478f758975f62
DYX1C1-E417X,DYX1C1,"One study reports this variant to be associated with dyslexia. The study group was relatively small and so the results did not have strong significance. If they are representative this variant is associated with a doubled risk for dyslexia, but it is unclear whether the effect would be additive, dominant, or recessive.",Low,Uncertain,Pathogenic,0.2,Mental and behavioral,Unknown,Heterozygous,12954984,rs57809907,3,chr15,55722882,A,http://evidence.personalgenomes.org/genomes?display_genome_id=b207b64a41cd250a7a14bc2a55e478f758975f62
FUT2-W154X,FUT2,"This recessive protective variant confers resistance to norovirus (which causes stomach flu). 20% of Caucasians and Africans are homozygous for this variant and are ""non-secretors"": they do not express ABO blood type antigens in their saliva or mucosal surfaces. Most strains of norovirus bind to these antigens in the gut, and so this non-secretor status confers almost total resistantance to most types of norovirus. There are notable exceptions, some strains of norovirus bind a different target and are equally infectious for secretors and non-secretors.",Moderate,Well-established,Protective,0.49,Blood;Immune system,Recessive,Heterozygous,7876235;12692541;19625485;20031047;22025362,rs601338,5,chr19,49206674,A,http://evidence.personalgenomes.org/genomes?display_genome_id=b207b64a41cd250a7a14bc2a55e478f758975f62
TOR1A-D216H,TOR1A,This SNP has been shown to be benign and play a protective role against Dystonia.  ,Low,Likely,Protective,0.1,Nervous system,Unknown,Heterozygous,18519876;19380705;20669276,rs1801968,1,chr9,132580901,G,http://evidence.personalgenomes.org/genomes?display_genome_id=b207b64a41cd250a7a14bc2a55e478f758975f62
KCNJ11-K23E,KCNJ11,"This variant is associated with decreased risk of type 2 diabetes. It is unclear whether this variant has additive effects, or acts in a dominant or recessive manner. Assuming diabetes has a lifetime risk of 36%, we estimate a decreased risk of around 1-2% per copy of this variant.",Low,Likely,Protective,0.74,Metabolism,Unknown,Heterozygous,17463246;17463248;20054294,rs5219,2,chr11,17409572,C,http://evidence.personalgenomes.org/genomes?display_genome_id=b207b64a41cd250a7a14bc2a55e478f758975f62
DTNBP1-P272S,DTNBP1,Possibly a slight protective effect against colorectal cancer if homozygous.,Low,Uncertain,Protective,0.035,Cancer,Recessive,Heterozygous,17000706,rs17470454,2,chr6,15523448,A,http://evidence.personalgenomes.org/genomes?display_genome_id=b207b64a41cd250a7a14bc2a55e478f758975f62
IRS2-G1057D,IRS2,"a.k.a Gly1057Asp, insulin receptor substrate-2 IRS2. The rs1805097(G) allele is associated with the Gly, and the (A) allele with Asp. 
A longevity study concluded that rs1805097(A;A) individuals were about twice as likely to live over 85 y/o (odds ratio 2.03, CI:1.39-2.99, p = .0003). ",Low,Uncertain,Protective,0.23,Other,Unknown,Homozygous,19887537,rs1805097,,chr13,110435231,T,http://evidence.personalgenomes.org/genomes?display_genome_id=b207b64a41cd250a7a14bc2a55e478f758975f62
PKP2-D26N,PKP2,"Probably benign. This variant has been classified as a rare polymorphism, although other variants in this gene have been implicated in causing autosomal dominant arrhythmogenic right ventricular dysplasia (which can cause sudden death at an early age).",Low,Likely,Benign,0.0049,Heart and circulatory,Unknown,Heterozygous,16567567;20829228,,,chr12,33049590,T,http://evidence.personalgenomes.org/genomes?display_genome_id=b207b64a41cd250a7a14bc2a55e478f758975f62
PMS2-P470S,PMS2,"Benign, common variant.",Low,Likely,Benign,0.37,Other,Unknown,Heterozygous,15256438,rs1805321,,chr7,6026988,A,http://evidence.personalgenomes.org/genomes?display_genome_id=b207b64a41cd250a7a14bc2a55e478f758975f62
FLT4-N149D,FLT4,"Other severe variants in this gene are implicated in causing Milroy Disease (primary lymphedema) in a recessive manner. Although this variant is rare (2.3% allele frequency), it is still common enough that it is highly unlikely to have a severe, high penetrance pathogenic effect.",Low,Likely,Benign,0.073,Blood,Unknown,Heterozygous,11292664,rs34221241,,chr5,180057293,C,http://evidence.personalgenomes.org/genomes?display_genome_id=b207b64a41cd250a7a14bc2a55e478f758975f62
OCA2-R305W,OCA2,"This variant is associated with eye color, as is OCA2 Arg419Gln. Individuals with this variant are more likely to have brown/black eyes (as opposed to blue/gray or green/hazel). Other variants in this gene are associated with oculocutaneous albinism (albinism which involves skin and eyes).",Low,Likely,Benign,0.082,Hearing and vision;Skin,Unknown,Heterozygous,"12163334;
15889046",rs1800401,,chr15,28260053,A,http://evidence.personalgenomes.org/genomes?display_genome_id=b207b64a41cd250a7a14bc2a55e478f758975f62
ADA-K80R,ADA,"This variant has a 3.5% allele frequency in 1000 genomes data. Although OMIM links this to disease, the paper they reference uses in vitro data to conclude that this is a functionally neutral polymorphism.",Low,Likely,Benign,0.064,Other,Recessive,Heterozygous,6198631;17181544,rs11555566,,chr20,43255220,C,http://evidence.personalgenomes.org/genomes?display_genome_id=b207b64a41cd250a7a14bc2a55e478f758975f62
MLH1-I219V,MLH1,"Computational evidence, functional assays, and case/control studies suggest this variant is probably benign.",Low,Uncertain,Benign,0.24,Other,Dominant,Heterozygous,11781295;12810663;17074586;17510385;17870204;19863800;20301390;22631669,rs1799977,0,chr3,37053568,G,http://evidence.personalgenomes.org/genomes?display_genome_id=b207b64a41cd250a7a14bc2a55e478f758975f62
GAA-E689K,GAA,This is also known as the GAA*4 allozyme is frequent in the Asian population and appears to have somewhat reduced enzyme activity. Kroos et al. rule out pathogenic effect.,Low,Uncertain,Benign,0.03,Other,Complex/Other,Heterozygous,18301443,rs1800309,,chr17,78087041,A,http://evidence.personalgenomes.org/genomes?display_genome_id=b207b64a41cd250a7a14bc2a55e478f758975f62
TAS2R38-A49P,TAS2R38,"This variant is strongly associated with causing the ""taster"" phenotype of phenylthiocarbamine (PTC) in a dominant manner.",Low,Uncertain,Benign,0.43,Other,Unknown,Homozygous,12595690;15883422;20675712,rs713598,,chr7,141673345,G,http://evidence.personalgenomes.org/genomes?display_genome_id=b207b64a41cd250a7a14bc2a55e478f758975f62
TCIRG1-R56W,TCIRG1,"Probably benign. One publication implicates the variant in causing osteopetrosis, but this is contradicted by the relatively high allele frequency for the variant in Caucasians (5%, 1 in 400 homozygous) while that disease is extremely rare (1 in 250,000).",Low,Uncertain,Benign,0.044,"Muscular, skeletal, and connective tissue",Unknown,Heterozygous,12161516;19448635,rs36027301,,chr11,67809268,T,http://evidence.personalgenomes.org/genomes?display_genome_id=b207b64a41cd250a7a14bc2a55e478f758975f62
TAS2R38-I296V,TAS2R38,"This variant is associated with ""taster"" status of PTC, along with 49P and 262A. Due to linkage disequilibrium, the independent effects of positions 296 and 262 is unclear. The presence of 49P confers taster status in a dominant fashion, but in the absence of 49P, the presence of 262A/296V is still positively associated with tasting PTC.",Low,Uncertain,Benign,0.46,Other,Unknown,Homozygous,12595690;20675712,rs10246939,,chr7,141672604,C,http://evidence.personalgenomes.org/genomes?display_genome_id=b207b64a41cd250a7a14bc2a55e478f758975f62
TXNDC3-I338T,TXNDC3,"Tentatively classified as benign, but predicted to be damaging and other variants in this gene are implicated in causing primary ciliary dyskinesia (situs inversus, chronic sinusitis, and bronchiectasis).",Low,Uncertain,Benign,0.038,Anatomical and congenital;Breathing,Unknown,Heterozygous,,rs62001870,,chr7,37923923,C,http://evidence.personalgenomes.org/genomes?display_genome_id=b207b64a41cd250a7a14bc2a55e478f758975f62
TYR-S192Y,TYR,This variant is reported to affect skin pigmentation. It is associated with lighter skin in South Asians (OR 4-5) and with a lack of freckles in Europeans (OR 1.3).,Low,Uncertain,Benign,0.27,Skin,Unknown,Homozygous,17952075;17999355,rs1042602,,chr11,88911696,A,http://evidence.personalgenomes.org/genomes?display_genome_id=b207b64a41cd250a7a14bc2a55e478f758975f62
NTRK1-G613V,NTRK1,"Also called G607V, this variant has been reported as a nonpathogenic polymorphism.",Low,Uncertain,Benign,0.043,Other,Unknown,Heterozygous,10330344;10443680;11159935,rs6339,,chr1,156848946,T,http://evidence.personalgenomes.org/genomes?display_genome_id=b207b64a41cd250a7a14bc2a55e478f758975f62
DSPP-R68W,DSPP,"Probably benign. One report linked this to causing dentinogenesis Imperfecta type II in a large Swedish family, but subsequent publications have observed this is a common variant and conclude it is a nonpathogenic polymorphism.",Low,Uncertain,Benign,0.14,"Mouth, liver, and digestive",Unknown,Heterozygous,14758537;17452557;18797159,rs36094464,,chr4,88533540,T,http://evidence.personalgenomes.org/genomes?display_genome_id=b207b64a41cd250a7a14bc2a55e478f758975f62
BRCA1-Q356R,BRCA1,"One common variant associated this variant with an increased risk of breast cancer, but a more recent, larger study found no association.",Low,Uncertain,Benign,0.046,Cancer,Unknown,Heterozygous,17341484;19661094,rs1799950,,chr17,41246481,C,http://evidence.personalgenomes.org/genomes?display_genome_id=b207b64a41cd250a7a14bc2a55e478f758975f62
APOB-Y1422C,APOB,This position is almost certainly an error in the HG18 reference sequence. ,Low,Uncertain,Benign,1.0,Other,Unknown,Homozygous,,rs568413,,chr2,21235475,C,http://evidence.personalgenomes.org/genomes?display_genome_id=b207b64a41cd250a7a14bc2a55e478f758975f62
NTRK1-H604Y,NTRK1,"Various databases and papers treat this variant as a non-pathogenic polymorphism, although it is fairly uncommon and is computational methods predict it to be damaging.",Low,Uncertain,Benign,0.043,Other,Unknown,Heterozygous,10443680;16412461;21228398,rs6336,,chr1,156848918,T,http://evidence.personalgenomes.org/genomes?display_genome_id=b207b64a41cd250a7a14bc2a55e478f758975f62
PCSK9-G670E,PCSK9,This variant is likely benign. ,Low,Uncertain,Benign,0.89,Other,Unknown,Homozygous,19351729,rs505151,,chr1,55529187,A,http://evidence.personalgenomes.org/genomes?display_genome_id=b207b64a41cd250a7a14bc2a55e478f758975f62
RP1-N985Y,RP1,"Probably benign. One report linked this variant to high triglycerides, but a later paper found a nearby SNP with similar association and suggests that both findings are caused by linkage to an undiscovered causal variant.",Low,Uncertain,Benign,0.35,Metabolism,Unknown,Heterozygous,12764676;19364639,rs2293869,,chr8,55539395,T,http://evidence.personalgenomes.org/genomes?display_genome_id=b207b64a41cd250a7a14bc2a55e478f758975f62
RAPSN-R58C,RAPSN,Reported as non-pathogenic polymorphism. ,Low,Uncertain,Benign,0.078,Other,Unknown,Heterozygous,11791205,rs34312154,,chr11,47470345,A,http://evidence.personalgenomes.org/genomes?display_genome_id=b207b64a41cd250a7a14bc2a55e478f758975f62
PKP2-L366P,PKP2,This variant is a benign polymorphism.  ,Low,Uncertain,Benign,0.22,Other,Unknown,Homozygous,19955750,rs1046116,,chr12,33021934,G,http://evidence.personalgenomes.org/genomes?display_genome_id=b207b64a41cd250a7a14bc2a55e478f758975f62
SLC45A2-L374F,SLC45A2,"Pigmentation allele for non-black hair, and consequently, possible increased susceptibility to malignant melanoma.",Low,Uncertain,Benign,0.69,Cancer,Unknown,Homozygous,15714523;17044855;18563784;18806926,rs16891982,,chr5,33951693,G,http://evidence.personalgenomes.org/genomes?display_genome_id=b207b64a41cd250a7a14bc2a55e478f758975f62
