variant,gene_symbol,summary,clinical_importance,evidence,impact,frequency,category,inheritance,zygosity,PMIDs,dbSNP_ID,penetrance_score,build_37_chromosome,build_37_position,build_37_variant_allele,getev_report_url
PKD2-S804N,PKD2,"Predicted to cause autosomal dominant polycystic kidney disease, but without control allele frequency the report cannot be tested for statistical significance.",High,Uncertain,Pathogenic,0.0026,Genital and urinary,Dominant,Heterozygous,17582161;20881056,,5,chr4,88989102,A,http://evidence.personalgenomes.org/genomes?display_genome_id=9f1c18192898dbe1e99f10048196c045b4c66152
PEX1-I696M,PEX1,"Reported as a mutation causing peroxisome biogenesis disorder in a single patient, presumably in a recessive manner.",High,Uncertain,Pathogenic,0.027,Metabolism,Recessive,Heterozygous,11389485,rs35996821,5,chr7,92132493,C,http://evidence.personalgenomes.org/genomes?display_genome_id=9f1c18192898dbe1e99f10048196c045b4c66152
FAM126A-Q154R,FAM126A,"Unreported, rare and predicted to be damaging by Polyphen 2. Other recessive variants in this gene, including one missense mutation, have been reported to cause hypomyelinating leukodystrophy and congenital cataracts.",High,Uncertain,Pathogenic,0.00019,Hearing and vision;Nervous system,Recessive,Heterozygous,,,5,chr7,23016381,C,http://evidence.personalgenomes.org/genomes?display_genome_id=9f1c18192898dbe1e99f10048196c045b4c66152
SPG7-G199Shift,SPG7,"This variant is predicted to cause hereditary spastic paraplegia (paraplegin type) in a recessive manner. Other downstream frameshift mutations in this gene have been implicated in causing the disease. Age of onset is usually in adulthood (~25 years of age), and is characterized by progressive bilateral lower limb weakness and spasticity.",High,Uncertain,Pathogenic,0.0078,Nervous system,Recessive,Heterozygous,,,5,,,,http://evidence.personalgenomes.org/genomes?display_genome_id=9f1c18192898dbe1e99f10048196c045b4c66152
C3-R102G,C3,"This variant (also called C3F) is common in Europeans (10.2% allele frequency), and is associated with age-related macular degeneration. In the US, 1.5% of adults over 40 have the disease, but the incidence increases strongly with age (>15% in women over 80). Assuming an average lifetime risk of ~10%, heterozygous individuals have a ~13% risk and homozygous have ~20%.",Moderate,Likely,Pathogenic,0.15,Hearing and vision,Complex/Other,Heterozygous,4427677;17634448,rs2230199,3,chr19,6718387,C,http://evidence.personalgenomes.org/genomes?display_genome_id=9f1c18192898dbe1e99f10048196c045b4c66152
SLC9A3R1-R153Q,SLC9A3R1,"This variant was reported in a small family, associated with kidney stones. This gene is strongly associated with causing kidney stones and osteoporosis, and the variant is computationally predicted to be damaging, but the reported cases for this variant were too few to establish any statistical significance.",Moderate,Uncertain,Pathogenic,0.0034,"Genital and urinary;Muscular, skeletal, and connective tissue",Dominant,Heterozygous,18784102,rs41282065,4,chr17,72758167,A,http://evidence.personalgenomes.org/genomes?display_genome_id=9f1c18192898dbe1e99f10048196c045b4c66152
RHO-G51A,RHO,"Implicated in autosomal dominant retinitis pigmentosa, but published observations lack statistical significance. Other variants at this position have strong evidence, but this variant had less severe consequences in functional studies. Also contradicting a pathogenic hypothesis is the fact that it has been seen in a presumed-healthy PGP individual (African American) and in one other presumed-healthy public genome (Nigerian).",Moderate,Uncertain,Pathogenic,0.0023,Hearing and vision,Dominant,Heterozygous,8317502;9380676;16962629,,4,chr3,129247728,C,http://evidence.personalgenomes.org/genomes?display_genome_id=9f1c18192898dbe1e99f10048196c045b4c66152
OPTN-M98K,OPTN,"This variant was initially reported to be a risk factor for glaucoma, but subsequent reports have failed to find a statistically significant association. It may have a modifier effect, with carriers of the variant having lower intraocular pressure on average -- pressures that might be considered normal in other individuals would be abnormally high for carriers of this variant.",Moderate,Uncertain,Pathogenic,0.061,Hearing and vision,Unknown,Heterozygous,11834836;14627677;19145250,rs11258194,3,chr10,13152400,A,http://evidence.personalgenomes.org/genomes?display_genome_id=9f1c18192898dbe1e99f10048196c045b4c66152
DSP-L1489R,DSP,"Unreported, rare and predicted to be damaging. Some dominant variants in this gene are reported to cause Arrhythmogenic Right Ventricular Dysplasia -- this effect is contradicted by the presence of this variant in a healthy PGP participant, although penetrance is reported to be variable. Other recessive missense variants in this gene are reported to cause Skin Fragility-Woolly Hair Syndrome.",Moderate,Uncertain,Pathogenic,9e-05,Heart and circulatory;Skin,Recessive,Heterozygous,,,5,chr6,7580889,G,http://evidence.personalgenomes.org/genomes?display_genome_id=9f1c18192898dbe1e99f10048196c045b4c66152
SLC26A4-I300L,SLC26A4,"If homozygous, this disruptive variant may be a recessive cause of Pendred Syndrome (congenital deafness).",Moderate,Uncertain,Pathogenic,0.0035,Hearing and vision,Recessive,Heterozygous,,rs111033304,5,chr7,107323779,C,http://evidence.personalgenomes.org/genomes?display_genome_id=9f1c18192898dbe1e99f10048196c045b4c66152
MTRR-I49M,MTRR,"This common variant (HapMap allele frequency of 31.3%) in a protein involved in folate (B9) and cobalamin (B12) metabolism and is often reported as ""MTRR I22M"" (an alternative transcript position). Mothers homozygous for this variant are associated with having around a increased chance of a child with Down syndrome (risk of 0.4%, average risk in population is 0.25%). Notably, age plays a far larger role in the rate of Down syndrome (risk is 4.5% for a mother 45-years-of-age), and it is unknown how this variant may combine with the effect of age. There are conflicting reports associating this variant with incidence of neural tube defects, possibly when combined with MTHFR A222V.",Low,Likely,Pathogenic,0.45,Anatomical and congenital;Metabolism;Nervous system,Recessive,Homozygous,10444342;10930360;11807890;12375236;15060097;15979034;17024475,rs1801394,1,chr5,7870973,G,http://evidence.personalgenomes.org/genomes?display_genome_id=9f1c18192898dbe1e99f10048196c045b4c66152
RPGRIP1L-A229T,RPGRIP1L,"This variant is generally not considered pathogenic, but when combined with other severe variants it is associated with rare genetic diseases which involve retinal degeneration. Carrying this variant increases the risk of these diseases, but the overall increased risk is very small because the diseases are very rare.",Low,Likely,Pathogenic,0.056,Hearing and vision,Unknown,Heterozygous,19430481,rs61747071,0,chr16,53720436,T,http://evidence.personalgenomes.org/genomes?display_genome_id=9f1c18192898dbe1e99f10048196c045b4c66152
rs5186,,"This common noncoding genetic variant has an allele frequency of ~30% and is associated with an increased risk of hypertension. If ~25% of non-carriers have hypertension, Bonnardeaux et al's data predict ~4% increased risk of hypertension per copy of this variant. This SNP is in the 3' noncoding region of the AGTR1 transcript (angiotensin II type 1 receptor), also known as AT2R1 or AT1R, which is a target of hypertension drugs.",Low,Likely,Pathogenic,0.21,Drug response;Heart and circulatory,Unknown,Heterozygous,"8021009;
11250978;11593098;16046653;16675453;17668390",rs5186,2,chr3,148459988,C,http://evidence.personalgenomes.org/genomes?display_genome_id=9f1c18192898dbe1e99f10048196c045b4c66152
SP110-L425S,SP110,"This variant is associated with a slightly increased risk of tuberculosis. It is unclear whether it is itself causal, or in linkage disequilibrium with some other causal variant that has a stronger effect.",Low,Uncertain,Pathogenic,0.86,Immune system,Unknown,Homozygous,16803959,rs3948464,1,chr2,231050715,G,http://evidence.personalgenomes.org/genomes?display_genome_id=9f1c18192898dbe1e99f10048196c045b4c66152
ERCC6-R1213G,ERCC6,"When homozygous, this variant may cause Cockayne Syndrome, which is a severe autosomal-recessive disorder characterized by abnormal early growth and development, abnormal sensitivity to sunlight, and premature aging. Cockayne Syndrome Type I and Type II lead to death in early childhood. Several other variants in the ERCC6 gene are linked to Cockayne Syndrome. This variant may also be linked to age-related macular degeneration like other ERCC6 variants, and has been linked to colorectal cancer in one study. ",Low,Uncertain,Pathogenic,0.2,Anatomical and congenital;Cancer;Hearing and vision,Recessive,Heterozygous,,rs2228527,0,chr10,50678369,C,http://evidence.personalgenomes.org/genomes?display_genome_id=9f1c18192898dbe1e99f10048196c045b4c66152
ITPA-P32T,ITPA,"This variant is associated with inosine triphosphate pyrophosphohydrolase deficiency and may be associated with an adverse reaction to thiopurine drugs (which are used as immunosuppressants). Homozygotes have no detectable ITPase activity, individuals compound heterozygous with another less severe mutation also have severely reduced enzyme activity.",Low,Well-established,Pharmacogenetic,0.061,Drug response;Immune system;Metabolism,Recessive,Heterozygous,12384777;15322947;17924837;19631656;19682085;20173735,rs1127354,1,chr20,3193842,A,http://evidence.personalgenomes.org/genomes?display_genome_id=9f1c18192898dbe1e99f10048196c045b4c66152
rs1544410,,"rs1544410 is a Vitamin D Receptor (VDR) single nucleotide polymorphism. It is unlikely that it has functional significance because it is located in an intron (Liu et. al.), but it is in strong linkage disequilibrium with rs731236 (Dvornyk et al), which is located in an exon. ",Low,Uncertain,Pharmacogenetic,0.35,Other,Unknown,Heterozygous,,rs1544410,0,,,,http://evidence.personalgenomes.org/genomes?display_genome_id=9f1c18192898dbe1e99f10048196c045b4c66152
FUT2-W154X,FUT2,"This recessive protective variant confers resistance to norovirus (which causes stomach flu). 20% of Caucasians and Africans are homozygous for this variant and are ""non-secretors"": they do not express ABO blood type antigens in their saliva or mucosal surfaces. Most strains of norovirus bind to these antigens in the gut, and so this non-secretor status confers almost total resistantance to most types of norovirus. There are notable exceptions, some strains of norovirus bind a different target and are equally infectious for secretors and non-secretors.",Moderate,Well-established,Protective,0.49,Blood;Immune system,Recessive,Heterozygous,7876235;12692541;19625485;20031047;22025362,rs601338,5,chr19,49206674,A,http://evidence.personalgenomes.org/genomes?display_genome_id=9f1c18192898dbe1e99f10048196c045b4c66152
PRNP-M129V,PRNP,"This variant is associated with some protective effects for prion disease -- individuals homozygous for this variant are less susceptible to Creutzfeldt-Jakob, and Papua New Guinea individuals heterozygotes at this site are less susceptible to kuru.

",Low,Well-established,Protective,0.34,Other,Complex/Other,Heterozygous,18236005;19081515,rs1799990,0,chr20,4680251,G,http://evidence.personalgenomes.org/genomes?display_genome_id=9f1c18192898dbe1e99f10048196c045b4c66152
CFH-V62I,CFH,"Associated with a decreased risk for age related macular degeneration (ARMD). Homozygotes for this have a 4-5% decreased attributable risk (3-4% vs. average 8% risk), heterozygotes have slightly lower than average risk (7%). Non-carriers have an increased risk (12-13%). ARMD impairs sharp vision as age progresses. While there is no cure, treatment can slow progression of the disease and environmental factors (smoking and obesity) contribute to higher risk.",Low,Likely,Protective,0.39,Hearing and vision;Metabolism,Complex/Other,Heterozygous,15870199,rs800292,2,chr1,196642233,A,http://evidence.personalgenomes.org/genomes?display_genome_id=9f1c18192898dbe1e99f10048196c045b4c66152
ABCG5-R50C,ABCG5,This variant has a mild protective effect on blood cholesterol. It is associated with slightly lower total and LDL cholesterol levels.,Low,Likely,Protective,0.068,Blood;Metabolism,Unknown,Heterozygous,19060911,rs6756629,1,chr2,44065090,A,http://evidence.personalgenomes.org/genomes?display_genome_id=9f1c18192898dbe1e99f10048196c045b4c66152
KCNJ11-K23E,KCNJ11,"This variant is associated with decreased risk of type 2 diabetes. It is unclear whether this variant has additive effects, or acts in a dominant or recessive manner. Assuming diabetes has a lifetime risk of 36%, we estimate a decreased risk of around 1-2% per copy of this variant.",Low,Likely,Protective,0.74,Metabolism,Unknown,Homozygous,17463246;17463248;20054294,rs5219,2,chr11,17409572,C,http://evidence.personalgenomes.org/genomes?display_genome_id=9f1c18192898dbe1e99f10048196c045b4c66152
IRS2-G1057D,IRS2,"a.k.a Gly1057Asp, insulin receptor substrate-2 IRS2. The rs1805097(G) allele is associated with the Gly, and the (A) allele with Asp. 
A longevity study concluded that rs1805097(A;A) individuals were about twice as likely to live over 85 y/o (odds ratio 2.03, CI:1.39-2.99, p = .0003). ",Low,Uncertain,Protective,0.23,Other,Unknown,Heterozygous,19887537,rs1805097,,chr13,110435231,T,http://evidence.personalgenomes.org/genomes?display_genome_id=9f1c18192898dbe1e99f10048196c045b4c66152
ARSA-N350S,ARSA,This common variant (HapMap 24.1% allele frequency) causes a loss of a glycosylation site (affecting the size of the protein when studied with gel electrophoresis) but does not affect enzyme activity or stability.,Low,Well-established,Benign,0.18,Other,Unknown,Heterozygous,2574462,rs2071421,,chr22,51064416,C,http://evidence.personalgenomes.org/genomes?display_genome_id=9f1c18192898dbe1e99f10048196c045b4c66152
EVC-R443Q,EVC,"Probably benign. Implicated in causing Ellis-van Creveld Syndrome in a dominant manner (despite the disease typically being recessive), but the high allele frequency of this variant (7.8% in GET-Evidence data) strongly contradicts any severe pathogenic effect.",Low,Likely,Benign,0.079,Anatomical and congenital,Complex/Other,Heterozygous,10700184,rs35953626,,chr4,5755524,A,http://evidence.personalgenomes.org/genomes?display_genome_id=9f1c18192898dbe1e99f10048196c045b4c66152
COL6A3-D2831H,COL6A3,"Probably benign, reported by Pan et al. as a presumed-nonpathogenic variant in the gene.",Low,Likely,Benign,0.068,Other,Unknown,Heterozygous,9536084;15563506,rs36104025,,chr2,238247734,G,http://evidence.personalgenomes.org/genomes?display_genome_id=9f1c18192898dbe1e99f10048196c045b4c66152
FBN2-S2580L,FBN2,"Probably benign -- initially associated with congenital contractual arachnodactyly, but later reports classify it as a nonpathogenic polymorphism.",Low,Uncertain,Benign,0.078,Anatomical and congenital,Dominant,Heterozygous,9714438;10633129;16835936;17345643,rs2291628,,chr5,127609633,A,http://evidence.personalgenomes.org/genomes?display_genome_id=9f1c18192898dbe1e99f10048196c045b4c66152
SYNE1-V5606L,SYNE1,"Tentatively classified as benign, although Polyphen 2 predicts a damaging effect. Other recessive variants in this gene are reported to cause Emery-Dreifuss muscular dystrophy or spinocerebellar ataxia, but these are generally more severe and/or far earlier in the peptide sequence.",Low,Uncertain,Benign,0.0078,"Muscular, skeletal, and connective tissue;Nervous system",Unknown,Heterozygous,,,,,,,http://evidence.personalgenomes.org/genomes?display_genome_id=9f1c18192898dbe1e99f10048196c045b4c66152
CAPN3-T184M,CAPN3,"Probably benign -- this was implicated in Limb-girdle muscular dystrophy when homozygous (in a recessive manner), but the reports lacked statistical significance and a relatively high allele frequency (>1%) contradicts the hypothesis.",Low,Uncertain,Benign,0.013,"Muscular, skeletal, and connective tissue",Unknown,Heterozygous,10330340;15221789;16627476,rs35889956,0,chr15,42680003,T,http://evidence.personalgenomes.org/genomes?display_genome_id=9f1c18192898dbe1e99f10048196c045b4c66152
TYK2-A928V,TYK2,Probably benign.,Low,Uncertain,Benign,0.0059,Other,Unknown,Heterozygous,18270328,rs35018800,,chr19,10464843,A,http://evidence.personalgenomes.org/genomes?display_genome_id=9f1c18192898dbe1e99f10048196c045b4c66152
DOK7-P214L,DOK7,"Rare and unreported, tentatively evaluated as benign. Some severe mutations in this gene cause congenital myasthenic syndromes, but these are usually more severe (frameshift or nonsense mutatinos) and there are many other genomes with rare missense polymorphisms.",Low,Uncertain,Benign,0.001,"Muscular, skeletal, and connective tissue;Nervous system",Unknown,Heterozygous,,,,chr4,3487374,T,http://evidence.personalgenomes.org/genomes?display_genome_id=9f1c18192898dbe1e99f10048196c045b4c66152
RP1-N985Y,RP1,"Probably benign. One report linked this variant to high triglycerides, but a later paper found a nearby SNP with similar association and suggests that both findings are caused by linkage to an undiscovered causal variant.",Low,Uncertain,Benign,0.35,Metabolism,Unknown,Heterozygous,12764676;19364639,rs2293869,,chr8,55539395,T,http://evidence.personalgenomes.org/genomes?display_genome_id=9f1c18192898dbe1e99f10048196c045b4c66152
SIL1-V332M,SIL1,"Tentatively evaluated as benign. Polyphen 2 predicts damaging effect, and other recessive variants in this gene are reported to cause Marinesco-Sjogren syndrome, but these are almost all more severe (nonsense or frameshift).",Low,Uncertain,Benign,0.0078,Anatomical and congenital,Unknown,Heterozygous,,,,,,,http://evidence.personalgenomes.org/genomes?display_genome_id=9f1c18192898dbe1e99f10048196c045b4c66152
APOB-Y1422C,APOB,This position is almost certainly an error in the HG18 reference sequence. ,Low,Uncertain,Benign,1.0,Other,Unknown,Homozygous,,rs568413,,chr2,21235475,C,http://evidence.personalgenomes.org/genomes?display_genome_id=9f1c18192898dbe1e99f10048196c045b4c66152
PKP2-L366P,PKP2,This variant is a benign polymorphism.  ,Low,Uncertain,Benign,0.22,Other,Unknown,Heterozygous,19955750,rs1046116,,chr12,33021934,G,http://evidence.personalgenomes.org/genomes?display_genome_id=9f1c18192898dbe1e99f10048196c045b4c66152
DNAH5-P4488T,DNAH5,Probably benign.,Low,Uncertain,Benign,0.047,Other,Unknown,Heterozygous,,rs113425437,,chr5,13701422,T,http://evidence.personalgenomes.org/genomes?display_genome_id=9f1c18192898dbe1e99f10048196c045b4c66152
TYR-S192Y,TYR,This variant is reported to affect skin pigmentation. It is associated with lighter skin in South Asians (OR 4-5) and with a lack of freckles in Europeans (OR 1.3).,Low,Uncertain,Benign,0.27,Skin,Unknown,Heterozygous,17952075;17999355,rs1042602,,chr11,88911696,A,http://evidence.personalgenomes.org/genomes?display_genome_id=9f1c18192898dbe1e99f10048196c045b4c66152
DSPP-R68W,DSPP,"Probably benign. One report linked this to causing dentinogenesis Imperfecta type II in a large Swedish family, but subsequent publications have observed this is a common variant and conclude it is a nonpathogenic polymorphism.",Low,Uncertain,Benign,0.14,"Mouth, liver, and digestive",Unknown,Heterozygous,14758537;17452557;18797159,rs36094464,,chr4,88533540,T,http://evidence.personalgenomes.org/genomes?display_genome_id=9f1c18192898dbe1e99f10048196c045b4c66152
MLC1-N218K,MLC1,Probably benign.,Low,Uncertain,Benign,0.0029,Other,Unknown,Heterozygous,12497630,rs41302601,,chr22,50512705,T,http://evidence.personalgenomes.org/genomes?display_genome_id=9f1c18192898dbe1e99f10048196c045b4c66152
RYR1-G893S,RYR1,"Rare, tentatively evaluated as benign. Some recessive missense variants in this gene are reported to cause malignant hyperthermia and central core disease, but this variant occurs outside of the amino acid regions where these pathogenic variants typically occur.",Low,Uncertain,Benign,0.0013,"Anatomical and congenital;Muscular, skeletal, and connective tissue",Unknown,Heterozygous,10790202,,,chr19,38954162,A,http://evidence.personalgenomes.org/genomes?display_genome_id=9f1c18192898dbe1e99f10048196c045b4c66152
