variant,gene_symbol,summary,clinical_importance,evidence,impact,frequency,category,inheritance,zygosity,PMIDs,dbSNP_ID,penetrance_score,build_37_chromosome,build_37_position,build_37_variant_allele,getev_report_url
LRP5-V667M,LRP5,"This variant has been implicated in causing osteoporosis-pseudoglioma syndrome in a recessive manner. The gene is strongly implicated in causing the disease, but an insufficient number of controls means this variant's observation lacks statistical significance. The condition manifests in childhood with early onset osteoporosis and eye problems.",High,Uncertain,Pathogenic,0.041,"Hearing and vision;Muscular, skeletal, and connective tissue",Recessive,Heterozygous,11719191,rs4988321,5,chr11,68174189,A,http://evidence.pgp-hms.org/genomes?display_genome_id=6cc582f5e2c71bc1af3f2bb6381c531b1517b544
COL4A1-Q1334H,COL4A1,"This common variant has been associated with arterial stiffness and, in Japanese, a small increased risk of myocardial infarction (MI, a.k.a. heart attack). This last observation supported a dominant effect for this variant and, assuming a lifetime risk of 15% for MI, we estimate carriers have an additional risk of 0.5-3%.",Low,Likely,Pathogenic,0.32,Heart and circulatory,Dominant,Heterozygous,10334796;18077766;20031579,rs3742207,2,chr13,110818598,G,http://evidence.pgp-hms.org/genomes?display_genome_id=6cc582f5e2c71bc1af3f2bb6381c531b1517b544
MTRR-I49M,MTRR,"This common variant (HapMap allele frequency of 31.3%) in a protein involved in folate (B9) and cobalamin (B12) metabolism and is often reported as ""MTRR I22M"" (an alternative transcript position). Mothers homozygous for this variant are associated with having around a increased chance of a child with Down syndrome (risk of 0.4%, average risk in population is 0.25%). Notably, age plays a far larger role in the rate of Down syndrome (risk is 4.5% for a mother 45-years-of-age), and it is unknown how this variant may combine with the effect of age. There are conflicting reports associating this variant with incidence of neural tube defects, possibly when combined with MTHFR A222V.",Low,Likely,Pathogenic,0.45,Anatomical and congenital;Metabolism;Nervous system,Recessive,Heterozygous,10444342;10930360;11807890;12375236;15060097;15979034;17024475,rs1801394,1,chr5,7870973,G,http://evidence.pgp-hms.org/genomes?display_genome_id=6cc582f5e2c71bc1af3f2bb6381c531b1517b544
AMPD1-Q12X,AMPD1,"Causes Adenosine Deaminase Deficiency in a recessive manner. Most of the time individuals do not report symptoms, but when symptoms do exist they to be post-exercise symptoms of muscle weakness, muscle pain, and getting tired more quickly.",Low,Likely,Pathogenic,0.093,"Metabolism;Muscular, skeletal, and connective tissue",Recessive,Heterozygous,1631143,rs17602729,4,chr1,115236057,A,http://evidence.pgp-hms.org/genomes?display_genome_id=6cc582f5e2c71bc1af3f2bb6381c531b1517b544
KRT5-G138E,KRT5,"This variant is associated with 1.25x increased risk of basal cell carcinoma (common skin cancer, rarely malignant).",Low,Likely,Pathogenic,0.052,Cancer;Skin,Unknown,Heterozygous,19578363,rs11170164,3,chr12,52913668,T,http://evidence.pgp-hms.org/genomes?display_genome_id=6cc582f5e2c71bc1af3f2bb6381c531b1517b544
APOA5-S19W,APOA5,"This variant, also known as APOA5*3, is associated with higher plasma triglyceride concentrations but no significant correlation with coronary artery disease itself has been found.",Low,Likely,Pathogenic,0.065,Heart and circulatory;Metabolism,Unknown,Heterozygous,12417524;12417525;16143024;16682041;19802338,rs3135506,2,chr11,116662407,C,http://evidence.pgp-hms.org/genomes?display_genome_id=6cc582f5e2c71bc1af3f2bb6381c531b1517b544
CETP-A390P,CETP,"This variant is associated with slightly lower HDL (good) cholesterol, although it has a negligible effect (around 2 mg/dl).",Low,Likely,Pathogenic,0.039,Metabolism,Unknown,Heterozygous,17952847,rs5880,1,chr16,57015091,C,http://evidence.pgp-hms.org/genomes?display_genome_id=6cc582f5e2c71bc1af3f2bb6381c531b1517b544
ELAC2-S217L,ELAC2,"Reported to be associated with increased susceptibility to prostate cancer, but later studies weaken the hypothesis. Xu et al.'s meta-analysis concludes that there is a small but significant increased risk (OR = 1.13). Assuming a lifetime risk of 16% for prostate cancer we calculate this leads to an increased risk of ~1.5% (17.5% total).",Low,Uncertain,Pathogenic,0.27,Cancer;Genital and urinary,Complex/Other,Heterozygous,12384782;15368467;18767027;20231859,rs4792311,2,chr17,12915009,A,http://evidence.pgp-hms.org/genomes?display_genome_id=6cc582f5e2c71bc1af3f2bb6381c531b1517b544
LRP5-A1330V,LRP5,"In a study of a UK population this variant was associated with a small increased risk of osteoporosis and osteoporotic bone fractures, with each copy of the variant presumed to have an additive effect. A study in Chinese young men failed to find an association with peak bone density.

 
",Low,Uncertain,Pathogenic,0.11,"Muscular, skeletal, and connective tissue",Complex/Other,Heterozygous,18455228;19148563;20953208,rs3736228,2,chr11,68201295,T,http://evidence.pgp-hms.org/genomes?display_genome_id=6cc582f5e2c71bc1af3f2bb6381c531b1517b544
SP110-L425S,SP110,"This variant is associated with a slightly increased risk of tuberculosis. It is unclear whether it is itself causal, or in linkage disequilibrium with some other causal variant that has a stronger effect.",Low,Uncertain,Pathogenic,0.86,Immune system,Unknown,Homozygous,16803959,rs3948464,1,chr2,231050715,G,http://evidence.pgp-hms.org/genomes?display_genome_id=6cc582f5e2c71bc1af3f2bb6381c531b1517b544
TP53-P72R,TP53,"This is a common variant was first reported as a polymorphism. It has since had mixed associations with cancer: Storey et al. conclude a 7x *increased* risk of HPV cancer for homozygotes vs hets, but Jones et al. find a 1.98x *decreased* risk for colorectal cancer. This variant may have significant impact on particular cancers, but it is unclear what effect it has on the overall burden of cancer.",Low,Uncertain,Pathogenic,0.63,Cancer,Unknown,Homozygous,1975675;9607760;15355915;19837266;20615891;22184967,rs1042522,0,chr17,7579472,C,http://evidence.pgp-hms.org/genomes?display_genome_id=6cc582f5e2c71bc1af3f2bb6381c531b1517b544
WFS1-R611H,WFS1,"This nonsynonymous SNP is associated with Wolfram Syndrome (known as DIDMOAD), which is characterized by early-onset non-autoimmune diabetes mellitus, diabetes insipidus, optic atrophy, and deafness) and to adult Type Two Diabetes Mellitus.  The WFS1 gene maps to chromosome 4p16.3.  The variant has been shown to be statistically associated with type II diabetes in six UK studies and one study of Ashkenazi Jews (Sandhu, M., et al., Minton et al.).",Low,Uncertain,Not Reviewed,0.4,Hearing and vision;Immune system;Metabolism,Recessive,Heterozygous,17603484;17719176;23257691,rs734312,1,chr4,6303354,A,http://evidence.pgp-hms.org/genomes?display_genome_id=6cc582f5e2c71bc1af3f2bb6381c531b1517b544
CLEC7A-Y238X,CLEC7A,This variant has been found to impair homan mucosal antifungal defense and was implicated in vulvovaginal candidiasis and mucocutaneous infections in a Dutch family.,Low,Uncertain,Pathogenic,0.063,Genital and urinary;Skin,Recessive,Heterozygous,19864674,rs16910526,4,chr12,10271087,C,http://evidence.pgp-hms.org/genomes?display_genome_id=6cc582f5e2c71bc1af3f2bb6381c531b1517b544
ERCC6-R1213G,ERCC6,"When homozygous, this variant may cause Cockayne Syndrome, which is a severe autosomal-recessive disorder characterized by abnormal early growth and development, abnormal sensitivity to sunlight, and premature aging. Cockayne Syndrome Type I and Type II lead to death in early childhood. Several other variants in the ERCC6 gene are linked to Cockayne Syndrome. This variant may also be linked to age-related macular degeneration like other ERCC6 variants, and has been linked to colorectal cancer in one study. ",Low,Uncertain,Pathogenic,0.2,Anatomical and congenital;Cancer;Hearing and vision,Recessive,Heterozygous,,rs2228527,0,chr10,50678369,C,http://evidence.pgp-hms.org/genomes?display_genome_id=6cc582f5e2c71bc1af3f2bb6381c531b1517b544
BRCA2-N372H,BRCA2,"This is a common variant of BRCA2 (HapMap allele frequency of 23%). The variant is weakly associated with an increased chance of breast cancer, and zygosity of the variant is associated with sex of children: male children are more likely to be homozygous for this variant, female children are more likely to be heterozygous.",Low,Uncertain,Pathogenic,0.24,Cancer,Recessive,Heterozygous,11062481;15235023,rs144848,2,chr13,32906729,C,http://evidence.pgp-hms.org/genomes?display_genome_id=6cc582f5e2c71bc1af3f2bb6381c531b1517b544
FUT2-W154X,FUT2,"This recessive protective variant confers resistance to norovirus (which causes stomach flu). 20% of Caucasians and Africans are homozygous for this variant and are ""non-secretors"": they do not express ABO blood type antigens in their saliva or mucosal surfaces. Most strains of norovirus bind to these antigens in the gut, and so this non-secretor status confers almost total resistantance to most types of norovirus. There are notable exceptions, some strains of norovirus bind a different target and are equally infectious for secretors and non-secretors.",Moderate,Well-established,Protective,0.49,Blood;Immune system,Recessive,Heterozygous,7876235;12692541;19625485;20031047;22025362,rs601338,5,chr19,49206674,A,http://evidence.pgp-hms.org/genomes?display_genome_id=6cc582f5e2c71bc1af3f2bb6381c531b1517b544
CFB-R32Q,CFB,"This variant is associated with a significant protective effect -- individuals with this variant are about half as likely to have age-related macular degeneration. Appears to be an additive effect, with homozygotes having a stronger protective effect.",Moderate,Likely,Protective,0.12,Hearing and vision,Dominant,Heterozygous,16518403;16936732;19117936,rs641153,3,,,,http://evidence.pgp-hms.org/genomes?display_genome_id=6cc582f5e2c71bc1af3f2bb6381c531b1517b544
KCNJ11-K23E,KCNJ11,"This variant is associated with decreased risk of type 2 diabetes. It is unclear whether this variant has additive effects, or acts in a dominant or recessive manner. Assuming diabetes has a lifetime risk of 36%, we estimate a decreased risk of around 1-2% per copy of this variant.",Low,Likely,Protective,0.74,Metabolism,Unknown,Homozygous,17463246;17463248;20054294,rs5219,2,chr11,17409572,C,http://evidence.pgp-hms.org/genomes?display_genome_id=6cc582f5e2c71bc1af3f2bb6381c531b1517b544
TOR1A-D216H,TOR1A,This SNP has been shown to be benign and play a protective role against Dystonia.  ,Low,Likely,Protective,0.1,Nervous system,Unknown,Heterozygous,18519876;19380705;20669276,rs1801968,1,chr9,132580901,G,http://evidence.pgp-hms.org/genomes?display_genome_id=6cc582f5e2c71bc1af3f2bb6381c531b1517b544
BRCA2-T1915M,BRCA2,Serrano-Fernández et al. found this variant to be associated with a modest (OR = 1.61) but significant (P = 0.0007) reduction in breast cancer risk.  ,Low,Uncertain,Protective,0.021,Cancer,Unknown,Heterozygous,19030985,rs4987117,,chr13,32914236,T,http://evidence.pgp-hms.org/genomes?display_genome_id=6cc582f5e2c71bc1af3f2bb6381c531b1517b544
JAK3-P151R,JAK3,"Reported in ClinVar to cause Severe Combined Immunodeficiency Disease (aka ""bubble boy disease""). However the variant is carried by nearly 1 in 100 individuals with European ancestry, and 1 in 12,000 are predicted to be homozygous. The disease is extremely rare -- highest estimate is 1 in 50,000 -- the high frequency of this variant means it cannot be a cause of this disease.",Low,Likely,Benign,,Immune system,Unknown,Heterozygous,10982185;17456055,rs55778349,,,,,http://evidence.pgp-hms.org/genomes?display_genome_id=6cc582f5e2c71bc1af3f2bb6381c531b1517b544
CACNA1S-L458H,CACNA1S,Common polymorphism,Low,Likely,Benign,0.27,Other,Unknown,Heterozygous,,rs12742169,,chr1,201052310,T,http://evidence.pgp-hms.org/genomes?display_genome_id=6cc582f5e2c71bc1af3f2bb6381c531b1517b544
OCA2-R419Q,OCA2,"This variant is associated with eye color, as is OCA2 R305W. Individuals with this variant are reported to be more likely to have green/hazel eyes as opposed to blue/gray eyes. Other variants in this gene are associated with oculocutaneous albinism (albinism which involves skin and eyes).",Low,Likely,Benign,0.057,Hearing and vision;Skin,Unknown,Homozygous,12163334,rs1800407,,chr15,28230318,T,http://evidence.pgp-hms.org/genomes?display_genome_id=6cc582f5e2c71bc1af3f2bb6381c531b1517b544
NEFL-S472Shift,NEFL,"Although a frameshift in this gene would be predicted to cause Charcot-Marie Neuropathy, this particular position appears to reflect a single base insertion error/mutation in the reference genome (in other words, normal individuals are always homozygous for a deletion at this position relative to reference). See chr8:24,811,060-24,811,080 annotations on UCSC.",Low,Likely,Benign,,Nervous system,Unknown,Homozygous,,rs11340767,,,,,http://evidence.pgp-hms.org/genomes?display_genome_id=6cc582f5e2c71bc1af3f2bb6381c531b1517b544
MLH1-I219V,MLH1,"Computational evidence, functional assays, and case/control studies suggest this variant is probably benign.",Low,Uncertain,Benign,0.24,Other,Dominant,Homozygous,11781295;12810663;17074586;17510385;17870204;19863800;20301390;22631669,rs1799977,0,chr3,37053568,G,http://evidence.pgp-hms.org/genomes?display_genome_id=6cc582f5e2c71bc1af3f2bb6381c531b1517b544
RPGRIP1-A547S,RPGRIP1,"Probably benign. Implicated in causing autosomal recessive cone-rod dystrophy, but a later report found the same incidence in controls and concludes it is not causal.",Low,Uncertain,Benign,0.23,Hearing and vision,Complex/Other,Homozygous,12920076;16272259,rs10151259,,chr14,21790040,T,http://evidence.pgp-hms.org/genomes?display_genome_id=6cc582f5e2c71bc1af3f2bb6381c531b1517b544
GAA-E689K,GAA,This is also known as the GAA*4 allozyme is frequent in the Asian population and appears to have somewhat reduced enzyme activity. Kroos et al. rule out pathogenic effect.,Low,Uncertain,Benign,0.03,Other,Complex/Other,Heterozygous,18301443,rs1800309,,chr17,78087041,A,http://evidence.pgp-hms.org/genomes?display_genome_id=6cc582f5e2c71bc1af3f2bb6381c531b1517b544
TAS2R38-A49P,TAS2R38,"This variant is strongly associated with causing the ""taster"" phenotype of phenylthiocarbamine (PTC) in a dominant manner.",Low,Uncertain,Benign,0.43,Other,Unknown,Heterozygous,12595690;15883422;20675712,rs713598,,chr7,141673345,G,http://evidence.pgp-hms.org/genomes?display_genome_id=6cc582f5e2c71bc1af3f2bb6381c531b1517b544
MAPT-Q230R,MAPT,Common polymorphism.,Low,Uncertain,Benign,0.042,Other,Unknown,Heterozygous,15365985,rs63750072,,chr17,44060859,G,http://evidence.pgp-hms.org/genomes?display_genome_id=6cc582f5e2c71bc1af3f2bb6381c531b1517b544
MAPT-R370W,MAPT,Probably benign.,Low,Uncertain,Benign,0.16,Other,Unknown,Heterozygous,15365985,rs17651549,,chr17,44061278,T,http://evidence.pgp-hms.org/genomes?display_genome_id=6cc582f5e2c71bc1af3f2bb6381c531b1517b544
AMPD1-P48L,AMPD1,"Probably benign, ancestral to15173240 pathogenic Q12X mutation.",Low,Uncertain,Benign,0.094,Other,Unknown,Heterozygous,15173240,rs61752479,,chr1,115231254,A,http://evidence.pgp-hms.org/genomes?display_genome_id=6cc582f5e2c71bc1af3f2bb6381c531b1517b544
GUCY2D-A52S,GUCY2D,"One publication suggested that this variant possibly causes Leber's congenital amaurosis in a recessive manner, but the frequency data (36% in 1000 genomes) contradicts any significant pathogenic effect.",Low,Uncertain,Benign,0.21,Hearing and vision,Recessive,Heterozygous,8944027,rs61749665,,chr17,7906519,T,http://evidence.pgp-hms.org/genomes?display_genome_id=6cc582f5e2c71bc1af3f2bb6381c531b1517b544
DSP-R1537C,DSP,Probably benign / nonpathogenic.,Low,Uncertain,Benign,0.01,Other,Unknown,Homozygous,20152563,rs28763967,,chr6,7581032,T,http://evidence.pgp-hms.org/genomes?display_genome_id=6cc582f5e2c71bc1af3f2bb6381c531b1517b544
APOB-Y1422C,APOB,This position is almost certainly an error in the HG18 reference sequence. ,Low,Uncertain,Benign,1.0,Other,Unknown,Homozygous,,rs568413,,chr2,21235475,C,http://evidence.pgp-hms.org/genomes?display_genome_id=6cc582f5e2c71bc1af3f2bb6381c531b1517b544
NTRK1-H604Y,NTRK1,"Various databases and papers treat this variant as a non-pathogenic polymorphism, although it is fairly uncommon and is computational methods predict it to be damaging.",Low,Uncertain,Benign,0.043,Other,Unknown,Heterozygous,10443680;16412461;21228398,rs6336,,chr1,156848918,T,http://evidence.pgp-hms.org/genomes?display_genome_id=6cc582f5e2c71bc1af3f2bb6381c531b1517b544
NTRK1-G613V,NTRK1,"Also called G607V, this variant has been reported as a nonpathogenic polymorphism.",Low,Uncertain,Benign,0.043,Other,Unknown,Heterozygous,10330344;10443680;11159935,rs6339,,chr1,156848946,T,http://evidence.pgp-hms.org/genomes?display_genome_id=6cc582f5e2c71bc1af3f2bb6381c531b1517b544
SLC45A2-L374F,SLC45A2,"Pigmentation allele for non-black hair, and consequently, possible increased susceptibility to malignant melanoma.",Low,Uncertain,Benign,0.69,Cancer,Unknown,Homozygous,15714523;17044855;18563784;18806926,rs16891982,,chr5,33951693,G,http://evidence.pgp-hms.org/genomes?display_genome_id=6cc582f5e2c71bc1af3f2bb6381c531b1517b544
PHYH-P29S,PHYH,"Probably benign. This variant was implicated as causing Refsum Disease in a recessive manner, but a subsequent publication noted that all instances were linked with other explanatory mutations. The high allele frequency of this variant in the population (7-13%) contradicts a pathogenic hypothesis.",Low,Uncertain,Benign,0.16,Nervous system,Unknown,Heterozygous,10767344;14974078,rs28938169,0,chr10,13340236,A,http://evidence.pgp-hms.org/genomes?display_genome_id=6cc582f5e2c71bc1af3f2bb6381c531b1517b544
PCSK9-G670E,PCSK9,This variant is likely benign. ,Low,Uncertain,Benign,0.89,Other,Unknown,Homozygous,19351729,rs505151,,chr1,55529187,A,http://evidence.pgp-hms.org/genomes?display_genome_id=6cc582f5e2c71bc1af3f2bb6381c531b1517b544
TAS2R38-I296V,TAS2R38,"This variant is associated with ""taster"" status of PTC, along with 49P and 262A. Due to linkage disequilibrium, the independent effects of positions 296 and 262 is unclear. The presence of 49P confers taster status in a dominant fashion, but in the absence of 49P, the presence of 262A/296V is still positively associated with tasting PTC.",Low,Uncertain,Benign,0.46,Other,Unknown,Heterozygous,12595690;20675712,rs10246939,,chr7,141672604,C,http://evidence.pgp-hms.org/genomes?display_genome_id=6cc582f5e2c71bc1af3f2bb6381c531b1517b544
