variant,gene_symbol,summary,clinical_importance,evidence,impact,frequency,category,inheritance,zygosity,PMIDs,dbSNP_ID,penetrance_score,build_37_chromosome,build_37_position,build_37_variant_allele,getev_report_url
ACTN2-Q9R,ACTN2,"Hypothesized to cause dilated cardiomyopathy in a dominant manner, but observations lack statistical significance.",High,Uncertain,Pathogenic,0.00056,"Heart and circulatory;Muscular, skeletal, and connective tissue;Nervous system",Dominant,Heterozygous,14567970,rs121434525,5,chr1,236849999,G,http://evidence.personalgenomes.org/genomes?display_genome_id=82c71a90fd03d901ca24c3cfe274460775229ec5
TGM1-E520G,TGM1,"This variant was found in three individuals with lamellar ichthyosis (two homozygous and one compound het.) in two publications, but insufficient controls makes it difficult to assess significance.",Moderate,Uncertain,Pathogenic,0.0064,Skin,Recessive,Heterozygous,11348475;19241467,,5,chr14,24724656,C,http://evidence.personalgenomes.org/genomes?display_genome_id=82c71a90fd03d901ca24c3cfe274460775229ec5
PPARG-P12A,PPARG,,Moderate,Uncertain,Not Reviewed,0.089,Other,Unknown,Heterozygous,16783862;17213274;17463248,rs1801282,3,chr3,12393125,G,http://evidence.personalgenomes.org/genomes?display_genome_id=82c71a90fd03d901ca24c3cfe274460775229ec5
MTRR-I49M,MTRR,"This common variant (HapMap allele frequency of 31.3%) in a protein involved in folate (B9) and cobalamin (B12) metabolism and is often reported as ""MTRR I22M"" (an alternative transcript position). Mothers homozygous for this variant are associated with having around a increased chance of a child with Down syndrome (risk of 0.4%, average risk in population is 0.25%). Notably, age plays a far larger role in the rate of Down syndrome (risk is 4.5% for a mother 45-years-of-age), and it is unknown how this variant may combine with the effect of age. There are conflicting reports associating this variant with incidence of neural tube defects, possibly when combined with MTHFR A222V.",Low,Likely,Pathogenic,0.45,Anatomical and congenital;Metabolism;Nervous system,Recessive,Homozygous,10444342;10930360;11807890;12375236;15060097;15979034;17024475,rs1801394,1,chr5,7870973,G,http://evidence.personalgenomes.org/genomes?display_genome_id=82c71a90fd03d901ca24c3cfe274460775229ec5
COL4A1-Q1334H,COL4A1,"This common variant has been associated with arterial stiffness and, in Japanese, a small increased risk of myocardial infarction (MI, a.k.a. heart attack). This last observation supported a dominant effect for this variant and, assuming a lifetime risk of 15% for MI, we estimate carriers have an additional risk of 0.5-3%.",Low,Likely,Pathogenic,0.32,Heart and circulatory,Dominant,Homozygous,10334796;18077766;20031579,rs3742207,2,chr13,110818598,G,http://evidence.personalgenomes.org/genomes?display_genome_id=82c71a90fd03d901ca24c3cfe274460775229ec5
MBL2-R52C,MBL2,"This variant is associated with mannose binding protein deficiency which leads to impaired complement system immune response to mannose-rich pathogens. Patients homozygous for this allele or compound heterozygous are likely to have increased susceptibility to infection, but Hellemann et al. report heterosis for intensive care outcomes in heterozygous subjects. The wild-type version of this gene is known as variant allele A, while this is called variant allele D. See G54D (variant B) and G57E (variant C).",Low,Likely,Pathogenic,0.049,Immune system,Recessive,Heterozygous,7564730;10199352;17872904,rs5030737,1,chr10,54531242,A,http://evidence.personalgenomes.org/genomes?display_genome_id=82c71a90fd03d901ca24c3cfe274460775229ec5
AMPD1-Q12X,AMPD1,"Causes Adenosine Deaminase Deficiency in a recessive manner. Most of the time individuals do not report symptoms, but when symptoms do exist they to be post-exercise symptoms of muscle weakness, muscle pain, and getting tired more quickly.",Low,Likely,Pathogenic,0.093,"Metabolism;Muscular, skeletal, and connective tissue",Recessive,Heterozygous,1631143,rs17602729,4,chr1,115236057,A,http://evidence.personalgenomes.org/genomes?display_genome_id=82c71a90fd03d901ca24c3cfe274460775229ec5
TNFRSF13B-C104R,TNFRSF13B,"Hypothesized to cause common variable immunodeficiency (CVID) in a dominant manner, but observations lack statistical significance and the frequency of people having this variant (0.8%) is much higher than the prevalence of the disease (0.002%). If this variant is associated with increased risk, carriers of this variant must still have an extremely low chance of developing CVID. Other genetic factors may be necessary.",Low,Uncertain,Pathogenic,0.004,Immune system,Dominant,Heterozygous,16007086;16007087;17492055,rs34557412,1,chr17,16852187,G,http://evidence.personalgenomes.org/genomes?display_genome_id=82c71a90fd03d901ca24c3cfe274460775229ec5
LRP5-A1330V,LRP5,"In a study of a UK population this variant was associated with a small increased risk of osteoporosis and osteoporotic bone fractures, with each copy of the variant presumed to have an additive effect. A study in Chinese young men failed to find an association with peak bone density.

 
",Low,Uncertain,Pathogenic,0.11,"Muscular, skeletal, and connective tissue",Complex/Other,Heterozygous,18455228;19148563;20953208,rs3736228,2,chr11,68201295,T,http://evidence.personalgenomes.org/genomes?display_genome_id=82c71a90fd03d901ca24c3cfe274460775229ec5
TLR5-R392X,TLR5,"This variant is believed to impair the ability to generate an immune response to the flagella of the bacteria. It is weakly associated with an increased incidence of Legionnaires' Disease, p = 0.085, increased lifetime risk of disease ~0.88% (about twice average). The variant is also weakly associated with a reduced incidence of systemic lupus erythematosus, p = 0.165.",Low,Uncertain,Pathogenic,0.044,Immune system,Complex/Other,Heterozygous,14623910;16027372;17516623;18230059,rs5744168,1,chr1,223285200,A,http://evidence.personalgenomes.org/genomes?display_genome_id=82c71a90fd03d901ca24c3cfe274460775229ec5
RNASEL-R462Q,RNASEL,"Associated with increased risk of prostate cancer in individuals who already have a family history of prostate cancer, but studies have been unable to replicate this finding in sporadic (non-familial) prostate cancer cases.",Low,Uncertain,Pathogenic,0.28,Cancer;Genital and urinary,Complex/Other,Heterozygous,11941539;12022038;12415269;17407163,rs486907,2,chr1,182554557,T,http://evidence.personalgenomes.org/genomes?display_genome_id=82c71a90fd03d901ca24c3cfe274460775229ec5
TP53-P72R,TP53,"This is a common variant was first reported as a polymorphism. It has since had mixed associations with cancer: Storey et al. conclude a 7x *increased* risk of HPV cancer for homozygotes vs hets, but Jones et al. find a 1.98x *decreased* risk for colorectal cancer. This variant may have significant impact on particular cancers, but it is unclear what effect it has on the overall burden of cancer.",Low,Uncertain,Pathogenic,0.63,Cancer,Unknown,Heterozygous,1975675;9607760;15355915;19837266;20615891;22184967,rs1042522,0,chr17,7579472,C,http://evidence.personalgenomes.org/genomes?display_genome_id=82c71a90fd03d901ca24c3cfe274460775229ec5
HFE-H63D,HFE,"There have been some hypotheses that this variant contributes to causing hereditary hemochromatosis, possibly as a compound heterozygote, but some others treat it as a polymorphism. Cys282Tyr is the classic causal variant and itself has very low penetrance. Mouse studies indicates this variant has a similar but weaker effect; if it has any effect at all its penetrance may be quite low and/or require modifier alleles.",Low,Uncertain,Pathogenic,0.11,Blood,Recessive,Heterozygous,8696333;9462220;12429850;14673107;17042772,rs1799945,1,chr6,26091179,G,http://evidence.personalgenomes.org/genomes?display_genome_id=82c71a90fd03d901ca24c3cfe274460775229ec5
SP110-L425S,SP110,"This variant is associated with a slightly increased risk of tuberculosis. It is unclear whether it is itself causal, or in linkage disequilibrium with some other causal variant that has a stronger effect.",Low,Uncertain,Pathogenic,0.86,Immune system,Unknown,Homozygous,16803959,rs3948464,1,chr2,231050715,G,http://evidence.personalgenomes.org/genomes?display_genome_id=82c71a90fd03d901ca24c3cfe274460775229ec5
ITPA-P32T,ITPA,"This variant is associated with inosine triphosphate pyrophosphohydrolase deficiency and may be associated with an adverse reaction to thiopurine drugs (which are used as immunosuppressants). Homozygotes have no detectable ITPase activity, individuals compound heterozygous with another less severe mutation also have severely reduced enzyme activity.",Low,Well-established,Pharmacogenetic,0.061,Drug response;Immune system;Metabolism,Recessive,Heterozygous,12384777;15322947;17924837;19631656;19682085;20173735,rs1127354,1,chr20,3193842,A,http://evidence.personalgenomes.org/genomes?display_genome_id=82c71a90fd03d901ca24c3cfe274460775229ec5
KCNE2-T8A,KCNE2,"Found in about 1% of individuals, probably has no clinically significant effect. One group proposed that this variant may cause increased susceptibility to drug-induced arrhythmia, but this conclusion is not supported (and perhaps slightly contradicted) by their reported observations of the variant in clinical cases.",Low,Uncertain,Pharmacogenetic,0.0045,Drug response;Heart and circulatory,Dominant,Heterozygous,10984545,rs2234916,2,chr21,35742799,G,http://evidence.personalgenomes.org/genomes?display_genome_id=82c71a90fd03d901ca24c3cfe274460775229ec5
rs1544410,,"rs1544410 is a Vitamin D Receptor (VDR) single nucleotide polymorphism. It is unlikely that it has functional significance because it is located in an intron (Liu et. al.), but it is in strong linkage disequilibrium with rs731236 (Dvornyk et al), which is located in an exon. ",Low,Uncertain,Pharmacogenetic,0.35,Other,Unknown,Heterozygous,,rs1544410,0,,,,http://evidence.personalgenomes.org/genomes?display_genome_id=82c71a90fd03d901ca24c3cfe274460775229ec5
FUT2-W154X,FUT2,"This recessive protective variant confers resistance to norovirus (which causes stomach flu). 20% of Caucasians and Africans are homozygous for this variant and are ""non-secretors"": they do not express ABO blood type antigens in their saliva or mucosal surfaces. Most strains of norovirus bind to these antigens in the gut, and so this non-secretor status confers almost total resistantance to most types of norovirus. There are notable exceptions, some strains of norovirus bind a different target and are equally infectious for secretors and non-secretors.",Moderate,Well-established,Protective,0.49,Blood;Immune system,Recessive,Homozygous,7876235;12692541;19625485;20031047;22025362,rs601338,5,chr19,49206674,A,http://evidence.personalgenomes.org/genomes?display_genome_id=82c71a90fd03d901ca24c3cfe274460775229ec5
NPC1-H215R,NPC1,"This variant is associated with a reduced risk of obesity, with an additive effect of -0.084 BMI per allele (an average of 0.54 pounds less, per allele, in a 5'6"" individual).





",Low,Likely,Protective,0.3,Metabolism,Complex/Other,Heterozygous,19151714;19174833;19910939,rs1805081,2,chr18,21140432,C,http://evidence.personalgenomes.org/genomes?display_genome_id=82c71a90fd03d901ca24c3cfe274460775229ec5
KCNJ11-K23E,KCNJ11,"This variant is associated with decreased risk of type 2 diabetes. It is unclear whether this variant has additive effects, or acts in a dominant or recessive manner. Assuming diabetes has a lifetime risk of 36%, we estimate a decreased risk of around 1-2% per copy of this variant.",Low,Likely,Protective,0.74,Metabolism,Unknown,Homozygous,17463246;17463248;20054294,rs5219,2,chr11,17409572,C,http://evidence.personalgenomes.org/genomes?display_genome_id=82c71a90fd03d901ca24c3cfe274460775229ec5
TOR1A-D216H,TOR1A,This SNP has been shown to be benign and play a protective role against Dystonia.  ,Low,Likely,Protective,0.1,Nervous system,Unknown,Heterozygous,18519876;19380705;20669276,rs1801968,1,chr9,132580901,G,http://evidence.personalgenomes.org/genomes?display_genome_id=82c71a90fd03d901ca24c3cfe274460775229ec5
DTNBP1-P272S,DTNBP1,Possibly a slight protective effect against colorectal cancer if homozygous.,Low,Uncertain,Protective,0.035,Cancer,Recessive,Heterozygous,17000706,rs17470454,2,chr6,15523448,A,http://evidence.personalgenomes.org/genomes?display_genome_id=82c71a90fd03d901ca24c3cfe274460775229ec5
IRS2-G1057D,IRS2,"a.k.a Gly1057Asp, insulin receptor substrate-2 IRS2. The rs1805097(G) allele is associated with the Gly, and the (A) allele with Asp. 
A longevity study concluded that rs1805097(A;A) individuals were about twice as likely to live over 85 y/o (odds ratio 2.03, CI:1.39-2.99, p = .0003). ",Low,Uncertain,Protective,0.23,Other,Unknown,Heterozygous,19887537,rs1805097,,chr13,110435231,T,http://evidence.personalgenomes.org/genomes?display_genome_id=82c71a90fd03d901ca24c3cfe274460775229ec5
RPGRIP1-A547S,RPGRIP1,"Probably benign. Implicated in causing autosomal recessive cone-rod dystrophy, but a later report found the same incidence in controls and concludes it is not causal.",Low,Uncertain,Benign,0.23,Hearing and vision,Complex/Other,Heterozygous,12920076;16272259,rs10151259,,chr14,21790040,T,http://evidence.personalgenomes.org/genomes?display_genome_id=82c71a90fd03d901ca24c3cfe274460775229ec5
COL7A1-P1277L,COL7A1,"Polymorphism, presumed benign.",Low,Uncertain,Benign,0.041,Other,Unknown,Heterozygous,,rs35761247,,chr3,48623124,A,http://evidence.personalgenomes.org/genomes?display_genome_id=82c71a90fd03d901ca24c3cfe274460775229ec5
TPCN2-G734E,TPCN2,Pigmentation allele.,Low,Uncertain,Benign,0.29,Other,Unknown,Heterozygous,18488028,rs3829241,,chr11,68855363,A,http://evidence.personalgenomes.org/genomes?display_genome_id=82c71a90fd03d901ca24c3cfe274460775229ec5
WDR36-H212P,WDR36,Probably benign.,Low,Uncertain,Benign,0.00047,Other,Unknown,Heterozygous,18172102;19150991,,,chr5,110436345,C,http://evidence.personalgenomes.org/genomes?display_genome_id=82c71a90fd03d901ca24c3cfe274460775229ec5
DSP-R1537C,DSP,Probably benign / nonpathogenic.,Low,Uncertain,Benign,0.01,Other,Unknown,Heterozygous,20152563,rs28763967,,chr6,7581032,T,http://evidence.personalgenomes.org/genomes?display_genome_id=82c71a90fd03d901ca24c3cfe274460775229ec5
AMPD1-P48L,AMPD1,"Probably benign, ancestral to15173240 pathogenic Q12X mutation.",Low,Uncertain,Benign,0.094,Other,Unknown,Heterozygous,15173240,rs61752479,,chr1,115231254,A,http://evidence.personalgenomes.org/genomes?display_genome_id=82c71a90fd03d901ca24c3cfe274460775229ec5
TAS2R38-I296V,TAS2R38,"This variant is associated with ""taster"" status of PTC, along with 49P and 262A. Due to linkage disequilibrium, the independent effects of positions 296 and 262 is unclear. The presence of 49P confers taster status in a dominant fashion, but in the absence of 49P, the presence of 262A/296V is still positively associated with tasting PTC.",Low,Uncertain,Benign,0.46,Other,Unknown,Heterozygous,12595690;20675712,rs10246939,,chr7,141672604,C,http://evidence.personalgenomes.org/genomes?display_genome_id=82c71a90fd03d901ca24c3cfe274460775229ec5
APOB-Y1422C,APOB,This position is almost certainly an error in the HG18 reference sequence. ,Low,Uncertain,Benign,1.0,Other,Unknown,Homozygous,,rs568413,,chr2,21235475,C,http://evidence.personalgenomes.org/genomes?display_genome_id=82c71a90fd03d901ca24c3cfe274460775229ec5
PTCH1-P1315L,PTCH1,"Common polymorphism, presumed benign.",Low,Uncertain,Benign,0.3,Other,Unknown,Heterozygous,15712338,rs357564,,chr9,98209594,A,http://evidence.personalgenomes.org/genomes?display_genome_id=82c71a90fd03d901ca24c3cfe274460775229ec5
PCSK9-G670E,PCSK9,This variant is likely benign. ,Low,Uncertain,Benign,0.89,Other,Unknown,Homozygous,19351729,rs505151,,chr1,55529187,A,http://evidence.personalgenomes.org/genomes?display_genome_id=82c71a90fd03d901ca24c3cfe274460775229ec5
RP1-N985Y,RP1,"Probably benign. One report linked this variant to high triglycerides, but a later paper found a nearby SNP with similar association and suggests that both findings are caused by linkage to an undiscovered causal variant.",Low,Uncertain,Benign,0.35,Metabolism,Unknown,Homozygous,12764676;19364639,rs2293869,,chr8,55539395,T,http://evidence.personalgenomes.org/genomes?display_genome_id=82c71a90fd03d901ca24c3cfe274460775229ec5
SLC45A2-L374F,SLC45A2,"Pigmentation allele for non-black hair, and consequently, possible increased susceptibility to malignant melanoma.",Low,Uncertain,Benign,0.69,Cancer,Unknown,Homozygous,15714523;17044855;18563784;18806926,rs16891982,,chr5,33951693,G,http://evidence.personalgenomes.org/genomes?display_genome_id=82c71a90fd03d901ca24c3cfe274460775229ec5
TAS2R38-A49P,TAS2R38,"This variant is strongly associated with causing the ""taster"" phenotype of phenylthiocarbamine (PTC) in a dominant manner.",Low,Uncertain,Benign,0.43,Other,Unknown,Heterozygous,12595690;15883422;20675712,rs713598,,chr7,141673345,G,http://evidence.personalgenomes.org/genomes?display_genome_id=82c71a90fd03d901ca24c3cfe274460775229ec5
GUCY2D-A52S,GUCY2D,"One publication suggested that this variant possibly causes Leber's congenital amaurosis in a recessive manner, but the frequency data (36% in 1000 genomes) contradicts any significant pathogenic effect.",Low,Uncertain,Benign,0.21,Hearing and vision,Recessive,Heterozygous,8944027,rs61749665,,chr17,7906519,T,http://evidence.personalgenomes.org/genomes?display_genome_id=82c71a90fd03d901ca24c3cfe274460775229ec5
FMO3-V257M,FMO3,"This common variant (HapMap allele frequency of 9.2%) appears to have no functional effect. OMIM has recorded it as having been seen homozygously in an individual with Trimethylaminuria, but Treacy et al. 1998 conclude it is a polymorphism.",Low,Uncertain,Benign,0.057,Metabolism,Unknown,Heterozygous,9536088,rs1736557,,chr1,171080080,A,http://evidence.personalgenomes.org/genomes?display_genome_id=82c71a90fd03d901ca24c3cfe274460775229ec5
