variant,gene_symbol,summary,clinical_importance,evidence,impact,frequency,category,inheritance,zygosity,PMIDs,dbSNP_ID,penetrance_score,build_37_chromosome,build_37_position,build_37_variant_allele
CFTR-G576A,CFTR,Associated with causing congenital bilateral absence of the vas deferens in a recessive manner. Reported cases were compound heterozygous with CFTR-F508Del.,High,Likely,Pathogenic,0.0047,Other,Recessive,Heterozygous,1545465;12719375,rs1800098,5,chr7,117230454,C
SYNE1-E6786Shift,SYNE1,"This may be rare and may cause cerebellar ataxia in a recessive manner. This is a disruptive variant, but most of reported causal variants have been upstream of this position -- the few reports of causal downstream variants lack statistical significance. This protein is very large, it's possible that truncating variants this far along in the product do not have as severe an effect.",Moderate,Uncertain,Pathogenic,,Nervous system,Recessive,Heterozygous,17159980,,5,,,
MTRR-I49M,MTRR,"This common variant (HapMap allele frequency of 31.3%) in a protein involved in folate (B9) and cobalamin (B12) metabolism and is often reported as ""MTRR I22M"" (an alternative transcript position). Mothers homozygous for this variant are associated with having around a increased chance of a child with Down syndrome (risk of 0.4%, average risk in population is 0.25%). Notably, age plays a far larger role in the rate of Down syndrome (risk is 4.5% for a mother 45-years-of-age), and it is unknown how this variant may combine with the effect of age. There are conflicting reports associating this variant with incidence of neural tube defects, possibly when combined with MTHFR A222V.",Low,Likely,Pathogenic,0.45,Anatomical and congenital;Metabolism;Nervous system,Recessive,Homozygous,10444342;10930360;11807890;12375236;15060097;15979034;17024475,rs1801394,1,chr5,7870973,G
COL4A1-Q1334H,COL4A1,"This common variant has been associated with arterial stiffness and, in Japanese, a small increased risk of myocardial infarction (MI, a.k.a. heart attack). This last observation supported a dominant effect for this variant and, assuming a lifetime risk of 15% for MI, we estimate carriers have an additional risk of 0.5-3%.",Low,Likely,Pathogenic,0.32,Heart and circulatory,Dominant,Homozygous,10334796;18077766;20031579,rs3742207,2,chr13,110818598,G
CETP-A390P,CETP,"This variant is associated with slightly lower HDL (good) cholesterol, although it has a negligible effect (around 2 mg/dl).",Low,Likely,Pathogenic,0.039,Metabolism,Unknown,Heterozygous,17952847,rs5880,1,chr16,57015091,C
APOA5-S19W,APOA5,"This variant, also known as APOA5*3, is associated with higher plasma triglyceride concentrations but no significant correlation with coronary artery disease itself has been found.",Low,Likely,Pathogenic,0.065,Heart and circulatory;Metabolism,Unknown,Homozygous,12417524;12417525;16143024;16682041;19802338,rs3135506,2,chr11,116662407,C
RNASEL-R462Q,RNASEL,"Associated with increased risk of prostate cancer in individuals who already have a family history of prostate cancer, but studies have been unable to replicate this finding in sporadic (non-familial) prostate cancer cases.",Low,Uncertain,Pathogenic,0.28,Cancer;Genital and urinary,Complex/Other,Homozygous,11941539;12022038;12415269;17407163,rs486907,2,chr1,182554557,T
WFS1-R611H,WFS1,"This nonsynonymous SNP is associated with Wolfram Syndrome (known as DIDMOAD), which is characterized by early-onset non-autoimmune diabetes mellitus, diabetes insipidus, optic atrophy, and deafness) and to adult Type Two Diabetes Mellitus.  The WFS1 gene maps to chromosome 4p16.3.  The variant has been shown to be statistically associated with type II diabetes in six UK studies and one study of Ashkenazi Jews (Sandhu, M., et al., Minton et al.).",Low,Uncertain,Not Reviewed,0.4,Hearing and vision;Immune system;Metabolism,Recessive,Heterozygous,17603484;17719176;23257691,rs734312,1,chr4,6303354,A
MPO-Y173C,MPO,"This variant is reported to cause MPO-deficiency, which is generally asymptomatic. MPO-deficiency may cause increased susceptibility to immunodeficiency or antibacterial immune response, but most people with MPO deficiency have no symptoms. This gene is likely to be redundant with other immune mechanisms, and individuals who did have symptoms possibly had additional pathogenic variants in other genes.",Low,Uncertain,Pathogenic,0.00056,Immune system,Recessive,Heterozygous,9637725,rs78950939,1,chr17,56356914,C
SP110-L425S,SP110,"This variant is associated with a slightly increased risk of tuberculosis. It is unclear whether it is itself causal, or in linkage disequilibrium with some other causal variant that has a stronger effect.",Low,Uncertain,Pathogenic,0.86,Immune system,Unknown,Homozygous,16803959,rs3948464,1,chr2,231050715,G
TP53-P72R,TP53,"This is a common variant was first reported as a polymorphism. It has since had mixed associations with cancer: Storey et al. conclude a 7x *increased* risk of HPV cancer for homozygotes vs hets, but Jones et al. find a 1.98x *decreased* risk for colorectal cancer. This variant may have significant impact on particular cancers, but it is unclear what effect it has on the overall burden of cancer.",Low,Uncertain,Pathogenic,0.63,Cancer,Unknown,Homozygous,1975675;9607760;15355915;19837266;20615891;22184967,rs1042522,0,chr17,7579472,C
H6PD-R453Q,H6PD,"This common variant may have a small pathogenic effect by contributing to cortisone reductase deficiency (a rare abnormality) when homozygous and combined with a serious pathogenic variant. The same authors have tested and ruled out a contribution to polycystic ovary syndrome (similar phenotype, more common disease).",Low,Uncertain,Pathogenic,0.31,Genital and urinary;Metabolism,Recessive,Heterozygous,12858176;15827106;16817821,rs6688832,1,chr1,9323910,A
ERCC6-R1213G,ERCC6,"When homozygous, this variant may cause Cockayne Syndrome, which is a severe autosomal-recessive disorder characterized by abnormal early growth and development, abnormal sensitivity to sunlight, and premature aging. Cockayne Syndrome Type I and Type II lead to death in early childhood. Several other variants in the ERCC6 gene are linked to Cockayne Syndrome. This variant may also be linked to age-related macular degeneration like other ERCC6 variants, and has been linked to colorectal cancer in one study. ",Low,Uncertain,Pathogenic,0.2,Anatomical and congenital;Cancer;Hearing and vision,Recessive,Heterozygous,,rs2228527,0,chr10,50678369,C
BRCA2-N372H,BRCA2,"This is a common variant of BRCA2 (HapMap allele frequency of 23%). The variant is weakly associated with an increased chance of breast cancer, and zygosity of the variant is associated with sex of children: male children are more likely to be homozygous for this variant, female children are more likely to be heterozygous.",Low,Uncertain,Pathogenic,0.24,Cancer,Recessive,Heterozygous,11062481;15235023,rs144848,2,chr13,32906729,C
DYX1C1-E417X,DYX1C1,"One study reports this variant to be associated with dyslexia. The study group was relatively small and so the results did not have strong significance. If they are representative this variant is associated with a doubled risk for dyslexia, but it is unclear whether the effect would be additive, dominant, or recessive.",Low,Uncertain,Pathogenic,0.2,Mental and behavioral,Unknown,Heterozygous,12954984,rs57809907,3,chr15,55722882,A
rs1544410,,"rs1544410 is a Vitamin D Receptor (VDR) single nucleotide polymorphism. It is unlikely that it has functional significance because it is located in an intron (Liu et. al.), but it is in strong linkage disequilibrium with rs731236 (Dvornyk et al), which is located in an exon. ",Low,Uncertain,Pharmacogenetic,0.35,Other,Unknown,Heterozygous,,rs1544410,0,,,
FUT2-W154X,FUT2,"This recessive protective variant confers resistance to norovirus (which causes stomach flu). 20% of Caucasians and Africans are homozygous for this variant and are ""non-secretors"": they do not express ABO blood type antigens in their saliva or mucosal surfaces. Most strains of norovirus bind to these antigens in the gut, and so this non-secretor status confers almost total resistantance to most types of norovirus. There are notable exceptions, some strains of norovirus bind a different target and are equally infectious for secretors and non-secretors.",Moderate,Well-established,Protective,0.49,Blood;Immune system,Recessive,Homozygous,7876235;12692541;19625485;20031047;22025362,rs601338,5,chr19,49206674,A
PRNP-M129V,PRNP,"This variant is associated with some protective effects for prion disease -- individuals homozygous for this variant are less susceptible to Creutzfeldt-Jakob, and Papua New Guinea individuals heterozygotes at this site are less susceptible to kuru.

",Low,Well-established,Protective,0.34,Other,Complex/Other,Heterozygous,18236005;19081515,rs1799990,0,chr20,4680251,G
CFH-V62I,CFH,"Associated with a decreased risk for age related macular degeneration (ARMD). Homozygotes for this have a 4-5% decreased attributable risk (3-4% vs. average 8% risk), heterozygotes have slightly lower than average risk (7%). Non-carriers have an increased risk (12-13%). ARMD impairs sharp vision as age progresses. While there is no cure, treatment can slow progression of the disease and environmental factors (smoking and obesity) contribute to higher risk.",Low,Likely,Protective,0.39,Hearing and vision;Metabolism,Complex/Other,Heterozygous,15870199,rs800292,2,chr1,196642233,A
NPC1-H215R,NPC1,"This variant is associated with a reduced risk of obesity, with an additive effect of -0.084 BMI per allele (an average of 0.54 pounds less, per allele, in a 5'6"" individual).





",Low,Likely,Protective,0.3,Metabolism,Complex/Other,Heterozygous,19151714;19174833;19910939,rs1805081,2,chr18,21140432,C
MTR-D919G,MTR,"This variant was weakly associated with a protective effect vs. colorectal cancer, but only in individuals with low alcohol consumption.


",Low,Uncertain,Protective,0.22,Cancer,Complex/Other,Heterozygous,10498402;14744749;17417062;17855192,rs1805087,1,chr1,237048500,G
ARSA-N350S,ARSA,This common variant (HapMap 24.1% allele frequency) causes a loss of a glycosylation site (affecting the size of the protein when studied with gel electrophoresis) but does not affect enzyme activity or stability.,Low,Well-established,Benign,0.18,Other,Unknown,Heterozygous,2574462,rs2071421,,chr22,51064416,C
CACNA1S-L458H,CACNA1S,Common polymorphism,Low,Likely,Benign,0.27,Other,Unknown,Heterozygous,,rs12742169,,chr1,201052310,T
DMD-R2155W,DMD,Probably benign.,Low,Likely,Benign,0.027,Other,Unknown,Homozygous,9298822,rs1800273,,chrX,31986607,A
FLT4-N149D,FLT4,"Other severe variants in this gene are implicated in causing Milroy Disease (primary lymphedema) in a recessive manner. Although this variant is rare (2.3% allele frequency), it is still common enough that it is highly unlikely to have a severe, high penetrance pathogenic effect.",Low,Likely,Benign,0.073,Blood,Unknown,Heterozygous,11292664,rs34221241,,chr5,180057293,C
PMS2-P470S,PMS2,"Benign, common variant.",Low,Likely,Benign,0.37,Other,Unknown,Heterozygous,15256438,rs1805321,,chr7,6026988,A
KEL-T193M,KEL,This variant is also known as Kell or K1 or K (capitalized) in the Kell antigen system. K1-negative mothers (carrying no copies of this variant) carrying K1-positive fetuses (heterozygous or homozygous) are at risk for hemolytic disease of the newborn. About 9% of caucasians carry one or two copies of K1.,Low,Uncertain,Benign,0.032,Blood,Dominant,Heterozygous,7849312,rs8176058,,chr7,142655008,A
RPGRIP1-A547S,RPGRIP1,"Probably benign. Implicated in causing autosomal recessive cone-rod dystrophy, but a later report found the same incidence in controls and concludes it is not causal.",Low,Uncertain,Benign,0.23,Hearing and vision,Complex/Other,Heterozygous,12920076;16272259,rs10151259,,chr14,21790040,T
GAA-D91N,GAA,"This is a rare but non-pathogenic coding polymorphism in GAA that creates variant allozyme, known as GAA*2.

 
",Low,Uncertain,Benign,0.024,Other,Recessive,Heterozygous,16359900,rs1800299,,chr17,78078656,A
GJB3-R32W,GJB3,"Probably benign. Although Polyphen 2 predicts it be damaging and some publications suggested it might have a functional effect, others report it to be a fairly common polymorphism and functional studies failed to find a difference between it and wild type.",Low,Uncertain,Benign,0.022,Other,Unknown,Heterozygous,10888284;11175305;12702148,rs1805063,,chr1,35250457,T
PKHD1-G2285E,PKHD1,"Tentatively classified as benign. Computationally predicted to be disruptive, but this has been seen twice in various unaffected controls and has not among published patients with autosomal recessive polycystic kidney disease, significantly contradicting a severe pathogenic effect.",Low,Uncertain,Benign,0.0022,Genital and urinary,Unknown,Heterozygous,15805161,,,chr6,51768795,T
ENPP1-R774C,ENPP1,"Tentatively classified as benign. Initially reported as a recessive cause of infantile arterial calcification, but with no statistical significance. Other variants have been implicated as causal in these cases this variant. 5% allele frequency in caucasians contradicts this variant as having any highly pathogenic effect.",Low,Uncertain,Benign,0.026,Heart and circulatory,Unknown,Heterozygous,12881724;20137773,rs28933977,0,chr6,132206079,T
COL5A2-P460S,COL5A2,"Tentatively benign. Although predicted to be damaging by Polyphen 2, this variant is seen in 2 out of 62 PGP & public genomes. OMIM lists other more disruptive variants (frameshift & nonsense) as reported to cause Ehlers-Danlos syndrome when homozygous.",Low,Uncertain,Benign,0.04,"Muscular, skeletal, and connective tissue",Unknown,Heterozygous,,rs35830636,,chr2,189932764,A
POLG2-G416A,POLG2,"Rare but presumed benign. It was believed to be non-causal in a patient with a different mutation, and functional analysis found no difference from wild type.",Low,Uncertain,Benign,0.012,Other,Unknown,Heterozygous,18195150,rs17850455,,chr17,62476451,G
PKP2-L366P,PKP2,This variant is a benign polymorphism.  ,Low,Uncertain,Benign,0.22,Other,Unknown,Heterozygous,19955750,rs1046116,,chr12,33021934,G
DSPP-R68W,DSPP,"Probably benign. One report linked this to causing dentinogenesis Imperfecta type II in a large Swedish family, but subsequent publications have observed this is a common variant and conclude it is a nonpathogenic polymorphism.",Low,Uncertain,Benign,0.14,"Mouth, liver, and digestive",Unknown,Heterozygous,14758537;17452557;18797159,rs36094464,,chr4,88533540,T
BRCA1-Q356R,BRCA1,"One common variant associated this variant with an increased risk of breast cancer, but a more recent, larger study found no association.",Low,Uncertain,Benign,0.046,Cancer,Unknown,Heterozygous,17341484;19661094,rs1799950,,chr17,41246481,C
APOB-Y1422C,APOB,This position is almost certainly an error in the HG18 reference sequence. ,Low,Uncertain,Benign,1.0,Other,Unknown,Homozygous,,rs568413,,chr2,21235475,C
MAPT-R370W,MAPT,Probably benign.,Low,Uncertain,Benign,0.16,Other,Unknown,Heterozygous,15365985,rs17651549,,chr17,44061278,T
PCSK9-G670E,PCSK9,This variant is likely benign. ,Low,Uncertain,Benign,0.89,Other,Unknown,Homozygous,19351729,rs505151,,chr1,55529187,A
TYR-S192Y,TYR,This variant is reported to affect skin pigmentation. It is associated with lighter skin in South Asians (OR 4-5) and with a lack of freckles in Europeans (OR 1.3).,Low,Uncertain,Benign,0.27,Skin,Unknown,Heterozygous,17952075;17999355,rs1042602,,chr11,88911696,A
SLC45A2-L374F,SLC45A2,"Pigmentation allele for non-black hair, and consequently, possible increased susceptibility to malignant melanoma.",Low,Uncertain,Benign,0.69,Cancer,Unknown,Homozygous,15714523;17044855;18563784;18806926,rs16891982,,chr5,33951693,G
PTCH1-P1315L,PTCH1,"Common polymorphism, presumed benign.",Low,Uncertain,Benign,0.3,Other,Unknown,Heterozygous,15712338,rs357564,,chr9,98209594,A
USH2A-V230M,USH2A,"This rare variant may be associated with Usher Syndrome II, but the literature seems to have concluded that it is a non-pathogenic polymorphism (including authors who earlier reported it as pathogenic).",Low,Uncertain,Benign,0.016,Hearing and vision,Recessive,Heterozygous,10909849;11311042;15325563;18273898,rs45500891,,chr1,216538391,T
