variant,gene_symbol,summary,clinical_importance,evidence,impact,frequency,category,inheritance,zygosity,PMIDs,dbSNP_ID,penetrance_score,build_37_chromosome,build_37_position,build_37_variant_allele
MFN2-R707W,MFN2,"Reported to cause Charcot-Marie-Tooth disease type 2 in a recessive manner, causing peripheral neuropathy and clubfoot. Insufficient observations to establish statistical significance for this particular variant, but other variants in this gene are well-established as causal.",High,Uncertain,Pathogenic,0.00019,Nervous system,Recessive,Heterozygous,18458227;20008656,,5,chr1,12069698,T
VWF-R854Q,VWF,Causes type 2N von Willebrand disease in a recessive manner. This defect in coagulation can manifest as excessive bleeding during surgery.,Moderate,Likely,Pathogenic,0.0041,Other,Recessive,Heterozygous,22875612,rs41276738,5,chr12,6143978,T
HABP2-G534E,HABP2,"Known as the ""Marburg I"" polymorphism, this variant is associated with increased risk of coronary heart disease (CHD) in individuals with elevated cholesterol, triglyceride, and fibrinogen levels (5-fold risk of a CHD event, compared to 2-fold risk increase in people with the same risk factors but do not have this variant). In individuals without these elevated levels, however, carriers of the variant do not appear to have any increased risk of CHD.",Moderate,Likely,Pathogenic,0.028,Heart and circulatory;Metabolism,Unknown,Heterozygous,15543324;22421107,rs7080536,3,chr10,115348046,A
APC-E1317Q,APC,"This rare variant has been hypothesized to increase risk of colon cancer. Later studies have contradicted this, finding no significant enrichment and concluding the variant does not increase risk.",Moderate,Uncertain,Pathogenic,0.0088,Cancer,Dominant,Heterozygous,11001924;14578138;17119068,rs1801166,3,chr5,112175240,C
MYO1A-G662E,MYO1A,"Although one report speculated that this variant may cause dominant, early-onset sensorineural hearing loss, the findings lacked statistical significance. Notably, this gene is not a clinically tested gene and another of the eight variants reported by these authors (S797F) has since been observed in a PGP participant with no symptoms of hearing loss.",Moderate,Uncertain,Pathogenic,0.026,Hearing and vision;Nervous system,Dominant,Heterozygous,12736868,rs33962952,5,chr12,57431402,T
SLC4A1-E40K,SLC4A1,"Rare and reported to cause hemolytic anemia in a recessive manner, although insufficient data is published to establish statistical significance. Polyphen 2 predicts a benign effect.",Moderate,Uncertain,Pathogenic,0.012,Blood,Recessive,Heterozygous,8471774,rs45562031,5,chr17,42338993,T
MTRR-I49M,MTRR,"This common variant (HapMap allele frequency of 31.3%) in a protein involved in folate (B9) and cobalamin (B12) metabolism and is often reported as ""MTRR I22M"" (an alternative transcript position). Mothers homozygous for this variant are associated with having around a increased chance of a child with Down syndrome (risk of 0.4%, average risk in population is 0.25%). Notably, age plays a far larger role in the rate of Down syndrome (risk is 4.5% for a mother 45-years-of-age), and it is unknown how this variant may combine with the effect of age. There are conflicting reports associating this variant with incidence of neural tube defects, possibly when combined with MTHFR A222V.",Low,Likely,Pathogenic,0.45,Anatomical and congenital;Metabolism;Nervous system,Recessive,Heterozygous,10444342;10930360;11807890;12375236;15060097;15979034;17024475,rs1801394,1,chr5,7870973,G
WFS1-R611H,WFS1,"This nonsynonymous SNP is associated with Wolfram Syndrome (known as DIDMOAD), which is characterized by early-onset non-autoimmune diabetes mellitus, diabetes insipidus, optic atrophy, and deafness) and to adult Type Two Diabetes Mellitus.  The WFS1 gene maps to chromosome 4p16.3.  The variant has been shown to be statistically associated with type II diabetes in six UK studies and one study of Ashkenazi Jews (Sandhu, M., et al., Minton et al.).",Low,Uncertain,Not Reviewed,0.4,Hearing and vision;Immune system;Metabolism,Recessive,Homozygous,17603484;17719176;23257691,rs734312,1,chr4,6303354,A
TGIF1-P83Shift,TGIF1,"Severe variants in this gene are associated with holoprosencephaly disorders when combined with loss-of-function variants in SHH. Haploinsufficiency was identified in some families with this condition. It is unclear how likely this variant is to occur in combination with an SHH variant, or what phenotypic effect the variant would have on its own.",Low,Uncertain,Pathogenic,0.14,Nervous system,Complex/Other,Heterozygous,10556296,rs11571510,1,,,
LRP5-A1330V,LRP5,"In a study of a UK population this variant was associated with a small increased risk of osteoporosis and osteoporotic bone fractures, with each copy of the variant presumed to have an additive effect. A study in Chinese young men failed to find an association with peak bone density.

 
",Low,Uncertain,Pathogenic,0.11,"Muscular, skeletal, and connective tissue",Complex/Other,Heterozygous,18455228;19148563;20953208,rs3736228,2,chr11,68201295,T
RNASEL-R462Q,RNASEL,"Associated with increased risk of prostate cancer in individuals who already have a family history of prostate cancer, but studies have been unable to replicate this finding in sporadic (non-familial) prostate cancer cases.",Low,Uncertain,Pathogenic,0.28,Cancer;Genital and urinary,Complex/Other,Homozygous,11941539;12022038;12415269;17407163,rs486907,2,chr1,182554557,T
DYX1C1-E417X,DYX1C1,"One study reports this variant to be associated with dyslexia. The study group was relatively small and so the results did not have strong significance. If they are representative this variant is associated with a doubled risk for dyslexia, but it is unclear whether the effect would be additive, dominant, or recessive.",Low,Uncertain,Pathogenic,0.2,Mental and behavioral,Unknown,Heterozygous,12954984,rs57809907,3,chr15,55722882,A
ERCC6-R1213G,ERCC6,"When homozygous, this variant may cause Cockayne Syndrome, which is a severe autosomal-recessive disorder characterized by abnormal early growth and development, abnormal sensitivity to sunlight, and premature aging. Cockayne Syndrome Type I and Type II lead to death in early childhood. Several other variants in the ERCC6 gene are linked to Cockayne Syndrome. This variant may also be linked to age-related macular degeneration like other ERCC6 variants, and has been linked to colorectal cancer in one study. ",Low,Uncertain,Pathogenic,0.2,Anatomical and congenital;Cancer;Hearing and vision,Recessive,Heterozygous,,rs2228527,0,chr10,50678369,C
H6PD-R453Q,H6PD,"This common variant may have a small pathogenic effect by contributing to cortisone reductase deficiency (a rare abnormality) when homozygous and combined with a serious pathogenic variant. The same authors have tested and ruled out a contribution to polycystic ovary syndrome (similar phenotype, more common disease).",Low,Uncertain,Pathogenic,0.31,Genital and urinary;Metabolism,Recessive,Heterozygous,12858176;15827106;16817821,rs6688832,1,chr1,9323910,A
BRCA2-N372H,BRCA2,"This is a common variant of BRCA2 (HapMap allele frequency of 23%). The variant is weakly associated with an increased chance of breast cancer, and zygosity of the variant is associated with sex of children: male children are more likely to be homozygous for this variant, female children are more likely to be heterozygous.",Low,Uncertain,Pathogenic,0.24,Cancer,Recessive,Heterozygous,11062481;15235023,rs144848,2,chr13,32906729,C
SP110-L425S,SP110,"This variant is associated with a slightly increased risk of tuberculosis. It is unclear whether it is itself causal, or in linkage disequilibrium with some other causal variant that has a stronger effect.",Low,Uncertain,Pathogenic,0.86,Immune system,Unknown,Homozygous,16803959,rs3948464,1,chr2,231050715,G
TP53-P72R,TP53,"This is a common variant was first reported as a polymorphism. It has since had mixed associations with cancer: Storey et al. conclude a 7x *increased* risk of HPV cancer for homozygotes vs hets, but Jones et al. find a 1.98x *decreased* risk for colorectal cancer. This variant may have significant impact on particular cancers, but it is unclear what effect it has on the overall burden of cancer.",Low,Uncertain,Pathogenic,0.63,Cancer,Unknown,Homozygous,1975675;9607760;15355915;19837266;20615891;22184967,rs1042522,0,chr17,7579472,C
rs1544410,,"rs1544410 is a Vitamin D Receptor (VDR) single nucleotide polymorphism. It is unlikely that it has functional significance because it is located in an intron (Liu et. al.), but it is in strong linkage disequilibrium with rs731236 (Dvornyk et al), which is located in an exon. ",Low,Uncertain,Pharmacogenetic,0.35,Other,Unknown,Heterozygous,,rs1544410,0,,,
FUT2-W154X,FUT2,"This recessive protective variant confers resistance to norovirus (which causes stomach flu). 20% of Caucasians and Africans are homozygous for this variant and are ""non-secretors"": they do not express ABO blood type antigens in their saliva or mucosal surfaces. Most strains of norovirus bind to these antigens in the gut, and so this non-secretor status confers almost total resistantance to most types of norovirus. There are notable exceptions, some strains of norovirus bind a different target and are equally infectious for secretors and non-secretors.",Moderate,Well-established,Protective,0.49,Blood;Immune system,Recessive,Heterozygous,7876235;12692541;19625485;20031047;22025362,rs601338,5,chr19,49206674,A
PRNP-M129V,PRNP,"This variant is associated with some protective effects for prion disease -- individuals homozygous for this variant are less susceptible to Creutzfeldt-Jakob, and Papua New Guinea individuals heterozygotes at this site are less susceptible to kuru.

",Low,Well-established,Protective,0.34,Other,Complex/Other,Heterozygous,18236005;19081515,rs1799990,0,chr20,4680251,G
CFH-V62I,CFH,"Associated with a decreased risk for age related macular degeneration (ARMD). Homozygotes for this have a 4-5% decreased attributable risk (3-4% vs. average 8% risk), heterozygotes have slightly lower than average risk (7%). Non-carriers have an increased risk (12-13%). ARMD impairs sharp vision as age progresses. While there is no cure, treatment can slow progression of the disease and environmental factors (smoking and obesity) contribute to higher risk.",Low,Likely,Protective,0.39,Hearing and vision;Metabolism,Complex/Other,Heterozygous,15870199,rs800292,2,chr1,196642233,A
IRS2-G1057D,IRS2,"a.k.a Gly1057Asp, insulin receptor substrate-2 IRS2. The rs1805097(G) allele is associated with the Gly, and the (A) allele with Asp. 
A longevity study concluded that rs1805097(A;A) individuals were about twice as likely to live over 85 y/o (odds ratio 2.03, CI:1.39-2.99, p = .0003). ",Low,Uncertain,Protective,0.23,Other,Unknown,Heterozygous,19887537,rs1805097,,chr13,110435231,T
MSH2-G322D,MSH2,"Although other variants in this mismatch repair gene are associated with cancer, most publications dismiss this variant as a polymorphism (HapMap allele frequency of 1.6%).",Low,Likely,Benign,0.011,Cancer,Unknown,Heterozygous,8776590;10023327;10469597;11870161;12673796;18470917,rs4987188,,chr2,47643457,A
COL6A3-D2831H,COL6A3,"Probably benign, reported by Pan et al. as a presumed-nonpathogenic variant in the gene.",Low,Likely,Benign,0.068,Other,Unknown,Heterozygous,9536084;15563506,rs36104025,,chr2,238247734,G
FANCI-P55L,FANCI,Probably benign.,Low,Likely,Benign,0.051,Other,Unknown,Heterozygous,17412408,rs62020347,,chr15,89803950,T
FBN2-S2580L,FBN2,"Probably benign -- initially associated with congenital contractual arachnodactyly, but later reports classify it as a nonpathogenic polymorphism.",Low,Uncertain,Benign,0.078,Anatomical and congenital,Dominant,Heterozygous,9714438;10633129;16835936;17345643,rs2291628,,chr5,127609633,A
MLH1-I219V,MLH1,"Computational evidence, functional assays, and case/control studies suggest this variant is probably benign.",Low,Uncertain,Benign,0.24,Other,Dominant,Heterozygous,11781295;12810663;17074586;17510385;17870204;19863800;20301390;22631669,rs1799977,0,chr3,37053568,G
GAA-D91N,GAA,"This is a rare but non-pathogenic coding polymorphism in GAA that creates variant allozyme, known as GAA*2.

 
",Low,Uncertain,Benign,0.024,Other,Recessive,Heterozygous,16359900,rs1800299,,chr17,78078656,A
TAS2R38-A49P,TAS2R38,"This variant is strongly associated with causing the ""taster"" phenotype of phenylthiocarbamine (PTC) in a dominant manner.",Low,Uncertain,Benign,0.43,Other,Unknown,Heterozygous,12595690;15883422;20675712,rs713598,,chr7,141673345,G
APOB-Y1422C,APOB,This position is almost certainly an error in the HG18 reference sequence. ,Low,Uncertain,Benign,1.0,Other,Unknown,Homozygous,,rs568413,,chr2,21235475,C
PTCH1-P1315L,PTCH1,"Common polymorphism, presumed benign.",Low,Uncertain,Benign,0.3,Other,Unknown,Homozygous,15712338,rs357564,,chr9,98209594,A
PHYH-P29S,PHYH,"Probably benign. This variant was implicated as causing Refsum Disease in a recessive manner, but a subsequent publication noted that all instances were linked with other explanatory mutations. The high allele frequency of this variant in the population (7-13%) contradicts a pathogenic hypothesis.",Low,Uncertain,Benign,0.16,Nervous system,Unknown,Heterozygous,10767344;14974078,rs28938169,0,chr10,13340236,A
PCSK9-G670E,PCSK9,This variant is likely benign. ,Low,Uncertain,Benign,0.89,Other,Unknown,Homozygous,19351729,rs505151,,chr1,55529187,A
RP1-N985Y,RP1,"Probably benign. One report linked this variant to high triglycerides, but a later paper found a nearby SNP with similar association and suggests that both findings are caused by linkage to an undiscovered causal variant.",Low,Uncertain,Benign,0.35,Metabolism,Unknown,Homozygous,12764676;19364639,rs2293869,,chr8,55539395,T
SLC45A2-L374F,SLC45A2,"Pigmentation allele for non-black hair, and consequently, possible increased susceptibility to malignant melanoma.",Low,Uncertain,Benign,0.69,Cancer,Unknown,Homozygous,15714523;17044855;18563784;18806926,rs16891982,,chr5,33951693,G
USH2A-V230M,USH2A,"This rare variant may be associated with Usher Syndrome II, but the literature seems to have concluded that it is a non-pathogenic polymorphism (including authors who earlier reported it as pathogenic).",Low,Uncertain,Benign,0.016,Hearing and vision,Recessive,Heterozygous,10909849;11311042;15325563;18273898,rs45500891,,chr1,216538391,T
TPCN2-G734E,TPCN2,Pigmentation allele.,Low,Uncertain,Benign,0.29,Other,Unknown,Heterozygous,18488028,rs3829241,,chr11,68855363,A
TAS2R38-I296V,TAS2R38,"This variant is associated with ""taster"" status of PTC, along with 49P and 262A. Due to linkage disequilibrium, the independent effects of positions 296 and 262 is unclear. The presence of 49P confers taster status in a dominant fashion, but in the absence of 49P, the presence of 262A/296V is still positively associated with tasting PTC.",Low,Uncertain,Benign,0.46,Other,Unknown,Heterozygous,12595690;20675712,rs10246939,,chr7,141672604,C
GUCY2D-A52S,GUCY2D,"One publication suggested that this variant possibly causes Leber's congenital amaurosis in a recessive manner, but the frequency data (36% in 1000 genomes) contradicts any significant pathogenic effect.",Low,Uncertain,Benign,0.21,Hearing and vision,Recessive,Heterozygous,8944027,rs61749665,,chr17,7906519,T
