variant,gene_symbol,summary,clinical_importance,evidence,impact,frequency,category,inheritance,zygosity,PMIDs,dbSNP_ID,penetrance_score,build_37_chromosome,build_37_position,build_37_variant_allele,getev_report_url
WFS1-R611H,WFS1,"This nonsynonymous SNP is associated with Wolfram Syndrome (known as DIDMOAD), which is characterized by early-onset non-autoimmune diabetes mellitus, diabetes insipidus, optic atrophy, and deafness) and to adult Type Two Diabetes Mellitus.  The WFS1 gene maps to chromosome 4p16.3.  The variant has been shown to be statistically associated with type II diabetes in six UK studies and one study of Ashkenazi Jews (Sandhu, M., et al., Minton et al.).",Low,Uncertain,Not Reviewed,0.4,Hearing and vision;Immune system;Metabolism,Recessive,Homozygous,17603484;17719176;23257691,rs734312,1,chr4,6303354,A,http://evidence.pgp-hms.org/genomes?display_genome_id=dc17a19fbdc019924c0f600615a9aa92f16b7113&access_token=5038d6526288b3ca807b8a86ee0148a2
SP110-L425S,SP110,"This variant is associated with a slightly increased risk of tuberculosis. It is unclear whether it is itself causal, or in linkage disequilibrium with some other causal variant that has a stronger effect.",Low,Uncertain,Pathogenic,0.86,Immune system,Unknown,Homozygous,16803959,rs3948464,1,chr2,231050715,G,http://evidence.pgp-hms.org/genomes?display_genome_id=dc17a19fbdc019924c0f600615a9aa92f16b7113&access_token=5038d6526288b3ca807b8a86ee0148a2
TP53-P72R,TP53,"This is a common variant was first reported as a polymorphism. It has since had mixed associations with cancer: Storey et al. conclude a 7x *increased* risk of HPV cancer for homozygotes vs hets, but Jones et al. find a 1.98x *decreased* risk for colorectal cancer. This variant may have significant impact on particular cancers, but it is unclear what effect it has on the overall burden of cancer.",Low,Uncertain,Pathogenic,0.63,Cancer,Unknown,Homozygous,1975675;9607760;15355915;19837266;20615891;22184967,rs1042522,0,chr17,7579472,C,http://evidence.pgp-hms.org/genomes?display_genome_id=dc17a19fbdc019924c0f600615a9aa92f16b7113&access_token=5038d6526288b3ca807b8a86ee0148a2
ERCC6-R1213G,ERCC6,"When homozygous, this variant may cause Cockayne Syndrome, which is a severe autosomal-recessive disorder characterized by abnormal early growth and development, abnormal sensitivity to sunlight, and premature aging. Cockayne Syndrome Type I and Type II lead to death in early childhood. Several other variants in the ERCC6 gene are linked to Cockayne Syndrome. This variant may also be linked to age-related macular degeneration like other ERCC6 variants, and has been linked to colorectal cancer in one study. ",Low,Uncertain,Pathogenic,0.2,Anatomical and congenital;Cancer;Hearing and vision,Recessive,Heterozygous,,rs2228527,0,chr10,50678369,C,http://evidence.pgp-hms.org/genomes?display_genome_id=dc17a19fbdc019924c0f600615a9aa92f16b7113&access_token=5038d6526288b3ca807b8a86ee0148a2
ITPA-P32T,ITPA,"This variant is associated with inosine triphosphate pyrophosphohydrolase deficiency and may be associated with an adverse reaction to thiopurine drugs (which are used as immunosuppressants). Homozygotes have no detectable ITPase activity, individuals compound heterozygous with another less severe mutation also have severely reduced enzyme activity.",Low,Well-established,Pharmacogenetic,0.061,Drug response;Immune system;Metabolism,Recessive,Heterozygous,12384777;15322947;17924837;19631656;19682085;20173735,rs1127354,1,chr20,3193842,A,http://evidence.pgp-hms.org/genomes?display_genome_id=dc17a19fbdc019924c0f600615a9aa92f16b7113&access_token=5038d6526288b3ca807b8a86ee0148a2
CFB-R32Q,CFB,"This variant is associated with a significant protective effect -- individuals with this variant are about half as likely to have age-related macular degeneration. Appears to be an additive effect, with homozygotes having a stronger protective effect.",Moderate,Likely,Protective,0.12,Hearing and vision,Dominant,Heterozygous,16518403;16936732;19117936,rs641153,3,,,,http://evidence.pgp-hms.org/genomes?display_genome_id=dc17a19fbdc019924c0f600615a9aa92f16b7113&access_token=5038d6526288b3ca807b8a86ee0148a2
CFH-V62I,CFH,"Associated with a decreased risk for age related macular degeneration (ARMD). Homozygotes for this have a 4-5% decreased attributable risk (3-4% vs. average 8% risk), heterozygotes have slightly lower than average risk (7%). Non-carriers have an increased risk (12-13%). ARMD impairs sharp vision as age progresses. While there is no cure, treatment can slow progression of the disease and environmental factors (smoking and obesity) contribute to higher risk.",Low,Likely,Protective,0.39,Hearing and vision;Metabolism,Complex/Other,Heterozygous,15870199,rs800292,2,chr1,196642233,A,http://evidence.pgp-hms.org/genomes?display_genome_id=dc17a19fbdc019924c0f600615a9aa92f16b7113&access_token=5038d6526288b3ca807b8a86ee0148a2
IL7R-T244I,IL7R,"The reference genome variant for this allele has been associated with a slight increased risk of multiple sclerosis. Thus, this variant can be treated as a ""protective"" variant -- carriers of this variant are slightly less likely to have MS. Because the disease is rare and the effect of this variant is not very strong, the absolute decreased risk for carriers of this variant is less than .05% (less than 1 in 2000).",Low,Likely,Protective,0.21,Immune system;Nervous system,Unknown,Heterozygous,12825072;17660530;17660816;17660817;21161391,rs6897932,0,chr5,35874575,T,http://evidence.pgp-hms.org/genomes?display_genome_id=dc17a19fbdc019924c0f600615a9aa92f16b7113&access_token=5038d6526288b3ca807b8a86ee0148a2
OCA2-H615R,OCA2,Associated with lighter skin pigmentation in East Asian populations.,Low,Likely,Benign,0.00065,Skin,Complex/Other,Heterozygous,17570052;20221248,rs1800414,,chr15,28197037,C,http://evidence.pgp-hms.org/genomes?display_genome_id=dc17a19fbdc019924c0f600615a9aa92f16b7113&access_token=5038d6526288b3ca807b8a86ee0148a2
NEFL-S472Shift,NEFL,"Although a frameshift in this gene would be predicted to cause Charcot-Marie Neuropathy, this particular position appears to reflect a single base insertion error/mutation in the reference genome (in other words, normal individuals are always homozygous for a deletion at this position relative to reference). See chr8:24,811,060-24,811,080 annotations on UCSC.",Low,Likely,Benign,,Nervous system,Unknown,Homozygous,,rs11340767,,,,,http://evidence.pgp-hms.org/genomes?display_genome_id=dc17a19fbdc019924c0f600615a9aa92f16b7113&access_token=5038d6526288b3ca807b8a86ee0148a2
SLC45A2-E272K,SLC45A2,Pigmentation allele for black hair in Caucasian population.,Low,Likely,Benign,0.029,Other,Unknown,Heterozygous,15714523,rs26722,,chr5,33963870,T,http://evidence.pgp-hms.org/genomes?display_genome_id=dc17a19fbdc019924c0f600615a9aa92f16b7113&access_token=5038d6526288b3ca807b8a86ee0148a2
EFHC1-R182H,EFHC1,Probably benign. OMIM appears to incorrectly interpret literature as linking this variant to juvenile myoclonic epilepsy; the authors report it as a polymorphism.,Low,Likely,Benign,0.044,Nervous system,Unknown,Heterozygous,7668263;15258581,rs3804505,,chr6,52303361,A,http://evidence.pgp-hms.org/genomes?display_genome_id=dc17a19fbdc019924c0f600615a9aa92f16b7113&access_token=5038d6526288b3ca807b8a86ee0148a2
LOXL1-R141L,LOXL1,"Associated with exfoliative glaucoma & syndrome (XFG & XFS) in various populations, but with contradicting results (protective in Caucasians, pathogenic in Japanese). Based on this it seems the variation itself -- although it affects protein structure -- is not itself causing disease. Instead it is likely associated with other nearby causal variants. As such, it is evaluated as benign by GET-Evidence (which focuses on reporting causal variants). See detailed variant report for disease risk associations.",Low,Uncertain,Benign,0.26,Hearing and vision,Complex/Other,Homozygous,17690259;18450598;20142848,rs1048661,,chr15,74219546,T,http://evidence.pgp-hms.org/genomes?display_genome_id=dc17a19fbdc019924c0f600615a9aa92f16b7113&access_token=5038d6526288b3ca807b8a86ee0148a2
GAA-E689K,GAA,This is also known as the GAA*4 allozyme is frequent in the Asian population and appears to have somewhat reduced enzyme activity. Kroos et al. rule out pathogenic effect.,Low,Uncertain,Benign,0.03,Other,Complex/Other,Homozygous,18301443,rs1800309,,chr17,78087041,A,http://evidence.pgp-hms.org/genomes?display_genome_id=dc17a19fbdc019924c0f600615a9aa92f16b7113&access_token=5038d6526288b3ca807b8a86ee0148a2
APOB-Y1422C,APOB,This position is almost certainly an error in the HG18 reference sequence. ,Low,Uncertain,Benign,1.0,Other,Unknown,Homozygous,,rs568413,,chr2,21235475,C,http://evidence.pgp-hms.org/genomes?display_genome_id=dc17a19fbdc019924c0f600615a9aa92f16b7113&access_token=5038d6526288b3ca807b8a86ee0148a2
TAS2R38-A49P,TAS2R38,"This variant is strongly associated with causing the ""taster"" phenotype of phenylthiocarbamine (PTC) in a dominant manner.",Low,Uncertain,Benign,0.43,Other,Unknown,Heterozygous,12595690;15883422;20675712,rs713598,,chr7,141673345,G,http://evidence.pgp-hms.org/genomes?display_genome_id=dc17a19fbdc019924c0f600615a9aa92f16b7113&access_token=5038d6526288b3ca807b8a86ee0148a2
TAS2R38-I296V,TAS2R38,"This variant is associated with ""taster"" status of PTC, along with 49P and 262A. Due to linkage disequilibrium, the independent effects of positions 296 and 262 is unclear. The presence of 49P confers taster status in a dominant fashion, but in the absence of 49P, the presence of 262A/296V is still positively associated with tasting PTC.",Low,Uncertain,Benign,0.46,Other,Unknown,Heterozygous,12595690;20675712,rs10246939,,chr7,141672604,C,http://evidence.pgp-hms.org/genomes?display_genome_id=dc17a19fbdc019924c0f600615a9aa92f16b7113&access_token=5038d6526288b3ca807b8a86ee0148a2
PCSK9-G670E,PCSK9,This variant is likely benign. ,Low,Uncertain,Benign,0.89,Other,Unknown,Homozygous,19351729,rs505151,,chr1,55529187,A,http://evidence.pgp-hms.org/genomes?display_genome_id=dc17a19fbdc019924c0f600615a9aa92f16b7113&access_token=5038d6526288b3ca807b8a86ee0148a2
FMO3-V257M,FMO3,"This common variant (HapMap allele frequency of 9.2%) appears to have no functional effect. OMIM has recorded it as having been seen homozygously in an individual with Trimethylaminuria, but Treacy et al. 1998 conclude it is a polymorphism.",Low,Uncertain,Benign,0.057,Metabolism,Unknown,Homozygous,9536088,rs1736557,,chr1,171080080,A,http://evidence.pgp-hms.org/genomes?display_genome_id=dc17a19fbdc019924c0f600615a9aa92f16b7113&access_token=5038d6526288b3ca807b8a86ee0148a2
FLG-R3530S,FLG,"Tentatively classified as benign, although predicted by Polyphen 2 to be damaging. Other more severe null mutations (frameshift and nonsense) in this gene are reported to cause ichthyosis vulgaris in a recessive manner.",Low,Uncertain,Benign,0.11,Skin,Unknown,Heterozygous,,rs72697000,,chr1,152276772,A,http://evidence.pgp-hms.org/genomes?display_genome_id=dc17a19fbdc019924c0f600615a9aa92f16b7113&access_token=5038d6526288b3ca807b8a86ee0148a2
GJB2-V27I,GJB2,"Probable non-pathogenic; other variants in gene associated with hearing loss.
A few controversial mutations of uncertain or evolving clinical signiﬁcance are included in this prototype.
Examples include V27I, M34T, V37I, and E114G in the GJB2 gene and IVS2-2AG in the SLC26A5 gene.
This variant is also observed both in Case and Control in the study of hearing loss.",Low,Uncertain,Benign,0.0027,Hearing and vision,Unknown,Heterozygous,11494963;15790391;19719946,rs2274084,,chr13,20763642,T,http://evidence.pgp-hms.org/genomes?display_genome_id=dc17a19fbdc019924c0f600615a9aa92f16b7113&access_token=5038d6526288b3ca807b8a86ee0148a2
ABCC11-G180R,ABCC11,This variant is associated with dry type ear wax (a benign trait) in a recessive manner.,Low,Uncertain,Benign,0.098,Other,Unknown,Homozygous,14471313;16444273,rs17822931,,chr16,48258198,T,http://evidence.pgp-hms.org/genomes?display_genome_id=dc17a19fbdc019924c0f600615a9aa92f16b7113&access_token=5038d6526288b3ca807b8a86ee0148a2
EDAR-V370A,EDAR,"Associated with thicker hair, common in Chinese and Japanese individuals and thought to be Asian-specific.",Low,Uncertain,Benign,0.011,Other,Unknown,Heterozygous,18065779;18561327;18704500;19804850,rs3827760,,chr2,109513601,G,http://evidence.pgp-hms.org/genomes?display_genome_id=dc17a19fbdc019924c0f600615a9aa92f16b7113&access_token=5038d6526288b3ca807b8a86ee0148a2
PTCH1-P1315L,PTCH1,"Common polymorphism, presumed benign.",Low,Uncertain,Benign,0.3,Other,Unknown,Homozygous,15712338,rs357564,,chr9,98209594,A,http://evidence.pgp-hms.org/genomes?display_genome_id=dc17a19fbdc019924c0f600615a9aa92f16b7113&access_token=5038d6526288b3ca807b8a86ee0148a2
