variant,gene_symbol,summary,clinical_importance,evidence,impact,frequency,category,inheritance,zygosity,PMIDs,dbSNP_ID,penetrance_score,build_37_chromosome,build_37_position,build_37_variant_allele,getev_report_url
PAH-A403V,PAH,"Reported to cause phenylketonuria, as recorded in ClinVar by three different genetic testing groups (Emory Genetics Lab, Counsyl, and Partners LMM): http://www.ncbi.nlm.nih.gov/clinvar/RCV000150075/  This effect seems to be well-supported in literature, e.g. Daniele et al 2007 (PMID: 17096675) report this variant accounting for 11.6% of disease-causing variants in patients studied in Southern Italy.",High,Likely,Pathogenic,,Other,Recessive,Heterozygous,,,5,,,,http://evidence.pgp-hms.org/genomes?display_genome_id=ebeb2607ff8fa5363e4b1891c7013013cae55707
CBS-I278T,CBS,This recessive mutation causes homocystinuria in a recessive manner and is found in patients responsive to pyridoxine treatment.,High,Likely,Pathogenic,0.0029,Genital and urinary;Metabolism,Recessive,Heterozygous,7611293;8554066;8940271;9813456;15972722;19683694,rs5742905,5,chr21,44483184,G,http://evidence.pgp-hms.org/genomes?display_genome_id=ebeb2607ff8fa5363e4b1891c7013013cae55707
CIRH1A-R565W,CIRH1A,"Reported to cause North American Indian childhood cirrhosis in a recessive manner, as recorded in ClinVar by OMIM. This comes from Chagnon et al 2002 (PMID: 12417987) who found this homozygous in all five affected families studied. All cases were Ojibway-Cree children in Quebec with a shared haplotype indicating a common ancestor, and may have been linked to a different causal variant. ExAC data reports that this variant is fairly common in Latino ancestry (allele frequency of 1.9%, ~1 in 3,000 are homozygous). This strongly contradicts the variant as causing this disease, which is extremely rare and has only been described in aboriginal children in northwestern Quebec.",High,Uncertain,Pathogenic,0.00028,"Mouth, liver, and digestive",Recessive,Heterozygous,12417987;18021715;22916032,,5,chr16,69199289,T,http://evidence.pgp-hms.org/genomes?display_genome_id=ebeb2607ff8fa5363e4b1891c7013013cae55707
RYR2-G1886S,RYR2,"Reported to cause arrhythmogenic right ventricular cardiomyopathy when compound heterozygous with G1885E, although this finding is weakened after correcting for multiple hypotheses and it is unclear what penetrance such a genotype might have, if it is causal.",High,Uncertain,Pathogenic,0.061,"Heart and circulatory;Muscular, skeletal, and connective tissue;Nervous system",Recessive,Heterozygous,16769042;18326664,rs3766871,4,chr1,237778084,A,http://evidence.pgp-hms.org/genomes?display_genome_id=ebeb2607ff8fa5363e4b1891c7013013cae55707
MYO1A-G662E,MYO1A,"Although one report speculated that this variant may cause dominant, early-onset sensorineural hearing loss, the findings lacked statistical significance. Notably, this gene is not a clinically tested gene and another of the eight variants reported by these authors (S797F) has since been observed in a PGP participant with no symptoms of hearing loss.",Moderate,Uncertain,Pathogenic,0.026,Hearing and vision;Nervous system,Dominant,Heterozygous,12736868,rs33962952,5,chr12,57431402,T,http://evidence.pgp-hms.org/genomes?display_genome_id=ebeb2607ff8fa5363e4b1891c7013013cae55707
COL4A1-Q1334H,COL4A1,"This common variant has been associated with arterial stiffness and, in Japanese, a small increased risk of myocardial infarction (MI, a.k.a. heart attack). This last observation supported a dominant effect for this variant and, assuming a lifetime risk of 15% for MI, we estimate carriers have an additional risk of 0.5-3%.",Low,Likely,Pathogenic,0.32,Heart and circulatory,Dominant,Heterozygous,10334796;18077766;20031579,rs3742207,2,chr13,110818598,G,http://evidence.pgp-hms.org/genomes?display_genome_id=ebeb2607ff8fa5363e4b1891c7013013cae55707
MTRR-I49M,MTRR,"This common variant (HapMap allele frequency of 31.3%) in a protein involved in folate (B9) and cobalamin (B12) metabolism and is often reported as ""MTRR I22M"" (an alternative transcript position). Mothers homozygous for this variant are associated with having around a increased chance of a child with Down syndrome (risk of 0.4%, average risk in population is 0.25%). Notably, age plays a far larger role in the rate of Down syndrome (risk is 4.5% for a mother 45-years-of-age), and it is unknown how this variant may combine with the effect of age. There are conflicting reports associating this variant with incidence of neural tube defects, possibly when combined with MTHFR A222V.",Low,Likely,Pathogenic,0.45,Anatomical and congenital;Metabolism;Nervous system,Recessive,Heterozygous,10444342;10930360;11807890;12375236;15060097;15979034;17024475,rs1801394,1,chr5,7870973,G,http://evidence.pgp-hms.org/genomes?display_genome_id=ebeb2607ff8fa5363e4b1891c7013013cae55707
TGIF1-P83Shift,TGIF1,"Severe variants in this gene are associated with holoprosencephaly disorders when combined with loss-of-function variants in SHH. Haploinsufficiency was identified in some families with this condition. It is unclear how likely this variant is to occur in combination with an SHH variant, or what phenotypic effect the variant would have on its own.",Low,Uncertain,Pathogenic,0.14,Nervous system,Complex/Other,Heterozygous,10556296,rs11571510,1,,,,http://evidence.pgp-hms.org/genomes?display_genome_id=ebeb2607ff8fa5363e4b1891c7013013cae55707
RNASEL-R462Q,RNASEL,"Associated with increased risk of prostate cancer in individuals who already have a family history of prostate cancer, but studies have been unable to replicate this finding in sporadic (non-familial) prostate cancer cases.",Low,Uncertain,Pathogenic,0.28,Cancer;Genital and urinary,Complex/Other,Heterozygous,11941539;12022038;12415269;17407163,rs486907,2,chr1,182554557,T,http://evidence.pgp-hms.org/genomes?display_genome_id=ebeb2607ff8fa5363e4b1891c7013013cae55707
CLEC7A-Y238X,CLEC7A,This variant has been found to impair homan mucosal antifungal defense and was implicated in vulvovaginal candidiasis and mucocutaneous infections in a Dutch family.,Low,Uncertain,Pathogenic,0.063,Genital and urinary;Skin,Recessive,Heterozygous,19864674,rs16910526,4,chr12,10271087,C,http://evidence.pgp-hms.org/genomes?display_genome_id=ebeb2607ff8fa5363e4b1891c7013013cae55707
PRODH-L289M,PRODH,"One report suggested that this rare variant (0.9% allele frequency) could be associated with hyperprolinemia and, through this, associated with increased susceptibility to schizophrenia and/or schizoaffective disorder. However, this finding completely lacked statistical significance, and both reported cases were also associated with other potentially causal variants. A later functional study found only a mild functional effect on enzyme activity (78-90% of wildtype activity).",Low,Uncertain,Pathogenic,0.0044,Mental and behavioral;Metabolism,Unknown,Heterozygous,12217952;15662599,,2,chr22,18909902,T,http://evidence.pgp-hms.org/genomes?display_genome_id=ebeb2607ff8fa5363e4b1891c7013013cae55707
H6PD-R453Q,H6PD,"This common variant may have a small pathogenic effect by contributing to cortisone reductase deficiency (a rare abnormality) when homozygous and combined with a serious pathogenic variant. The same authors have tested and ruled out a contribution to polycystic ovary syndrome (similar phenotype, more common disease).",Low,Uncertain,Pathogenic,0.31,Genital and urinary;Metabolism,Recessive,Heterozygous,12858176;15827106;16817821,rs6688832,1,chr1,9323910,A,http://evidence.pgp-hms.org/genomes?display_genome_id=ebeb2607ff8fa5363e4b1891c7013013cae55707
SP110-L425S,SP110,"This variant is associated with a slightly increased risk of tuberculosis. It is unclear whether it is itself causal, or in linkage disequilibrium with some other causal variant that has a stronger effect.",Low,Uncertain,Pathogenic,0.86,Immune system,Unknown,Homozygous,16803959,rs3948464,1,chr2,231050715,G,http://evidence.pgp-hms.org/genomes?display_genome_id=ebeb2607ff8fa5363e4b1891c7013013cae55707
WFS1-R611H,WFS1,"This nonsynonymous SNP is associated with Wolfram Syndrome (known as DIDMOAD), which is characterized by early-onset non-autoimmune diabetes mellitus, diabetes insipidus, optic atrophy, and deafness) and to adult Type Two Diabetes Mellitus.  The WFS1 gene maps to chromosome 4p16.3.  The variant has been shown to be statistically associated with type II diabetes in six UK studies and one study of Ashkenazi Jews (Sandhu, M., et al., Minton et al.).",Low,Uncertain,Not Reviewed,0.4,Hearing and vision;Immune system;Metabolism,Recessive,Heterozygous,17603484;17719176;23257691,rs734312,1,chr4,6303354,A,http://evidence.pgp-hms.org/genomes?display_genome_id=ebeb2607ff8fa5363e4b1891c7013013cae55707
TP53-P72R,TP53,"This is a common variant was first reported as a polymorphism. It has since had mixed associations with cancer: Storey et al. conclude a 7x *increased* risk of HPV cancer for homozygotes vs hets, but Jones et al. find a 1.98x *decreased* risk for colorectal cancer. This variant may have significant impact on particular cancers, but it is unclear what effect it has on the overall burden of cancer.",Low,Uncertain,Pathogenic,0.63,Cancer,Unknown,Heterozygous,1975675;9607760;15355915;19837266;20615891;22184967,rs1042522,0,chr17,7579472,C,http://evidence.pgp-hms.org/genomes?display_genome_id=ebeb2607ff8fa5363e4b1891c7013013cae55707
DPYD-M166V,DPYD,Associated with DPYD deficiency and poor prognosis for chemotherapy w/ 5-flurorouracil. ,High,Likely,Pharmacogenetic,0.078,Other,Unknown,Heterozygous,11895907;14635116;19104657,rs2297595,5,chr1,98165091,C,http://evidence.pgp-hms.org/genomes?display_genome_id=ebeb2607ff8fa5363e4b1891c7013013cae55707
ABCC6-R1268Q,ABCC6,This common polymorphism appears to not have a significant phenotypic impact. A few studies report weak but significant associations with plasma lipids (in Inuits) and thalidomide toxicity.,Low,Uncertain,Pharmacogenetic,0.22,Metabolism,Unknown,Heterozygous,10811882;10913334;11776382;20038957,rs2238472,1,chr16,16251599,T,http://evidence.pgp-hms.org/genomes?display_genome_id=ebeb2607ff8fa5363e4b1891c7013013cae55707
rs1544410,,"rs1544410 is a Vitamin D Receptor (VDR) single nucleotide polymorphism. It is unlikely that it has functional significance because it is located in an intron (Liu et. al.), but it is in strong linkage disequilibrium with rs731236 (Dvornyk et al), which is located in an exon. ",Low,Uncertain,Pharmacogenetic,0.35,Other,Unknown,Homozygous,,rs1544410,0,,,,http://evidence.pgp-hms.org/genomes?display_genome_id=ebeb2607ff8fa5363e4b1891c7013013cae55707
FUT2-W154X,FUT2,"This recessive protective variant confers resistance to norovirus (which causes stomach flu). 20% of Caucasians and Africans are homozygous for this variant and are ""non-secretors"": they do not express ABO blood type antigens in their saliva or mucosal surfaces. Most strains of norovirus bind to these antigens in the gut, and so this non-secretor status confers almost total resistantance to most types of norovirus. There are notable exceptions, some strains of norovirus bind a different target and are equally infectious for secretors and non-secretors.",Moderate,Well-established,Protective,0.49,Blood;Immune system,Recessive,Heterozygous,7876235;12692541;19625485;20031047;22025362,rs601338,5,chr19,49206674,A,http://evidence.pgp-hms.org/genomes?display_genome_id=ebeb2607ff8fa5363e4b1891c7013013cae55707
PRNP-M129V,PRNP,"This variant is associated with some protective effects for prion disease -- individuals homozygous for this variant are less susceptible to Creutzfeldt-Jakob, and Papua New Guinea individuals heterozygotes at this site are less susceptible to kuru.

",Low,Well-established,Protective,0.34,Other,Complex/Other,Heterozygous,18236005;19081515,rs1799990,0,chr20,4680251,G,http://evidence.pgp-hms.org/genomes?display_genome_id=ebeb2607ff8fa5363e4b1891c7013013cae55707
CFH-V62I,CFH,"Associated with a decreased risk for age related macular degeneration (ARMD). Homozygotes for this have a 4-5% decreased attributable risk (3-4% vs. average 8% risk), heterozygotes have slightly lower than average risk (7%). Non-carriers have an increased risk (12-13%). ARMD impairs sharp vision as age progresses. While there is no cure, treatment can slow progression of the disease and environmental factors (smoking and obesity) contribute to higher risk.",Low,Likely,Protective,0.39,Hearing and vision;Metabolism,Complex/Other,Heterozygous,15870199,rs800292,2,chr1,196642233,A,http://evidence.pgp-hms.org/genomes?display_genome_id=ebeb2607ff8fa5363e4b1891c7013013cae55707
NPC1-H215R,NPC1,"This variant is associated with a reduced risk of obesity, with an additive effect of -0.084 BMI per allele (an average of 0.54 pounds less, per allele, in a 5'6"" individual).





",Low,Likely,Protective,0.3,Metabolism,Complex/Other,Heterozygous,19151714;19174833;19910939,rs1805081,2,chr18,21140432,C,http://evidence.pgp-hms.org/genomes?display_genome_id=ebeb2607ff8fa5363e4b1891c7013013cae55707
KCNJ11-K23E,KCNJ11,"This variant is associated with decreased risk of type 2 diabetes. It is unclear whether this variant has additive effects, or acts in a dominant or recessive manner. Assuming diabetes has a lifetime risk of 36%, we estimate a decreased risk of around 1-2% per copy of this variant.",Low,Likely,Protective,0.74,Metabolism,Unknown,Homozygous,17463246;17463248;20054294,rs5219,2,chr11,17409572,C,http://evidence.pgp-hms.org/genomes?display_genome_id=ebeb2607ff8fa5363e4b1891c7013013cae55707
IL7R-T244I,IL7R,"The reference genome variant for this allele has been associated with a slight increased risk of multiple sclerosis. Thus, this variant can be treated as a ""protective"" variant -- carriers of this variant are slightly less likely to have MS. Because the disease is rare and the effect of this variant is not very strong, the absolute decreased risk for carriers of this variant is less than .05% (less than 1 in 2000).",Low,Likely,Protective,0.21,Immune system;Nervous system,Unknown,Heterozygous,12825072;17660530;17660816;17660817;21161391,rs6897932,0,chr5,35874575,T,http://evidence.pgp-hms.org/genomes?display_genome_id=ebeb2607ff8fa5363e4b1891c7013013cae55707
TYR-R402Q,TYR,"This is a frequent pigmentation polymorphism in Europeans that affects function of the Tyrosinase gene. It is associated with blue instead of green eyes and sun sensitivity. For the most part this variant is benign, but many individuals with ocular albinism (which affects only the eyes) carry this variant along with another more severe variant in the same gene.",Low,Well-established,Benign,0.2,Hearing and vision,Complex/Other,Heterozygous,1820207;7704033;11284711;18326704;18488027;18488028;19533789,rs1126809,0,chr11,89017961,A,http://evidence.pgp-hms.org/genomes?display_genome_id=ebeb2607ff8fa5363e4b1891c7013013cae55707
COL6A3-D2831H,COL6A3,"Probably benign, reported by Pan et al. as a presumed-nonpathogenic variant in the gene.",Low,Likely,Benign,0.068,Other,Unknown,Heterozygous,9536084;15563506,rs36104025,,chr2,238247734,G,http://evidence.pgp-hms.org/genomes?display_genome_id=ebeb2607ff8fa5363e4b1891c7013013cae55707
NEFL-S472Shift,NEFL,"Although a frameshift in this gene would be predicted to cause Charcot-Marie Neuropathy, this particular position appears to reflect a single base insertion error/mutation in the reference genome (in other words, normal individuals are always homozygous for a deletion at this position relative to reference). See chr8:24,811,060-24,811,080 annotations on UCSC.",Low,Likely,Benign,,Nervous system,Unknown,Homozygous,,rs11340767,,,,,http://evidence.pgp-hms.org/genomes?display_genome_id=ebeb2607ff8fa5363e4b1891c7013013cae55707
CACNA1S-L458H,CACNA1S,Common polymorphism,Low,Likely,Benign,0.27,Other,Unknown,Homozygous,,rs12742169,,chr1,201052310,T,http://evidence.pgp-hms.org/genomes?display_genome_id=ebeb2607ff8fa5363e4b1891c7013013cae55707
FBN2-S2580L,FBN2,"Probably benign -- initially associated with congenital contractual arachnodactyly, but later reports classify it as a nonpathogenic polymorphism.",Low,Uncertain,Benign,0.078,Anatomical and congenital,Dominant,Heterozygous,9714438;10633129;16835936;17345643,rs2291628,,chr5,127609633,A,http://evidence.pgp-hms.org/genomes?display_genome_id=ebeb2607ff8fa5363e4b1891c7013013cae55707
MLH1-I219V,MLH1,"Computational evidence, functional assays, and case/control studies suggest this variant is probably benign.",Low,Uncertain,Benign,0.24,Other,Dominant,Heterozygous,11781295;12810663;17074586;17510385;17870204;19863800;20301390;22631669,rs1799977,0,chr3,37053568,G,http://evidence.pgp-hms.org/genomes?display_genome_id=ebeb2607ff8fa5363e4b1891c7013013cae55707
PCCA-I475V,PCCA,"Reported as a polymorphism, tentatively presumed benign.",Low,Uncertain,Benign,0.038,Other,Unknown,Heterozygous,10101253,rs35719359,,chr13,100962156,G,http://evidence.pgp-hms.org/genomes?display_genome_id=ebeb2607ff8fa5363e4b1891c7013013cae55707
PKP2-L366P,PKP2,This variant is a benign polymorphism.  ,Low,Uncertain,Benign,0.22,Other,Unknown,Heterozygous,19955750,rs1046116,,chr12,33021934,G,http://evidence.pgp-hms.org/genomes?display_genome_id=ebeb2607ff8fa5363e4b1891c7013013cae55707
FMO3-V257M,FMO3,"This common variant (HapMap allele frequency of 9.2%) appears to have no functional effect. OMIM has recorded it as having been seen homozygously in an individual with Trimethylaminuria, but Treacy et al. 1998 conclude it is a polymorphism.",Low,Uncertain,Benign,0.057,Metabolism,Unknown,Heterozygous,9536088,rs1736557,,chr1,171080080,A,http://evidence.pgp-hms.org/genomes?display_genome_id=ebeb2607ff8fa5363e4b1891c7013013cae55707
KRT85-R78H,KRT85,"Presumed benign. Although this variant was implicated in causing ectodermal dysplasia in a recessive manner in two Pakistani families (one of which was large and consanguineous), GET-Evidence reports that the variant has been seen in 5 out of 114 random control chromosomes. This strongly contradicts a severe pathogenic effect.",Low,Uncertain,Benign,0.042,Skin,Recessive,Heterozygous,16525032;19865094,rs61630004,,chr12,52760957,T,http://evidence.pgp-hms.org/genomes?display_genome_id=ebeb2607ff8fa5363e4b1891c7013013cae55707
FLG-R3530S,FLG,"Tentatively classified as benign, although predicted by Polyphen 2 to be damaging. Other more severe null mutations (frameshift and nonsense) in this gene are reported to cause ichthyosis vulgaris in a recessive manner.",Low,Uncertain,Benign,0.11,Skin,Unknown,Heterozygous,,rs72697000,,chr1,152276772,A,http://evidence.pgp-hms.org/genomes?display_genome_id=ebeb2607ff8fa5363e4b1891c7013013cae55707
BRCA1-Q356R,BRCA1,"One common variant associated this variant with an increased risk of breast cancer, but a more recent, larger study found no association.",Low,Uncertain,Benign,0.046,Cancer,Unknown,Heterozygous,17341484;19661094,rs1799950,,chr17,41246481,C,http://evidence.pgp-hms.org/genomes?display_genome_id=ebeb2607ff8fa5363e4b1891c7013013cae55707
APOB-Y1422C,APOB,This position is almost certainly an error in the HG18 reference sequence. ,Low,Uncertain,Benign,1.0,Other,Unknown,Homozygous,,rs568413,,chr2,21235475,C,http://evidence.pgp-hms.org/genomes?display_genome_id=ebeb2607ff8fa5363e4b1891c7013013cae55707
NEUROD1-P197H,NEUROD1,"Tentatively presumed benign. Other disruptive mutations in this gene have been reported to cause type 2 diabetes in a dominant manner, but this was found in a PGP participant who does not report having the disease.",Low,Uncertain,Benign,0.02,Metabolism,Unknown,Heterozygous,10545951,rs8192556,,chr2,182542998,T,http://evidence.pgp-hms.org/genomes?display_genome_id=ebeb2607ff8fa5363e4b1891c7013013cae55707
PCSK9-G670E,PCSK9,This variant is likely benign. ,Low,Uncertain,Benign,0.89,Other,Unknown,Heterozygous,19351729,rs505151,,chr1,55529187,A,http://evidence.pgp-hms.org/genomes?display_genome_id=ebeb2607ff8fa5363e4b1891c7013013cae55707
TAS2R38-A49P,TAS2R38,"This variant is strongly associated with causing the ""taster"" phenotype of phenylthiocarbamine (PTC) in a dominant manner.",Low,Uncertain,Benign,0.43,Other,Unknown,Heterozygous,12595690;15883422;20675712,rs713598,,chr7,141673345,G,http://evidence.pgp-hms.org/genomes?display_genome_id=ebeb2607ff8fa5363e4b1891c7013013cae55707
TAS2R38-I296V,TAS2R38,"This variant is associated with ""taster"" status of PTC, along with 49P and 262A. Due to linkage disequilibrium, the independent effects of positions 296 and 262 is unclear. The presence of 49P confers taster status in a dominant fashion, but in the absence of 49P, the presence of 262A/296V is still positively associated with tasting PTC.",Low,Uncertain,Benign,0.46,Other,Unknown,Heterozygous,12595690;20675712,rs10246939,,chr7,141672604,C,http://evidence.pgp-hms.org/genomes?display_genome_id=ebeb2607ff8fa5363e4b1891c7013013cae55707
SLC45A2-L374F,SLC45A2,"Pigmentation allele for non-black hair, and consequently, possible increased susceptibility to malignant melanoma.",Low,Uncertain,Benign,0.69,Cancer,Unknown,Homozygous,15714523;17044855;18563784;18806926,rs16891982,,chr5,33951693,G,http://evidence.pgp-hms.org/genomes?display_genome_id=ebeb2607ff8fa5363e4b1891c7013013cae55707
PTCH1-P1315L,PTCH1,"Common polymorphism, presumed benign.",Low,Uncertain,Benign,0.3,Other,Unknown,Heterozygous,15712338,rs357564,,chr9,98209594,A,http://evidence.pgp-hms.org/genomes?display_genome_id=ebeb2607ff8fa5363e4b1891c7013013cae55707
TXNDC3-I338T,TXNDC3,"Tentatively classified as benign, but predicted to be damaging and other variants in this gene are implicated in causing primary ciliary dyskinesia (situs inversus, chronic sinusitis, and bronchiectasis).",Low,Uncertain,Benign,0.038,Anatomical and congenital;Breathing,Unknown,Heterozygous,,rs62001870,,chr7,37923923,C,http://evidence.pgp-hms.org/genomes?display_genome_id=ebeb2607ff8fa5363e4b1891c7013013cae55707
