variant,gene_symbol,summary,clinical_importance,evidence,impact,frequency,category,inheritance,zygosity,PMIDs,dbSNP_ID,penetrance_score,build_37_chromosome,build_37_position,build_37_variant_allele,getev_report_url
MYO1A-S797F,MYO1A,"Although reported to cause dominant, early-onset sensorineural hearing loss, this variant has been reported in the genome of an unaffected PGP participant.",Moderate,Uncertain,Pathogenic,0.0047,Hearing and vision;Nervous system,Dominant,Heterozygous,12736868,rs113470661,5,chr12,57424918,A,http://evidence.personalgenomes.org/genomes?display_genome_id=648144bce22d26001f815dd6e8c58df15c720589&access_token=c5ef34c09e1c98a6c1e55437905b4a4b
SIAE-M89V,SIAE,"This variant was reported to be associated with autoimmune disease when homozygous. However, a later publication has contradicted this result, finding no significant association between this variant and autoimmune disease in a very large cohort.",Moderate,Uncertain,Pathogenic,0.04,Immune system,Recessive,Heterozygous,20555325;22200769,rs78778622,3,chr11,124530664,C,http://evidence.personalgenomes.org/genomes?display_genome_id=648144bce22d26001f815dd6e8c58df15c720589&access_token=c5ef34c09e1c98a6c1e55437905b4a4b
COL4A1-Q1334H,COL4A1,"This common variant has been associated with arterial stiffness and, in Japanese, a small increased risk of myocardial infarction (MI, a.k.a. heart attack). This last observation supported a dominant effect for this variant and, assuming a lifetime risk of 15% for MI, we estimate carriers have an additional risk of 0.5-3%.",Low,Likely,Pathogenic,0.32,Heart and circulatory,Dominant,Homozygous,10334796;18077766;20031579,rs3742207,2,chr13,110818598,G,http://evidence.personalgenomes.org/genomes?display_genome_id=648144bce22d26001f815dd6e8c58df15c720589&access_token=c5ef34c09e1c98a6c1e55437905b4a4b
MTRR-I49M,MTRR,"This common variant (HapMap allele frequency of 31.3%) in a protein involved in folate (B9) and cobalamin (B12) metabolism and is often reported as ""MTRR I22M"" (an alternative transcript position). Mothers homozygous for this variant are associated with having around a increased chance of a child with Down syndrome (risk of 0.4%, average risk in population is 0.25%). Notably, age plays a far larger role in the rate of Down syndrome (risk is 4.5% for a mother 45-years-of-age), and it is unknown how this variant may combine with the effect of age. There are conflicting reports associating this variant with incidence of neural tube defects, possibly when combined with MTHFR A222V.",Low,Likely,Pathogenic,0.45,Anatomical and congenital;Metabolism;Nervous system,Recessive,Heterozygous,10444342;10930360;11807890;12375236;15060097;15979034;17024475,rs1801394,1,chr5,7870973,G,http://evidence.personalgenomes.org/genomes?display_genome_id=648144bce22d26001f815dd6e8c58df15c720589&access_token=c5ef34c09e1c98a6c1e55437905b4a4b
MBL2-R52C,MBL2,"This variant is associated with mannose binding protein deficiency which leads to impaired complement system immune response to mannose-rich pathogens. Patients homozygous for this allele or compound heterozygous are likely to have increased susceptibility to infection, but Hellemann et al. report heterosis for intensive care outcomes in heterozygous subjects. The wild-type version of this gene is known as variant allele A, while this is called variant allele D. See G54D (variant B) and G57E (variant C).",Low,Likely,Pathogenic,0.049,Immune system,Recessive,Heterozygous,7564730;10199352;17872904,rs5030737,1,chr10,54531242,A,http://evidence.personalgenomes.org/genomes?display_genome_id=648144bce22d26001f815dd6e8c58df15c720589&access_token=c5ef34c09e1c98a6c1e55437905b4a4b
AMPD1-Q12X,AMPD1,"Causes Adenosine Deaminase Deficiency in a recessive manner. Most of the time individuals do not report symptoms, but when symptoms do exist they to be post-exercise symptoms of muscle weakness, muscle pain, and getting tired more quickly.",Low,Likely,Pathogenic,0.093,"Metabolism;Muscular, skeletal, and connective tissue",Recessive,Heterozygous,1631143,rs17602729,4,chr1,115236057,A,http://evidence.personalgenomes.org/genomes?display_genome_id=648144bce22d26001f815dd6e8c58df15c720589&access_token=c5ef34c09e1c98a6c1e55437905b4a4b
FANCG-R513Q,FANCG,"Rare polymorphism. Hypothesized to increase susceptibility to childhood acute myeloid leukemia, but the numbers in the study failed to have statistical significance.",Low,Uncertain,Pathogenic,0.0072,Blood;Cancer,Dominant,Heterozygous,16643430,rs17885240,2,chr9,35075022,T,http://evidence.personalgenomes.org/genomes?display_genome_id=648144bce22d26001f815dd6e8c58df15c720589&access_token=c5ef34c09e1c98a6c1e55437905b4a4b
RNASEL-R462Q,RNASEL,"Associated with increased risk of prostate cancer in individuals who already have a family history of prostate cancer, but studies have been unable to replicate this finding in sporadic (non-familial) prostate cancer cases.",Low,Uncertain,Pathogenic,0.28,Cancer;Genital and urinary,Complex/Other,Heterozygous,11941539;12022038;12415269;17407163,rs486907,2,chr1,182554557,T,http://evidence.personalgenomes.org/genomes?display_genome_id=648144bce22d26001f815dd6e8c58df15c720589&access_token=c5ef34c09e1c98a6c1e55437905b4a4b
BRCA2-N372H,BRCA2,"This is a common variant of BRCA2 (HapMap allele frequency of 23%). The variant is weakly associated with an increased chance of breast cancer, and zygosity of the variant is associated with sex of children: male children are more likely to be homozygous for this variant, female children are more likely to be heterozygous.",Low,Uncertain,Pathogenic,0.24,Cancer,Recessive,Heterozygous,11062481;15235023,rs144848,2,chr13,32906729,C,http://evidence.personalgenomes.org/genomes?display_genome_id=648144bce22d26001f815dd6e8c58df15c720589&access_token=c5ef34c09e1c98a6c1e55437905b4a4b
WFS1-R611H,WFS1,"This nonsynonymous SNP is associated with Wolfram Syndrome (known as DIDMOAD), which is characterized by early-onset non-autoimmune diabetes mellitus, diabetes insipidus, optic atrophy, and deafness) and to adult Type Two Diabetes Mellitus.  The WFS1 gene maps to chromosome 4p16.3.  The variant has been shown to be statistically associated with type II diabetes in six UK studies and one study of Ashkenazi Jews (Sandhu, M., et al., Minton et al.).",Low,Uncertain,Not Reviewed,0.4,Hearing and vision;Immune system;Metabolism,Recessive,Heterozygous,17603484;17719176;23257691,rs734312,1,chr4,6303354,A,http://evidence.personalgenomes.org/genomes?display_genome_id=648144bce22d26001f815dd6e8c58df15c720589&access_token=c5ef34c09e1c98a6c1e55437905b4a4b
SP110-L425S,SP110,"This variant is associated with a slightly increased risk of tuberculosis. It is unclear whether it is itself causal, or in linkage disequilibrium with some other causal variant that has a stronger effect.",Low,Uncertain,Pathogenic,0.86,Immune system,Unknown,Homozygous,16803959,rs3948464,1,chr2,231050715,G,http://evidence.personalgenomes.org/genomes?display_genome_id=648144bce22d26001f815dd6e8c58df15c720589&access_token=c5ef34c09e1c98a6c1e55437905b4a4b
TP53-P72R,TP53,"This is a common variant was first reported as a polymorphism. It has since had mixed associations with cancer: Storey et al. conclude a 7x *increased* risk of HPV cancer for homozygotes vs hets, but Jones et al. find a 1.98x *decreased* risk for colorectal cancer. This variant may have significant impact on particular cancers, but it is unclear what effect it has on the overall burden of cancer.",Low,Uncertain,Pathogenic,0.63,Cancer,Unknown,Heterozygous,1975675;9607760;15355915;19837266;20615891;22184967,rs1042522,0,chr17,7579472,C,http://evidence.personalgenomes.org/genomes?display_genome_id=648144bce22d26001f815dd6e8c58df15c720589&access_token=c5ef34c09e1c98a6c1e55437905b4a4b
rs1544410,,"rs1544410 is a Vitamin D Receptor (VDR) single nucleotide polymorphism. It is unlikely that it has functional significance because it is located in an intron (Liu et. al.), but it is in strong linkage disequilibrium with rs731236 (Dvornyk et al), which is located in an exon. ",Low,Uncertain,Pharmacogenetic,0.35,Other,Unknown,Heterozygous,,rs1544410,0,,,,http://evidence.personalgenomes.org/genomes?display_genome_id=648144bce22d26001f815dd6e8c58df15c720589&access_token=c5ef34c09e1c98a6c1e55437905b4a4b
PRNP-M129V,PRNP,"This variant is associated with some protective effects for prion disease -- individuals homozygous for this variant are less susceptible to Creutzfeldt-Jakob, and Papua New Guinea individuals heterozygotes at this site are less susceptible to kuru.

",Low,Well-established,Protective,0.34,Other,Complex/Other,Heterozygous,18236005;19081515,rs1799990,0,chr20,4680251,G,http://evidence.personalgenomes.org/genomes?display_genome_id=648144bce22d26001f815dd6e8c58df15c720589&access_token=c5ef34c09e1c98a6c1e55437905b4a4b
NPC1-H215R,NPC1,"This variant is associated with a reduced risk of obesity, with an additive effect of -0.084 BMI per allele (an average of 0.54 pounds less, per allele, in a 5'6"" individual).





",Low,Likely,Protective,0.3,Metabolism,Complex/Other,Heterozygous,19151714;19174833;19910939,rs1805081,2,chr18,21140432,C,http://evidence.personalgenomes.org/genomes?display_genome_id=648144bce22d26001f815dd6e8c58df15c720589&access_token=c5ef34c09e1c98a6c1e55437905b4a4b
KCNJ11-K23E,KCNJ11,"This variant is associated with decreased risk of type 2 diabetes. It is unclear whether this variant has additive effects, or acts in a dominant or recessive manner. Assuming diabetes has a lifetime risk of 36%, we estimate a decreased risk of around 1-2% per copy of this variant.",Low,Likely,Protective,0.74,Metabolism,Unknown,Homozygous,17463246;17463248;20054294,rs5219,2,chr11,17409572,C,http://evidence.personalgenomes.org/genomes?display_genome_id=648144bce22d26001f815dd6e8c58df15c720589&access_token=c5ef34c09e1c98a6c1e55437905b4a4b
TOR1A-D216H,TOR1A,This SNP has been shown to be benign and play a protective role against Dystonia.  ,Low,Likely,Protective,0.1,Nervous system,Unknown,Heterozygous,18519876;19380705;20669276,rs1801968,1,chr9,132580901,G,http://evidence.personalgenomes.org/genomes?display_genome_id=648144bce22d26001f815dd6e8c58df15c720589&access_token=c5ef34c09e1c98a6c1e55437905b4a4b
EVC-R443Q,EVC,"Probably benign. Implicated in causing Ellis-van Creveld Syndrome in a dominant manner (despite the disease typically being recessive), but the high allele frequency of this variant (7.8% in GET-Evidence data) strongly contradicts any severe pathogenic effect.",Low,Likely,Benign,0.079,Anatomical and congenital,Complex/Other,Heterozygous,10700184,rs35953626,,chr4,5755524,A,http://evidence.personalgenomes.org/genomes?display_genome_id=648144bce22d26001f815dd6e8c58df15c720589&access_token=c5ef34c09e1c98a6c1e55437905b4a4b
PMS2-P470S,PMS2,"Benign, common variant.",Low,Likely,Benign,0.37,Other,Unknown,Heterozygous,15256438,rs1805321,,chr7,6026988,A,http://evidence.personalgenomes.org/genomes?display_genome_id=648144bce22d26001f815dd6e8c58df15c720589&access_token=c5ef34c09e1c98a6c1e55437905b4a4b
MLH1-I219V,MLH1,"Computational evidence, functional assays, and case/control studies suggest this variant is probably benign.",Low,Uncertain,Benign,0.24,Other,Dominant,Heterozygous,11781295;12810663;17074586;17510385;17870204;19863800;20301390;22631669,rs1799977,0,chr3,37053568,G,http://evidence.personalgenomes.org/genomes?display_genome_id=648144bce22d26001f815dd6e8c58df15c720589&access_token=c5ef34c09e1c98a6c1e55437905b4a4b
ALOX12B-P127S,ALOX12B,"This variant was found heterozygously in autosomal recessive congenital ichthyosis in two Turkish siblings, although the second mutation was not found. Later, Lesueur et al. observe that this variant has a 4% frequency in their North African controls and is likely just a rare SNP.",Low,Uncertain,Benign,0.017,Skin,Complex/Other,Heterozygous,16116617;17139268,rs72842957,,chr17,7984479,A,http://evidence.personalgenomes.org/genomes?display_genome_id=648144bce22d26001f815dd6e8c58df15c720589&access_token=c5ef34c09e1c98a6c1e55437905b4a4b
RPGRIP1-A547S,RPGRIP1,"Probably benign. Implicated in causing autosomal recessive cone-rod dystrophy, but a later report found the same incidence in controls and concludes it is not causal.",Low,Uncertain,Benign,0.23,Hearing and vision,Complex/Other,Heterozygous,12920076;16272259,rs10151259,,chr14,21790040,T,http://evidence.personalgenomes.org/genomes?display_genome_id=648144bce22d26001f815dd6e8c58df15c720589&access_token=c5ef34c09e1c98a6c1e55437905b4a4b
TAS2R38-A49P,TAS2R38,"This variant is strongly associated with causing the ""taster"" phenotype of phenylthiocarbamine (PTC) in a dominant manner.",Low,Uncertain,Benign,0.43,Other,Unknown,Homozygous,12595690;15883422;20675712,rs713598,,chr7,141673345,G,http://evidence.personalgenomes.org/genomes?display_genome_id=648144bce22d26001f815dd6e8c58df15c720589&access_token=c5ef34c09e1c98a6c1e55437905b4a4b
TPCN2-G734E,TPCN2,Pigmentation allele.,Low,Uncertain,Benign,0.29,Other,Unknown,Heterozygous,18488028,rs3829241,,chr11,68855363,A,http://evidence.personalgenomes.org/genomes?display_genome_id=648144bce22d26001f815dd6e8c58df15c720589&access_token=c5ef34c09e1c98a6c1e55437905b4a4b
RPGRIP1L-A1183G,RPGRIP1L,"Probably not pathogenic, although it may have a modifier effect in other diseases. Other disruptive variants in this gene are implicated in causing Joubert Syndrome and Meckel Syndrome in a recessive manner. Although this variant is somewhat rare (1.1% allele frequency) and Polyphen 2 predicts it to be disruptive, most reported disease-causing variants in the gene are more disruptive frameshift or nonsense mutations & occur upstream of this position.",Low,Uncertain,Benign,0.011,Anatomical and congenital;Mental and behavioral;Nervous system,Unknown,Heterozygous,19430481,,,chr16,53653005,C,http://evidence.personalgenomes.org/genomes?display_genome_id=648144bce22d26001f815dd6e8c58df15c720589&access_token=c5ef34c09e1c98a6c1e55437905b4a4b
TAS2R38-I296V,TAS2R38,"This variant is associated with ""taster"" status of PTC, along with 49P and 262A. Due to linkage disequilibrium, the independent effects of positions 296 and 262 is unclear. The presence of 49P confers taster status in a dominant fashion, but in the absence of 49P, the presence of 262A/296V is still positively associated with tasting PTC.",Low,Uncertain,Benign,0.46,Other,Unknown,Homozygous,12595690;20675712,rs10246939,,chr7,141672604,C,http://evidence.personalgenomes.org/genomes?display_genome_id=648144bce22d26001f815dd6e8c58df15c720589&access_token=c5ef34c09e1c98a6c1e55437905b4a4b
PCSK9-G670E,PCSK9,This variant is likely benign. ,Low,Uncertain,Benign,0.89,Other,Unknown,Homozygous,19351729,rs505151,,chr1,55529187,A,http://evidence.personalgenomes.org/genomes?display_genome_id=648144bce22d26001f815dd6e8c58df15c720589&access_token=c5ef34c09e1c98a6c1e55437905b4a4b
APOB-Y1422C,APOB,This position is almost certainly an error in the HG18 reference sequence. ,Low,Uncertain,Benign,1.0,Other,Unknown,Homozygous,,rs568413,,chr2,21235475,C,http://evidence.personalgenomes.org/genomes?display_genome_id=648144bce22d26001f815dd6e8c58df15c720589&access_token=c5ef34c09e1c98a6c1e55437905b4a4b
AMPD1-P48L,AMPD1,"Probably benign, ancestral to15173240 pathogenic Q12X mutation.",Low,Uncertain,Benign,0.094,Other,Unknown,Heterozygous,15173240,rs61752479,,chr1,115231254,A,http://evidence.personalgenomes.org/genomes?display_genome_id=648144bce22d26001f815dd6e8c58df15c720589&access_token=c5ef34c09e1c98a6c1e55437905b4a4b
F5-D2222G,F5,"Other mutations in this gene are associated with Factor 5 deficiency. There is no literature implicating this variant, however, and it is fairly common in the population (3.8% in HapMap), and so it is currently labeled as benign.",Low,Uncertain,Benign,0.045,Blood,Unknown,Heterozygous,,rs6027,,chr1,169483561,C,http://evidence.personalgenomes.org/genomes?display_genome_id=648144bce22d26001f815dd6e8c58df15c720589&access_token=c5ef34c09e1c98a6c1e55437905b4a4b
F5-M413T,F5,Presumed benign. This variant is not particularly rare and has not been reported to cause disease.,Low,Uncertain,Benign,0.058,Other,Unknown,Heterozygous,17284699,rs6033,,chr1,169521853,G,http://evidence.personalgenomes.org/genomes?display_genome_id=648144bce22d26001f815dd6e8c58df15c720589&access_token=c5ef34c09e1c98a6c1e55437905b4a4b
RP1-N985Y,RP1,"Probably benign. One report linked this variant to high triglycerides, but a later paper found a nearby SNP with similar association and suggests that both findings are caused by linkage to an undiscovered causal variant.",Low,Uncertain,Benign,0.35,Metabolism,Unknown,Homozygous,12764676;19364639,rs2293869,,chr8,55539395,T,http://evidence.personalgenomes.org/genomes?display_genome_id=648144bce22d26001f815dd6e8c58df15c720589&access_token=c5ef34c09e1c98a6c1e55437905b4a4b
PKP2-L366P,PKP2,This variant is a benign polymorphism.  ,Low,Uncertain,Benign,0.22,Other,Unknown,Heterozygous,19955750,rs1046116,,chr12,33021934,G,http://evidence.personalgenomes.org/genomes?display_genome_id=648144bce22d26001f815dd6e8c58df15c720589&access_token=c5ef34c09e1c98a6c1e55437905b4a4b
SLC45A2-L374F,SLC45A2,"Pigmentation allele for non-black hair, and consequently, possible increased susceptibility to malignant melanoma.",Low,Uncertain,Benign,0.69,Cancer,Unknown,Homozygous,15714523;17044855;18563784;18806926,rs16891982,,chr5,33951693,G,http://evidence.personalgenomes.org/genomes?display_genome_id=648144bce22d26001f815dd6e8c58df15c720589&access_token=c5ef34c09e1c98a6c1e55437905b4a4b
