variant,gene_symbol,summary,clinical_importance,evidence,impact,frequency,category,inheritance,zygosity,PMIDs,dbSNP_ID,penetrance_score,build_37_chromosome,build_37_position,build_37_variant_allele,getev_report_url
KCNE1-D85N,KCNE1,Proposed to cause drug-induced long QT syndrome by one group. Another group suggests an association with noise-induced hearing loss. Neither study found a statistical significant association for this variant after multiple hypotheses are corrected for.,High,Uncertain,Pathogenic,0.0087,Drug response;Hearing and vision;Heart and circulatory,Unknown,Heterozygous,14760488;16823764,,4,chr21,35821680,T,http://evidence.personalgenomes.org/genomes?display_genome_id=6b7fed3a12eb45734150eb86cdfa1a49b4b115ce&access_token=8e4ae29da141ed477b975996d370ecea
C3-R102G,C3,"This variant (also called C3F) is common in Europeans (10.2% allele frequency), and is associated with age-related macular degeneration. In the US, 1.5% of adults over 40 have the disease, but the incidence increases strongly with age (>15% in women over 80). Assuming an average lifetime risk of ~10%, heterozygous individuals have a ~13% risk and homozygous have ~20%.",Moderate,Likely,Pathogenic,0.15,Hearing and vision,Complex/Other,Heterozygous,4427677;17634448,rs2230199,3,chr19,6718387,C,http://evidence.personalgenomes.org/genomes?display_genome_id=6b7fed3a12eb45734150eb86cdfa1a49b4b115ce&access_token=8e4ae29da141ed477b975996d370ecea
COL4A1-Q1334H,COL4A1,"This common variant has been associated with arterial stiffness and, in Japanese, a small increased risk of myocardial infarction (MI, a.k.a. heart attack). This last observation supported a dominant effect for this variant and, assuming a lifetime risk of 15% for MI, we estimate carriers have an additional risk of 0.5-3%.",Low,Likely,Pathogenic,0.32,Heart and circulatory,Dominant,Homozygous,10334796;18077766;20031579,rs3742207,2,chr13,110818598,G,http://evidence.personalgenomes.org/genomes?display_genome_id=6b7fed3a12eb45734150eb86cdfa1a49b4b115ce&access_token=8e4ae29da141ed477b975996d370ecea
rs5186,,"This common noncoding genetic variant has an allele frequency of ~30% and is associated with an increased risk of hypertension. If ~25% of non-carriers have hypertension, Bonnardeaux et al's data predict ~4% increased risk of hypertension per copy of this variant. This SNP is in the 3' noncoding region of the AGTR1 transcript (angiotensin II type 1 receptor), also known as AT2R1 or AT1R, which is a target of hypertension drugs.",Low,Likely,Pathogenic,0.21,Drug response;Heart and circulatory,Unknown,Heterozygous,"8021009;
11250978;11593098;16046653;16675453;17668390",rs5186,2,chr3,148459988,C,http://evidence.personalgenomes.org/genomes?display_genome_id=6b7fed3a12eb45734150eb86cdfa1a49b4b115ce&access_token=8e4ae29da141ed477b975996d370ecea
AMPD1-Q12X,AMPD1,"Causes Adenosine Deaminase Deficiency in a recessive manner. Most of the time individuals do not report symptoms, but when symptoms do exist they to be post-exercise symptoms of muscle weakness, muscle pain, and getting tired more quickly.",Low,Likely,Pathogenic,0.093,"Metabolism;Muscular, skeletal, and connective tissue",Recessive,Heterozygous,1631143,rs17602729,4,chr1,115236057,A,http://evidence.personalgenomes.org/genomes?display_genome_id=6b7fed3a12eb45734150eb86cdfa1a49b4b115ce&access_token=8e4ae29da141ed477b975996d370ecea
WFS1-R611H,WFS1,"This nonsynonymous SNP is associated with Wolfram Syndrome (known as DIDMOAD), which is characterized by early-onset non-autoimmune diabetes mellitus, diabetes insipidus, optic atrophy, and deafness) and to adult Type Two Diabetes Mellitus.  The WFS1 gene maps to chromosome 4p16.3.  The variant has been shown to be statistically associated with type II diabetes in six UK studies and one study of Ashkenazi Jews (Sandhu, M., et al., Minton et al.).",Low,Uncertain,Not Reviewed,0.4,Hearing and vision;Immune system;Metabolism,Recessive,Homozygous,17603484;17719176;23257691,rs734312,1,chr4,6303354,A,http://evidence.personalgenomes.org/genomes?display_genome_id=6b7fed3a12eb45734150eb86cdfa1a49b4b115ce&access_token=8e4ae29da141ed477b975996d370ecea
ELAC2-S217L,ELAC2,"Reported to be associated with increased susceptibility to prostate cancer, but later studies weaken the hypothesis. Xu et al.'s meta-analysis concludes that there is a small but significant increased risk (OR = 1.13). Assuming a lifetime risk of 16% for prostate cancer we calculate this leads to an increased risk of ~1.5% (17.5% total).",Low,Uncertain,Pathogenic,0.27,Cancer;Genital and urinary,Complex/Other,Homozygous,12384782;15368467;18767027;20231859,rs4792311,2,chr17,12915009,A,http://evidence.personalgenomes.org/genomes?display_genome_id=6b7fed3a12eb45734150eb86cdfa1a49b4b115ce&access_token=8e4ae29da141ed477b975996d370ecea
TP53-P72R,TP53,"This is a common variant was first reported as a polymorphism. It has since had mixed associations with cancer: Storey et al. conclude a 7x *increased* risk of HPV cancer for homozygotes vs hets, but Jones et al. find a 1.98x *decreased* risk for colorectal cancer. This variant may have significant impact on particular cancers, but it is unclear what effect it has on the overall burden of cancer.",Low,Uncertain,Pathogenic,0.63,Cancer,Unknown,Heterozygous,1975675;9607760;15355915;19837266;20615891;22184967,rs1042522,0,chr17,7579472,C,http://evidence.personalgenomes.org/genomes?display_genome_id=6b7fed3a12eb45734150eb86cdfa1a49b4b115ce&access_token=8e4ae29da141ed477b975996d370ecea
SP110-L425S,SP110,"This variant is associated with a slightly increased risk of tuberculosis. It is unclear whether it is itself causal, or in linkage disequilibrium with some other causal variant that has a stronger effect.",Low,Uncertain,Pathogenic,0.86,Immune system,Unknown,Heterozygous,16803959,rs3948464,1,chr2,231050715,G,http://evidence.personalgenomes.org/genomes?display_genome_id=6b7fed3a12eb45734150eb86cdfa1a49b4b115ce&access_token=8e4ae29da141ed477b975996d370ecea
H6PD-R453Q,H6PD,"This common variant may have a small pathogenic effect by contributing to cortisone reductase deficiency (a rare abnormality) when homozygous and combined with a serious pathogenic variant. The same authors have tested and ruled out a contribution to polycystic ovary syndrome (similar phenotype, more common disease).",Low,Uncertain,Pathogenic,0.31,Genital and urinary;Metabolism,Recessive,Heterozygous,12858176;15827106;16817821,rs6688832,1,chr1,9323910,A,http://evidence.personalgenomes.org/genomes?display_genome_id=6b7fed3a12eb45734150eb86cdfa1a49b4b115ce&access_token=8e4ae29da141ed477b975996d370ecea
HFE-H63D,HFE,"There have been some hypotheses that this variant contributes to causing hereditary hemochromatosis, possibly as a compound heterozygote, but some others treat it as a polymorphism. Cys282Tyr is the classic causal variant and itself has very low penetrance. Mouse studies indicates this variant has a similar but weaker effect; if it has any effect at all its penetrance may be quite low and/or require modifier alleles.",Low,Uncertain,Pathogenic,0.11,Blood,Recessive,Heterozygous,8696333;9462220;12429850;14673107;17042772,rs1799945,1,chr6,26091179,G,http://evidence.personalgenomes.org/genomes?display_genome_id=6b7fed3a12eb45734150eb86cdfa1a49b4b115ce&access_token=8e4ae29da141ed477b975996d370ecea
DYX1C1-E417X,DYX1C1,"One study reports this variant to be associated with dyslexia. The study group was relatively small and so the results did not have strong significance. If they are representative this variant is associated with a doubled risk for dyslexia, but it is unclear whether the effect would be additive, dominant, or recessive.",Low,Uncertain,Pathogenic,0.2,Mental and behavioral,Unknown,Heterozygous,12954984,rs57809907,3,chr15,55722882,A,http://evidence.personalgenomes.org/genomes?display_genome_id=6b7fed3a12eb45734150eb86cdfa1a49b4b115ce&access_token=8e4ae29da141ed477b975996d370ecea
ERCC6-R1213G,ERCC6,"When homozygous, this variant may cause Cockayne Syndrome, which is a severe autosomal-recessive disorder characterized by abnormal early growth and development, abnormal sensitivity to sunlight, and premature aging. Cockayne Syndrome Type I and Type II lead to death in early childhood. Several other variants in the ERCC6 gene are linked to Cockayne Syndrome. This variant may also be linked to age-related macular degeneration like other ERCC6 variants, and has been linked to colorectal cancer in one study. ",Low,Uncertain,Pathogenic,0.2,Anatomical and congenital;Cancer;Hearing and vision,Recessive,Heterozygous,,rs2228527,0,chr10,50678369,C,http://evidence.personalgenomes.org/genomes?display_genome_id=6b7fed3a12eb45734150eb86cdfa1a49b4b115ce&access_token=8e4ae29da141ed477b975996d370ecea
CYP2C9-R144C,CYP2C9,"This variant, also called CYP2C9*2, is a pharmacogenetic variant that modulates sensitivity for Warfarin (due to reduced metabolism). This variant is associated with Caucasians. The FDA has approved reduced recommended Warfarin dosage based on the presence of this variant.",Moderate,Well-established,Pharmacogenetic,0.097,Drug response;Metabolism,Unknown,Heterozygous,8004131;15947090;17161452;17686967;19228618;19794411;19794412,rs1799853,3,chr10,96702047,T,http://evidence.personalgenomes.org/genomes?display_genome_id=6b7fed3a12eb45734150eb86cdfa1a49b4b115ce&access_token=8e4ae29da141ed477b975996d370ecea
ABCC6-R1268Q,ABCC6,This common polymorphism appears to not have a significant phenotypic impact. A few studies report weak but significant associations with plasma lipids (in Inuits) and thalidomide toxicity.,Low,Uncertain,Pharmacogenetic,0.22,Metabolism,Unknown,Heterozygous,10811882;10913334;11776382;20038957,rs2238472,1,chr16,16251599,T,http://evidence.personalgenomes.org/genomes?display_genome_id=6b7fed3a12eb45734150eb86cdfa1a49b4b115ce&access_token=8e4ae29da141ed477b975996d370ecea
FUT2-W154X,FUT2,"This recessive protective variant confers resistance to norovirus (which causes stomach flu). 20% of Caucasians and Africans are homozygous for this variant and are ""non-secretors"": they do not express ABO blood type antigens in their saliva or mucosal surfaces. Most strains of norovirus bind to these antigens in the gut, and so this non-secretor status confers almost total resistantance to most types of norovirus. There are notable exceptions, some strains of norovirus bind a different target and are equally infectious for secretors and non-secretors.",Moderate,Well-established,Protective,0.49,Blood;Immune system,Recessive,Heterozygous,7876235;12692541;19625485;20031047;22025362,rs601338,5,chr19,49206674,A,http://evidence.personalgenomes.org/genomes?display_genome_id=6b7fed3a12eb45734150eb86cdfa1a49b4b115ce&access_token=8e4ae29da141ed477b975996d370ecea
CFH-V62I,CFH,"Associated with a decreased risk for age related macular degeneration (ARMD). Homozygotes for this have a 4-5% decreased attributable risk (3-4% vs. average 8% risk), heterozygotes have slightly lower than average risk (7%). Non-carriers have an increased risk (12-13%). ARMD impairs sharp vision as age progresses. While there is no cure, treatment can slow progression of the disease and environmental factors (smoking and obesity) contribute to higher risk.",Low,Likely,Protective,0.39,Hearing and vision;Metabolism,Complex/Other,Heterozygous,15870199,rs800292,2,chr1,196642233,A,http://evidence.personalgenomes.org/genomes?display_genome_id=6b7fed3a12eb45734150eb86cdfa1a49b4b115ce&access_token=8e4ae29da141ed477b975996d370ecea
NPC1-H215R,NPC1,"This variant is associated with a reduced risk of obesity, with an additive effect of -0.084 BMI per allele (an average of 0.54 pounds less, per allele, in a 5'6"" individual).





",Low,Likely,Protective,0.3,Metabolism,Complex/Other,Heterozygous,19151714;19174833;19910939,rs1805081,2,chr18,21140432,C,http://evidence.personalgenomes.org/genomes?display_genome_id=6b7fed3a12eb45734150eb86cdfa1a49b4b115ce&access_token=8e4ae29da141ed477b975996d370ecea
KCNJ11-K23E,KCNJ11,"This variant is associated with decreased risk of type 2 diabetes. It is unclear whether this variant has additive effects, or acts in a dominant or recessive manner. Assuming diabetes has a lifetime risk of 36%, we estimate a decreased risk of around 1-2% per copy of this variant.",Low,Likely,Protective,0.74,Metabolism,Unknown,Heterozygous,17463246;17463248;20054294,rs5219,2,chr11,17409572,C,http://evidence.personalgenomes.org/genomes?display_genome_id=6b7fed3a12eb45734150eb86cdfa1a49b4b115ce&access_token=8e4ae29da141ed477b975996d370ecea
TOR1A-D216H,TOR1A,This SNP has been shown to be benign and play a protective role against Dystonia.  ,Low,Likely,Protective,0.1,Nervous system,Unknown,Heterozygous,18519876;19380705;20669276,rs1801968,1,chr9,132580901,G,http://evidence.personalgenomes.org/genomes?display_genome_id=6b7fed3a12eb45734150eb86cdfa1a49b4b115ce&access_token=8e4ae29da141ed477b975996d370ecea
IL7R-T244I,IL7R,"The reference genome variant for this allele has been associated with a slight increased risk of multiple sclerosis. Thus, this variant can be treated as a ""protective"" variant -- carriers of this variant are slightly less likely to have MS. Because the disease is rare and the effect of this variant is not very strong, the absolute decreased risk for carriers of this variant is less than .05% (less than 1 in 2000).",Low,Likely,Protective,0.21,Immune system;Nervous system,Unknown,Heterozygous,12825072;17660530;17660816;17660817;21161391,rs6897932,0,chr5,35874575,T,http://evidence.personalgenomes.org/genomes?display_genome_id=6b7fed3a12eb45734150eb86cdfa1a49b4b115ce&access_token=8e4ae29da141ed477b975996d370ecea
TYR-R402Q,TYR,"This is a frequent pigmentation polymorphism in Europeans that affects function of the Tyrosinase gene. It is associated with blue instead of green eyes and sun sensitivity. For the most part this variant is benign, but many individuals with ocular albinism (which affects only the eyes) carry this variant along with another more severe variant in the same gene.",Low,Well-established,Benign,0.2,Hearing and vision,Complex/Other,Heterozygous,1820207;7704033;11284711;18326704;18488027;18488028;19533789,rs1126809,0,chr11,89017961,A,http://evidence.personalgenomes.org/genomes?display_genome_id=6b7fed3a12eb45734150eb86cdfa1a49b4b115ce&access_token=8e4ae29da141ed477b975996d370ecea
ARSA-N350S,ARSA,This common variant (HapMap 24.1% allele frequency) causes a loss of a glycosylation site (affecting the size of the protein when studied with gel electrophoresis) but does not affect enzyme activity or stability.,Low,Well-established,Benign,0.18,Other,Unknown,Homozygous,2574462,rs2071421,,chr22,51064416,C,http://evidence.personalgenomes.org/genomes?display_genome_id=6b7fed3a12eb45734150eb86cdfa1a49b4b115ce&access_token=8e4ae29da141ed477b975996d370ecea
FANCI-P55L,FANCI,Probably benign.,Low,Likely,Benign,0.051,Other,Unknown,Homozygous,17412408,rs62020347,,chr15,89803950,T,http://evidence.personalgenomes.org/genomes?display_genome_id=6b7fed3a12eb45734150eb86cdfa1a49b4b115ce&access_token=8e4ae29da141ed477b975996d370ecea
PMS2-P470S,PMS2,"Benign, common variant.",Low,Likely,Benign,0.37,Other,Unknown,Homozygous,15256438,rs1805321,,chr7,6026988,A,http://evidence.personalgenomes.org/genomes?display_genome_id=6b7fed3a12eb45734150eb86cdfa1a49b4b115ce&access_token=8e4ae29da141ed477b975996d370ecea
FANCA-M717I,FANCA,"Rare polymorphism, not considered pathogenic.",Low,Likely,Benign,0.022,Other,Unknown,Heterozygous,10521298,rs1131660,,chr16,89838086,A,http://evidence.personalgenomes.org/genomes?display_genome_id=6b7fed3a12eb45734150eb86cdfa1a49b4b115ce&access_token=8e4ae29da141ed477b975996d370ecea
CACNA1S-L458H,CACNA1S,Common polymorphism,Low,Likely,Benign,0.27,Other,Unknown,Heterozygous,,rs12742169,,chr1,201052310,T,http://evidence.personalgenomes.org/genomes?display_genome_id=6b7fed3a12eb45734150eb86cdfa1a49b4b115ce&access_token=8e4ae29da141ed477b975996d370ecea
FBN2-S2580L,FBN2,"Probably benign -- initially associated with congenital contractual arachnodactyly, but later reports classify it as a nonpathogenic polymorphism.",Low,Uncertain,Benign,0.078,Anatomical and congenital,Dominant,Heterozygous,9714438;10633129;16835936;17345643,rs2291628,,chr5,127609633,A,http://evidence.personalgenomes.org/genomes?display_genome_id=6b7fed3a12eb45734150eb86cdfa1a49b4b115ce&access_token=8e4ae29da141ed477b975996d370ecea
LOXL1-R141L,LOXL1,"Associated with exfoliative glaucoma & syndrome (XFG & XFS) in various populations, but with contradicting results (protective in Caucasians, pathogenic in Japanese). Based on this it seems the variation itself -- although it affects protein structure -- is not itself causing disease. Instead it is likely associated with other nearby causal variants. As such, it is evaluated as benign by GET-Evidence (which focuses on reporting causal variants). See detailed variant report for disease risk associations.",Low,Uncertain,Benign,0.26,Hearing and vision,Complex/Other,Homozygous,17690259;18450598;20142848,rs1048661,,chr15,74219546,T,http://evidence.personalgenomes.org/genomes?display_genome_id=6b7fed3a12eb45734150eb86cdfa1a49b4b115ce&access_token=8e4ae29da141ed477b975996d370ecea
UNC13D-A59T,UNC13D,"Probably benign. This variant was reported to cause haemophagocytic lymphohistiocytosis in a recessive manner, but its allele frequency is inconsistent with this hypothesis and so we evaluate it as a nonpathogenic polymorphism.",Low,Uncertain,Benign,0.017,Blood,Unknown,Heterozygous,16825436,rs9904366,,chr17,73839326,T,http://evidence.personalgenomes.org/genomes?display_genome_id=6b7fed3a12eb45734150eb86cdfa1a49b4b115ce&access_token=8e4ae29da141ed477b975996d370ecea
MAPT-R370W,MAPT,Probably benign.,Low,Uncertain,Benign,0.16,Other,Unknown,Heterozygous,15365985,rs17651549,,chr17,44061278,T,http://evidence.personalgenomes.org/genomes?display_genome_id=6b7fed3a12eb45734150eb86cdfa1a49b4b115ce&access_token=8e4ae29da141ed477b975996d370ecea
NTRK1-H604Y,NTRK1,"Various databases and papers treat this variant as a non-pathogenic polymorphism, although it is fairly uncommon and is computational methods predict it to be damaging.",Low,Uncertain,Benign,0.043,Other,Unknown,Heterozygous,10443680;16412461;21228398,rs6336,,chr1,156848918,T,http://evidence.personalgenomes.org/genomes?display_genome_id=6b7fed3a12eb45734150eb86cdfa1a49b4b115ce&access_token=8e4ae29da141ed477b975996d370ecea
DSPP-R68W,DSPP,"Probably benign. One report linked this to causing dentinogenesis Imperfecta type II in a large Swedish family, but subsequent publications have observed this is a common variant and conclude it is a nonpathogenic polymorphism.",Low,Uncertain,Benign,0.14,"Mouth, liver, and digestive",Unknown,Heterozygous,14758537;17452557;18797159,rs36094464,,chr4,88533540,T,http://evidence.personalgenomes.org/genomes?display_genome_id=6b7fed3a12eb45734150eb86cdfa1a49b4b115ce&access_token=8e4ae29da141ed477b975996d370ecea
APOB-Y1422C,APOB,This position is almost certainly an error in the HG18 reference sequence. ,Low,Uncertain,Benign,1.0,Other,Unknown,Homozygous,,rs568413,,chr2,21235475,C,http://evidence.personalgenomes.org/genomes?display_genome_id=6b7fed3a12eb45734150eb86cdfa1a49b4b115ce&access_token=8e4ae29da141ed477b975996d370ecea
AMPD1-P48L,AMPD1,"Probably benign, ancestral to15173240 pathogenic Q12X mutation.",Low,Uncertain,Benign,0.094,Other,Unknown,Heterozygous,15173240,rs61752479,,chr1,115231254,A,http://evidence.personalgenomes.org/genomes?display_genome_id=6b7fed3a12eb45734150eb86cdfa1a49b4b115ce&access_token=8e4ae29da141ed477b975996d370ecea
MAPT-Q230R,MAPT,Common polymorphism.,Low,Uncertain,Benign,0.042,Other,Unknown,Heterozygous,15365985,rs63750072,,chr17,44060859,G,http://evidence.personalgenomes.org/genomes?display_genome_id=6b7fed3a12eb45734150eb86cdfa1a49b4b115ce&access_token=8e4ae29da141ed477b975996d370ecea
NTRK1-G613V,NTRK1,"Also called G607V, this variant has been reported as a nonpathogenic polymorphism.",Low,Uncertain,Benign,0.043,Other,Unknown,Heterozygous,10330344;10443680;11159935,rs6339,,chr1,156848946,T,http://evidence.personalgenomes.org/genomes?display_genome_id=6b7fed3a12eb45734150eb86cdfa1a49b4b115ce&access_token=8e4ae29da141ed477b975996d370ecea
TAS2R38-A49P,TAS2R38,"This variant is strongly associated with causing the ""taster"" phenotype of phenylthiocarbamine (PTC) in a dominant manner.",Low,Uncertain,Benign,0.43,Other,Unknown,Heterozygous,12595690;15883422;20675712,rs713598,,chr7,141673345,G,http://evidence.personalgenomes.org/genomes?display_genome_id=6b7fed3a12eb45734150eb86cdfa1a49b4b115ce&access_token=8e4ae29da141ed477b975996d370ecea
RP1-N985Y,RP1,"Probably benign. One report linked this variant to high triglycerides, but a later paper found a nearby SNP with similar association and suggests that both findings are caused by linkage to an undiscovered causal variant.",Low,Uncertain,Benign,0.35,Metabolism,Unknown,Heterozygous,12764676;19364639,rs2293869,,chr8,55539395,T,http://evidence.personalgenomes.org/genomes?display_genome_id=6b7fed3a12eb45734150eb86cdfa1a49b4b115ce&access_token=8e4ae29da141ed477b975996d370ecea
PCSK9-G670E,PCSK9,This variant is likely benign. ,Low,Uncertain,Benign,0.89,Other,Unknown,Homozygous,19351729,rs505151,,chr1,55529187,A,http://evidence.personalgenomes.org/genomes?display_genome_id=6b7fed3a12eb45734150eb86cdfa1a49b4b115ce&access_token=8e4ae29da141ed477b975996d370ecea
SLC45A2-L374F,SLC45A2,"Pigmentation allele for non-black hair, and consequently, possible increased susceptibility to malignant melanoma.",Low,Uncertain,Benign,0.69,Cancer,Unknown,Heterozygous,15714523;17044855;18563784;18806926,rs16891982,,chr5,33951693,G,http://evidence.personalgenomes.org/genomes?display_genome_id=6b7fed3a12eb45734150eb86cdfa1a49b4b115ce&access_token=8e4ae29da141ed477b975996d370ecea
PALB2-E672Q,PALB2,Probably benign.,Low,Uncertain,Benign,0.024,Other,Unknown,Heterozygous,17200668,rs45532440,,chr16,23641461,G,http://evidence.personalgenomes.org/genomes?display_genome_id=6b7fed3a12eb45734150eb86cdfa1a49b4b115ce&access_token=8e4ae29da141ed477b975996d370ecea
TAS2R38-I296V,TAS2R38,"This variant is associated with ""taster"" status of PTC, along with 49P and 262A. Due to linkage disequilibrium, the independent effects of positions 296 and 262 is unclear. The presence of 49P confers taster status in a dominant fashion, but in the absence of 49P, the presence of 262A/296V is still positively associated with tasting PTC.",Low,Uncertain,Benign,0.46,Other,Unknown,Heterozygous,12595690;20675712,rs10246939,,chr7,141672604,C,http://evidence.personalgenomes.org/genomes?display_genome_id=6b7fed3a12eb45734150eb86cdfa1a49b4b115ce&access_token=8e4ae29da141ed477b975996d370ecea
SPTA1-A970D,SPTA1,"This variant, also called alpha-IIa, has been seen frequently in individuals with recessive Hereditary spherocytosis. This appears to be the result of linkage to alpha-LEPRA (a C>T substitution at position -99 of intron 30); A970D is later reported as functionally neutral.",Low,Uncertain,Benign,0.037,Blood,Unknown,Heterozygous,8844207;9067503;15384986;16150946,rs35948326,,chr1,158624528,T,http://evidence.personalgenomes.org/genomes?display_genome_id=6b7fed3a12eb45734150eb86cdfa1a49b4b115ce&access_token=8e4ae29da141ed477b975996d370ecea
PHYH-P29S,PHYH,"Probably benign. This variant was implicated as causing Refsum Disease in a recessive manner, but a subsequent publication noted that all instances were linked with other explanatory mutations. The high allele frequency of this variant in the population (7-13%) contradicts a pathogenic hypothesis.",Low,Uncertain,Benign,0.16,Nervous system,Unknown,Heterozygous,10767344;14974078,rs28938169,0,chr10,13340236,A,http://evidence.personalgenomes.org/genomes?display_genome_id=6b7fed3a12eb45734150eb86cdfa1a49b4b115ce&access_token=8e4ae29da141ed477b975996d370ecea
